strix_halo_bf16_tflops/data/tunableop_results0.csv
Validator,PT_VERSION,2.10.0
Validator,HIP_VERSION,701
Validator,HIPBLASLT_VERSION,100100-f6fa39dccf
Validator,GCN_ARCH_NAME,gfx1151
Validator,ROCBLAS_VERSION,5.1.0.f6fa39dccf
GemmTunableOp_BFloat16_TN,tn_8192_9216_8192_ld_8192_8192_8192,Gemm_Rocblas_-1162085588,56.8604
GemmTunableOp_BFloat16_TN,tn_8192_9216_7168_ld_7168_7168_8192,Default,41.3252
GemmTunableOp_BFloat16_TN,tn_8192_9216_6144_ld_6144_6144_8192,Gemm_Rocblas_-1162085592,41.4449
GemmTunableOp_BFloat16_TN,tn_8192_9216_1024_ld_1024_1024_8192,Gemm_Rocblas_-1162085569,5.39448
GemmTunableOp_BFloat16_TN,tn_7168_9216_13312_ld_13312_13312_7168,Gemm_Rocblas_-1162085575,71.426
GemmTunableOp_BFloat16_TN,tn_7168_9216_10240_ld_10240_10240_7168,Default,63.0679
GemmTunableOp_BFloat16_TN,tn_7168_9216_8192_ld_8192_8192_7168,Gemm_Rocblas_-1162085585,47.7088
GemmTunableOp_BFloat16_TN,tn_7168_9216_7168_ld_7168_7168_7168,Default,35.9142
GemmTunableOp_BFloat16_TN,tn_7168_9216_6144_ld_6144_6144_7168,Gemm_Rocblas_-1162085592,35.9528
GemmTunableOp_BFloat16_TN,tn_7168_9216_4096_ld_4096_4096_7168,Default,24.053
GemmTunableOp_BFloat16_TN,tn_7168_9216_3072_ld_3072_3072_7168,Gemm_Rocblas_-1162085591,14.974
GemmTunableOp_BFloat16_TN,tn_7168_9216_2048_ld_2048_2048_7168,Gemm_Rocblas_-1162085569,10.063
GemmTunableOp_BFloat16_TN,tn_7168_9216_1024_ld_1024_1024_7168,Gemm_Rocblas_-1162085569,4.68034
GemmTunableOp_BFloat16_TN,tn_6144_9216_14336_ld_14336_14336_6144,Gemm_Rocblas_-1162085575,83.9474
GemmTunableOp_BFloat16_TN,tn_6144_9216_13312_ld_13312_13312_6144,Gemm_Rocblas_-1162085575,62.3069
GemmTunableOp_BFloat16_TN,tn_6144_9216_11264_ld_11264_11264_6144,Default,50.9491
GemmTunableOp_BFloat16_TN,tn_6144_9216_8192_ld_8192_8192_6144,Gemm_Rocblas_-1162085591,42.4904
GemmTunableOp_BFloat16_TN,tn_6144_9216_6144_ld_6144_6144_6144,Gemm_Rocblas_-1162085592,31.3677
GemmTunableOp_BFloat16_TN,tn_6144_9216_4096_ld_4096_4096_6144,Gemm_Rocblas_-1162085590,21.1143
GemmTunableOp_BFloat16_TN,tn_6144_9216_3072_ld_3072_3072_6144,Gemm_Rocblas_-1162085592,13.1889
GemmTunableOp_BFloat16_TN,tn_6144_9216_2048_ld_2048_2048_6144,Gemm_Rocblas_-1162085569,8.35103
GemmTunableOp_BFloat16_TN,tn_6144_9216_1024_ld_1024_1024_6144,Gemm_Rocblas_-1162085569,4.10926
GemmTunableOp_BFloat16_TN,tn_5120_9216_10240_ld_10240_10240_5120,Gemm_Rocblas_-1162085592,46.3477
GemmTunableOp_BFloat16_TN,tn_5120_9216_7168_ld_7168_7168_5120,Default,25.742
GemmTunableOp_BFloat16_TN,tn_5120_9216_6144_ld_6144_6144_5120,Default,26.2559
GemmTunableOp_BFloat16_TN,tn_5120_9216_5120_ld_5120_5120_5120,Gemm_Rocblas_-1162085592,18.0831
GemmTunableOp_BFloat16_TN,tn_5120_9216_4096_ld_4096_4096_5120,Gemm_Rocblas_-1162085590,17.4827
GemmTunableOp_BFloat16_TN,tn_5120_9216_2048_ld_2048_2048_5120,Gemm_Rocblas_-1162085569,6.84511
GemmTunableOp_BFloat16_TN,tn_5120_9216_1024_ld_1024_1024_5120,Gemm_Rocblas_-1162085578,3.33926
GemmTunableOp_BFloat16_TN,tn_4096_9216_13312_ld_13312_13312_4096,Gemm_Rocblas_-1162085575,42.1089
GemmTunableOp_BFloat16_TN,tn_4096_9216_11264_ld_11264_11264_4096,Default,34.9983
GemmTunableOp_BFloat16_TN,tn_4096_9216_9216_ld_9216_9216_4096,Default,27.8535
GemmTunableOp_BFloat16_TN,tn_4096_9216_8192_ld_8192_8192_4096,Gemm_Rocblas_-1162085585,29.1366
GemmTunableOp_BFloat16_TN,tn_4096_9216_7168_ld_7168_7168_4096,Default,20.5082
GemmTunableOp_BFloat16_TN,tn_4096_9216_6144_ld_6144_6144_4096,Gemm_Rocblas_-1162085592,21.1612
GemmTunableOp_BFloat16_TN,tn_4096_9216_2048_ld_2048_2048_4096,Gemm_Rocblas_-1162085569,5.59082
GemmTunableOp_BFloat16_TN,tn_4096_9216_1024_ld_1024_1024_4096,Gemm_Rocblas_-1162085569,2.78539
GemmTunableOp_BFloat16_TN,tn_3072_9216_15360_ld_15360_15360_3072,Gemm_Rocblas_-1162085575,37.5371
GemmTunableOp_BFloat16_TN,tn_3072_9216_9216_ld_9216_9216_3072,Gemm_Rocblas_-1162085587,20.5956
GemmTunableOp_BFloat16_TN,tn_3072_9216_8192_ld_8192_8192_3072,Gemm_Rocblas_-1162085585,21.5411
GemmTunableOp_BFloat16_TN,tn_3072_9216_6144_ld_6144_6144_3072,Gemm_Rocblas_-1162085592,16.2375
GemmTunableOp_BFloat16_TN,tn_3072_9216_5120_ld_5120_5120_3072,Gemm_Rocblas_-1162085592,11.1079
GemmTunableOp_BFloat16_TN,tn_3072_9216_2048_ld_2048_2048_3072,Gemm_Rocblas_-1162085569,4.19316
GemmTunableOp_BFloat16_TN,tn_3072_9216_1024_ld_1024_1024_3072,Gemm_Rocblas_-1162085569,2.06583
GemmTunableOp_BFloat16_TN,tn_2048_9216_9216_ld_9216_9216_2048,Gemm_Rocblas_-1162085575,14.5452
GemmTunableOp_BFloat16_TN,tn_2048_9216_7168_ld_7168_7168_2048,Gemm_Rocblas_-1162085592,10.9938
GemmTunableOp_BFloat16_TN,tn_2048_9216_6144_ld_6144_6144_2048,Gemm_Rocblas_-1162085566,9.60894
GemmTunableOp_BFloat16_TN,tn_2048_9216_4096_ld_4096_4096_2048,Gemm_Rocblas_-1162085569,6.29478
GemmTunableOp_BFloat16_TN,tn_1024_9216_15360_ld_15360_15360_1024,Gemm_Rocblas_-1162085566,13.2251
GemmTunableOp_BFloat16_TN,tn_1024_9216_14336_ld_14336_14336_1024,Gemm_Rocblas_-1162085570,16.4625
GemmTunableOp_BFloat16_TN,tn_1024_9216_13312_ld_13312_13312_1024,Gemm_Rocblas_-1162085566,11.3213
GemmTunableOp_BFloat16_TN,tn_1024_9216_7168_ld_7168_7168_1024,Gemm_Rocblas_-1162085580,5.33829
GemmTunableOp_BFloat16_TN,tn_1024_9216_5120_ld_5120_5120_1024,Gemm_Rocblas_-1162085566,3.7622
GemmTunableOp_BFloat16_TN,tn_15360_8192_15360_ld_15360_15360_15360,Gemm_Rocblas_-1162085575,164.05
GemmTunableOp_BFloat16_TN,tn_15360_8192_9216_ld_9216_9216_15360,Gemm_Rocblas_-1162085575,88.5445
GemmTunableOp_BFloat16_TN,tn_15360_8192_8192_ld_8192_8192_15360,Default,89.2656
GemmTunableOp_BFloat16_TN,tn_15360_8192_7168_ld_7168_7168_15360,Gemm_Rocblas_-1162085587,67.0193
GemmTunableOp_BFloat16_TN,tn_15360_8192_6144_ld_6144_6144_15360,Gemm_Rocblas_-1162085592,66.8881
GemmTunableOp_BFloat16_TN,tn_15360_8192_5120_ld_5120_5120_15360,Gemm_Rocblas_-1162085587,47.6474
GemmTunableOp_BFloat16_TN,tn_15360_8192_2048_ld_2048_2048_15360,Gemm_Hipblaslt_502,23.7433
GemmTunableOp_BFloat16_TN,tn_14336_8192_15360_ld_15360_15360_14336,Gemm_Rocblas_-1162085575,151.876
GemmTunableOp_BFloat16_TN,tn_14336_8192_13312_ld_13312_13312_14336,Gemm_Rocblas_-1162085575,128.09
GemmTunableOp_BFloat16_TN,tn_14336_8192_12288_ld_12288_12288_14336,Gemm_Rocblas_-1162085575,142.965
GemmTunableOp_BFloat16_TN,tn_14336_8192_11264_ld_11264_11264_14336,Gemm_Rocblas_-1162085575,107.305
GemmTunableOp_BFloat16_TN,tn_14336_8192_10240_ld_10240_10240_14336,Gemm_Rocblas_-1162085587,109.084
GemmTunableOp_BFloat16_TN,tn_14336_8192_9216_ld_9216_9216_14336,Gemm_Rocblas_-1162085587,83.1461
GemmTunableOp_BFloat16_TN,tn_14336_8192_8192_ld_8192_8192_14336,Gemm_Rocblas_-1162085585,85.1296
GemmTunableOp_BFloat16_TN,tn_14336_8192_7168_ld_7168_7168_14336,Default,62.7257
GemmTunableOp_BFloat16_TN,tn_14336_8192_4096_ld_4096_4096_14336,Gemm_Rocblas_-1162085590,42.3189
GemmTunableOp_BFloat16_TN,tn_14336_8192_3072_ld_3072_3072_14336,Gemm_Rocblas_-1162085590,26.9644
GemmTunableOp_BFloat16_TN,tn_14336_8192_1024_ld_1024_1024_14336,Gemm_Rocblas_-1162085569,8.41011
GemmTunableOp_BFloat16_TN,tn_13312_8192_13312_ld_13312_13312_13312,Gemm_Rocblas_-1162085575,117.58
GemmTunableOp_BFloat16_TN,tn_13312_8192_12288_ld_12288_12288_13312,Gemm_Rocblas_-1162085575,131.63
GemmTunableOp_BFloat16_TN,tn_13312_8192_11264_ld_11264_11264_13312,Gemm_Rocblas_-1162085587,96.9826
GemmTunableOp_BFloat16_TN,tn_13312_8192_9216_ld_9216_9216_13312,Default,76.8024
GemmTunableOp_BFloat16_TN,tn_13312_8192_8192_ld_8192_8192_13312,Default,77.3016
GemmTunableOp_BFloat16_TN,tn_13312_8192_5120_ld_5120_5120_13312,Gemm_Rocblas_-1162085592,41.3278
GemmTunableOp_BFloat16_TN,tn_13312_8192_4096_ld_4096_4096_13312,Gemm_Rocblas_-1162085590,38.4811
GemmTunableOp_BFloat16_TN,tn_13312_8192_3072_ld_3072_3072_13312,Gemm_Rocblas_-1162085590,24.7466
GemmTunableOp_BFloat16_TN,tn_13312_8192_1024_ld_1024_1024_13312,Gemm_Rocblas_-1162085569,7.70711
GemmTunableOp_BFloat16_TN,tn_12288_8192_14336_ld_14336_14336_12288,Gemm_Rocblas_-1162085581,147.545
GemmTunableOp_BFloat16_TN,tn_12288_8192_11264_ld_11264_11264_12288,Gemm_Rocblas_-1162085575,91.7598
GemmTunableOp_BFloat16_TN,tn_12288_8192_3072_ld_3072_3072_12288,Gemm_Rocblas_-1162085592,22.4949
GemmTunableOp_BFloat16_TN,tn_11264_8192_15360_ld_15360_15360_11264,Gemm_Rocblas_-1162085575,122.095
GemmTunableOp_BFloat16_TN,tn_11264_8192_14336_ld_14336_14336_11264,Gemm_Rocblas_-1162085575,132.997
GemmTunableOp_BFloat16_TN,tn_11264_8192_12288_ld_12288_12288_11264,Gemm_Rocblas_-1162085575,112.262
GemmTunableOp_BFloat16_TN,tn_11264_8192_11264_ld_11264_11264_11264,Gemm_Rocblas_-1162085587,83.2283
GemmTunableOp_BFloat16_TN,tn_11264_8192_10240_ld_10240_10240_11264,Default,85.2265
GemmTunableOp_BFloat16_TN,tn_1024_9216_1024_ld_1024_1024_1024,Gemm_Rocblas_-1162085578,0.684659
GemmTunableOp_BFloat16_TN,tn_11264_8192_9216_ld_9216_9216_11264,Default,65.5987
GemmTunableOp_BFloat16_TN,tn_11264_8192_6144_ld_6144_6144_11264,Gemm_Rocblas_-1162085592,49.1202
GemmTunableOp_BFloat16_TN,tn_11264_8192_5120_ld_5120_5120_11264,Gemm_Rocblas_-1162085587,34.682
GemmTunableOp_BFloat16_TN,tn_12288_8192_1024_ld_1024_1024_12288,Gemm_Rocblas_-1162085569,7.12427
GemmTunableOp_BFloat16_TN,tn_11264_8192_4096_ld_4096_4096_11264,Gemm_Rocblas_-1162085592,32.5922
GemmTunableOp_BFloat16_TN,tn_11264_8192_3072_ld_3072_3072_11264,Gemm_Rocblas_-1162085592,20.7087
GemmTunableOp_BFloat16_TN,tn_10240_8192_14336_ld_14336_14336_10240,Gemm_Rocblas_-1162085580,122.692
GemmTunableOp_BFloat16_TN,tn_10240_8192_13312_ld_13312_13312_10240,Gemm_Rocblas_-1162085580,91.8919
GemmTunableOp_BFloat16_TN,tn_10240_8192_11264_ld_11264_11264_10240,Gemm_Rocblas_-1162085575,77.1178
GemmTunableOp_BFloat16_TN,tn_10240_8192_9216_ld_9216_9216_10240,Default,59.8549
GemmTunableOp_BFloat16_TN,tn_10240_8192_7168_ld_7168_7168_10240,Default,43.9393
GemmTunableOp_BFloat16_TN,tn_10240_8192_6144_ld_6144_6144_10240,Gemm_Rocblas_-1162085592,46.1657
GemmTunableOp_BFloat16_TN,tn_10240_8192_5120_ld_5120_5120_10240,Default,31.7722
GemmTunableOp_BFloat16_TN,tn_10240_8192_3072_ld_3072_3072_10240,Gemm_Rocblas_-1162085592,19.2271
GemmTunableOp_BFloat16_TN,tn_10240_8192_1024_ld_1024_1024_10240,Gemm_Rocblas_-1162085569,6.15428
GemmTunableOp_BFloat16_TN,tn_9216_8192_14336_ld_14336_14336_9216,Gemm_Rocblas_-1162085581,110.432
GemmTunableOp_BFloat16_TN,tn_9216_8192_13312_ld_13312_13312_9216,Gemm_Rocblas_-1162085575,82.9554
GemmTunableOp_BFloat16_TN,tn_9216_8192_10240_ld_10240_10240_9216,Gemm_Rocblas_-1162085587,71.0015
GemmTunableOp_BFloat16_TN,tn_9216_8192_8192_ld_8192_8192_9216,Gemm_Rocblas_-1162085584,54.3594
GemmTunableOp_BFloat16_TN,tn_9216_8192_6144_ld_6144_6144_9216,Gemm_Rocblas_-1162085592,40.7556
GemmTunableOp_BFloat16_TN,tn_12288_8192_12288_ld_12288_12288_12288,Gemm_Rocblas_-1162085575,123.59
GemmTunableOp_BFloat16_TN,tn_9216_8192_5120_ld_5120_5120_9216,Default,28.9523
GemmTunableOp_BFloat16_TN,tn_9216_8192_4096_ld_4096_4096_9216,Gemm_Rocblas_-1162085590,26.4896
GemmTunableOp_BFloat16_TN,tn_9216_8192_2048_ld_2048_2048_9216,Gemm_Hipblaslt_502,14.3403
GemmTunableOp_BFloat16_TN,tn_9216_8192_1024_ld_1024_1024_9216,Gemm_Rocblas_-1162085569,5.37752
GemmTunableOp_BFloat16_TN,tn_8192_8192_10240_ld_10240_10240_8192,Default,63.3775
GemmTunableOp_BFloat16_TN,tn_8192_8192_8192_ld_8192_8192_8192,Gemm_Rocblas_-1162085588,50.8605
GemmTunableOp_BFloat16_TN,tn_8192_8192_5120_ld_5120_5120_8192,Gemm_Rocblas_-1162085592,25.677
GemmTunableOp_BFloat16_TN,tn_8192_8192_4096_ld_4096_4096_8192,Gemm_Rocblas_-1162085591,24.1883
GemmTunableOp_BFloat16_TN,tn_15360_8192_14336_ld_14336_14336_15360,Gemm_Rocblas_-1162085575,179.924
GemmTunableOp_BFloat16_TN,tn_8192_8192_3072_ld_3072_3072_8192,Gemm_Rocblas_-1162085588,15.5914
GemmTunableOp_BFloat16_TN,tn_8192_8192_2048_ld_2048_2048_8192,Gemm_Rocblas_-1162085569,11.8908
GemmTunableOp_BFloat16_TN,tn_7168_8192_8192_ld_8192_8192_7168,Default,42.8203
GemmTunableOp_BFloat16_TN,tn_7168_8192_6144_ld_6144_6144_7168,Gemm_Rocblas_-1162085592,31.564
GemmTunableOp_BFloat16_TN,tn_7168_8192_3072_ld_3072_3072_7168,Gemm_Rocblas_-1162085588,13.3573
GemmTunableOp_BFloat16_TN,tn_6144_8192_15360_ld_15360_15360_6144,Gemm_Rocblas_-1162085575,66.9894
GemmTunableOp_BFloat16_TN,tn_6144_8192_13312_ld_13312_13312_6144,Gemm_Rocblas_-1162085575,55.2785
GemmTunableOp_BFloat16_TN,tn_6144_8192_11264_ld_11264_11264_6144,Default,45.9966
GemmTunableOp_BFloat16_TN,tn_6144_8192_10240_ld_10240_10240_6144,Default,49.5454
GemmTunableOp_BFloat16_TN,tn_6144_8192_9216_ld_9216_9216_6144,Default,36.3446
GemmTunableOp_BFloat16_TN,tn_6144_8192_7168_ld_7168_7168_6144,Gemm_Rocblas_-1162085587,27.6129
GemmTunableOp_BFloat16_TN,tn_6144_8192_5120_ld_5120_5120_6144,Default,19.6125
GemmTunableOp_BFloat16_TN,tn_5120_8192_15360_ld_15360_15360_5120,Gemm_Rocblas_-1162085580,56.4892
GemmTunableOp_BFloat16_TN,tn_5120_8192_13312_ld_13312_13312_5120,Gemm_Rocblas_-1162085587,47.7059
GemmTunableOp_BFloat16_TN,tn_5120_8192_11264_ld_11264_11264_5120,Default,39.2303
GemmTunableOp_BFloat16_TN,tn_5120_8192_9216_ld_9216_9216_5120,Default,29.7768
GemmTunableOp_BFloat16_TN,tn_5120_8192_7168_ld_7168_7168_5120,Gemm_Rocblas_-1162085587,22.0683
GemmTunableOp_BFloat16_TN,tn_5120_8192_6144_ld_6144_6144_5120,Default,23.1027
GemmTunableOp_BFloat16_TN,tn_9216_8192_9216_ld_9216_9216_9216,Default,52.5205
GemmTunableOp_BFloat16_TN,tn_5120_8192_5120_ld_5120_5120_5120,Gemm_Rocblas_-1162085592,15.9175
GemmTunableOp_BFloat16_TN,tn_4096_8192_15360_ld_15360_15360_4096,Gemm_Rocblas_-1162085575,44.263
GemmTunableOp_BFloat16_TN,tn_4096_8192_14336_ld_14336_14336_4096,Gemm_Rocblas_-1162085575,53.9611
GemmTunableOp_BFloat16_TN,tn_4096_8192_11264_ld_11264_11264_4096,Default,31.8688
GemmTunableOp_BFloat16_TN,tn_4096_8192_10240_ld_10240_10240_4096,Default,32.877
GemmTunableOp_BFloat16_TN,tn_4096_8192_9216_ld_9216_9216_4096,Gemm_Rocblas_-1162085587,24.7154
GemmTunableOp_BFloat16_TN,tn_4096_8192_7168_ld_7168_7168_4096,Gemm_Rocblas_-1162085587,18.6665
GemmTunableOp_BFloat16_TN,tn_4096_8192_3072_ld_3072_3072_4096,Gemm_Rocblas_-1162085576,7.39339
GemmTunableOp_BFloat16_TN,tn_3072_8192_14336_ld_14336_14336_3072,Gemm_Rocblas_-1162085581,40.0488
GemmTunableOp_BFloat16_TN,tn_3072_8192_13312_ld_13312_13312_3072,Gemm_Rocblas_-1162085592,28.7943
GemmTunableOp_BFloat16_TN,tn_3072_8192_12288_ld_12288_12288_3072,Gemm_Rocblas_-1162085575,33.6895
GemmTunableOp_BFloat16_TN,tn_3072_8192_10240_ld_10240_10240_3072,Gemm_Rocblas_-1162085592,25.7344
GemmTunableOp_BFloat16_TN,tn_3072_8192_9216_ld_9216_9216_3072,Gemm_Rocblas_-1162085592,18.9563
GemmTunableOp_BFloat16_TN,tn_3072_8192_7168_ld_7168_7168_3072,Gemm_Rocblas_-1162085592,13.4906
GemmTunableOp_BFloat16_TN,tn_3072_8192_6144_ld_6144_6144_3072,Gemm_Rocblas_-1162085592,14.1705
GemmTunableOp_BFloat16_TN,tn_3072_8192_5120_ld_5120_5120_3072,Gemm_Rocblas_-1162085587,9.84421
GemmTunableOp_BFloat16_TN,tn_2048_8192_14336_ld_14336_14336_2048,Gemm_Rocblas_-1162085572,29.1554
GemmTunableOp_BFloat16_TN,tn_2048_8192_13312_ld_13312_13312_2048,Gemm_Rocblas_-1162085592,19.9468
GemmTunableOp_BFloat16_TN,tn_2048_8192_11264_ld_11264_11264_2048,Gemm_Rocblas_-1162085587,16.6257
GemmTunableOp_BFloat16_TN,tn_2048_8192_9216_ld_9216_9216_2048,Gemm_Rocblas_-1162085575,12.9026
GemmTunableOp_BFloat16_TN,tn_2048_8192_5120_ld_5120_5120_2048,Gemm_Rocblas_-1162085578,6.4945
GemmTunableOp_BFloat16_TN,tn_2048_8192_1024_ld_1024_1024_2048,Gemm_Rocblas_-1162085569,1.24268
GemmTunableOp_BFloat16_TN,tn_1024_8192_14336_ld_14336_14336_1024,Gemm_Rocblas_-1162085570,14.4359
GemmTunableOp_BFloat16_TN,tn_1024_8192_13312_ld_13312_13312_1024,Gemm_Rocblas_-1162085575,10.0553
GemmTunableOp_BFloat16_TN,tn_1024_8192_11264_ld_11264_11264_1024,Gemm_Rocblas_-1162085566,8.10633
GemmTunableOp_BFloat16_TN,tn_1024_8192_8192_ld_8192_8192_1024,Gemm_Rocblas_-1162085569,5.83915
GemmTunableOp_BFloat16_TN,tn_1024_8192_7168_ld_7168_7168_1024,Gemm_Rocblas_-1162085580,4.74888
GemmTunableOp_BFloat16_TN,tn_1024_8192_6144_ld_6144_6144_1024,Gemm_Rocblas_-1162085566,4.67835
GemmTunableOp_BFloat16_TN,tn_1024_8192_5120_ld_5120_5120_1024,Gemm_Rocblas_-1162085578,3.2346
GemmTunableOp_BFloat16_TN,tn_1024_8192_3072_ld_3072_3072_1024,Gemm_Rocblas_-1162085570,1.8628
GemmTunableOp_BFloat16_TN,tn_15360_7168_11264_ld_11264_11264_15360,Default,99.7121
GemmTunableOp_BFloat16_TN,tn_15360_8192_3072_ld_3072_3072_15360,Gemm_Rocblas_-1162085592,28.4387
GemmTunableOp_BFloat16_TN,tn_3072_8192_1024_ld_1024_1024_3072,Gemm_Rocblas_-1162085569,1.84573
GemmTunableOp_BFloat16_TN,tn_15360_7168_10240_ld_10240_10240_15360,Gemm_Rocblas_-1162085587,101.523
GemmTunableOp_BFloat16_TN,tn_15360_7168_8192_ld_8192_8192_15360,Gemm_Rocblas_-1162085591,78.0648
GemmTunableOp_BFloat16_TN,tn_15360_7168_6144_ld_6144_6144_15360,Gemm_Rocblas_-1162085592,58.4018
GemmTunableOp_BFloat16_TN,tn_15360_7168_5120_ld_5120_5120_15360,Default,41.5952
GemmTunableOp_BFloat16_TN,tn_15360_7168_4096_ld_4096_4096_15360,Gemm_Rocblas_-1162085590,39.0184
GemmTunableOp_BFloat16_TN,tn_14336_7168_15360_ld_15360_15360_14336,Gemm_Rocblas_-1162085575,131.876
GemmTunableOp_BFloat16_TN,tn_14336_7168_14336_ld_14336_14336_14336,Gemm_Rocblas_-1162085581,150.142
GemmTunableOp_BFloat16_TN,tn_14336_7168_5120_ld_5120_5120_14336,Default,38.9953
GemmTunableOp_BFloat16_TN,tn_13312_7168_11264_ld_11264_11264_13312,Gemm_Rocblas_-1162085575,84.2404
GemmTunableOp_BFloat16_TN,tn_13312_7168_10240_ld_10240_10240_13312,Gemm_Rocblas_-1162085587,86.0608
GemmTunableOp_BFloat16_TN,tn_13312_7168_8192_ld_8192_8192_13312,Default,67.9807
GemmTunableOp_BFloat16_TN,tn_13312_7168_7168_ld_7168_7168_13312,Default,50.8
GemmTunableOp_BFloat16_TN,tn_13312_7168_3072_ld_3072_3072_13312,Gemm_Rocblas_-1162085591,21.5184
GemmTunableOp_BFloat16_TN,tn_13312_7168_2048_ld_2048_2048_13312,Gemm_Hipblaslt_502,18.0967
GemmTunableOp_BFloat16_TN,tn_12288_7168_14336_ld_14336_14336_12288,Gemm_Rocblas_-1162085575,127.931
GemmTunableOp_BFloat16_TN,tn_12288_7168_12288_ld_12288_12288_12288,Gemm_Rocblas_-1162085575,105.653
GemmTunableOp_BFloat16_TN,tn_8192_8192_9216_ld_9216_9216_8192,Default,47.8152
GemmTunableOp_BFloat16_TN,tn_12288_7168_11264_ld_11264_11264_12288,Default,78.0602
GemmTunableOp_BFloat16_TN,tn_12288_7168_10240_ld_10240_10240_12288,Default,81.9789
GemmTunableOp_BFloat16_TN,tn_12288_7168_8192_ld_8192_8192_12288,Gemm_Rocblas_-1162085591,64.6865
GemmTunableOp_BFloat16_TN,tn_12288_7168_6144_ld_6144_6144_12288,Gemm_Rocblas_-1162085592,47.6606
GemmTunableOp_BFloat16_TN,tn_12288_7168_4096_ld_4096_4096_12288,Gemm_Rocblas_-1162085590,32.8006
GemmTunableOp_BFloat16_TN,tn_12288_7168_3072_ld_3072_3072_12288,Gemm_Rocblas_-1162085590,20.1917
GemmTunableOp_BFloat16_TN,tn_12288_7168_2048_ld_2048_2048_12288,Gemm_Hipblaslt_503,17.2307
GemmTunableOp_BFloat16_TN,tn_12288_7168_1024_ld_1024_1024_12288,Gemm_Rocblas_-1162085569,6.28432
GemmTunableOp_BFloat16_TN,tn_5120_9216_15360_ld_15360_15360_5120,Gemm_Rocblas_-1162085580,63.2995
GemmTunableOp_BFloat16_TN,tn_11264_7168_13312_ld_13312_13312_11264,Gemm_Rocblas_-1162085580,85.5693
GemmTunableOp_BFloat16_TN,tn_11264_7168_11264_ld_11264_11264_11264,Gemm_Rocblas_-1162085587,72.9948
GemmTunableOp_BFloat16_TN,tn_11264_7168_10240_ld_10240_10240_11264,Default,75.2909
GemmTunableOp_BFloat16_TN,tn_2048_8192_8192_ld_8192_8192_2048,Gemm_Rocblas_-1162085588,13.831
GemmTunableOp_BFloat16_TN,tn_11264_7168_7168_ld_7168_7168_11264,Default,43.246
GemmTunableOp_BFloat16_TN,tn_11264_7168_6144_ld_6144_6144_11264,Gemm_Rocblas_-1162085592,43.2476
GemmTunableOp_BFloat16_TN,tn_2048_8192_3072_ld_3072_3072_2048,Gemm_Rocblas_-1162085578,3.74645
GemmTunableOp_BFloat16_TN,tn_11264_7168_3072_ld_3072_3072_11264,Gemm_Rocblas_-1162085590,18.1047
GemmTunableOp_BFloat16_TN,tn_10240_7168_15360_ld_15360_15360_10240,Gemm_Rocblas_-1162085575,97.1418
GemmTunableOp_BFloat16_TN,tn_10240_7168_10240_ld_10240_10240_10240,Gemm_Rocblas_-1162085587,69.5429
GemmTunableOp_BFloat16_TN,tn_1024_8192_12288_ld_12288_12288_1024,Gemm_Rocblas_-1162085566,10.9163
GemmTunableOp_BFloat16_TN,tn_10240_7168_9216_ld_9216_9216_10240,Gemm_Rocblas_-1162085587,52.1832
GemmTunableOp_BFloat16_TN,tn_10240_7168_8192_ld_8192_8192_10240,Gemm_Rocblas_-1162085591,53.4146
GemmTunableOp_BFloat16_TN,tn_10240_7168_6144_ld_6144_6144_10240,Gemm_Rocblas_-1162085587,40.3357
GemmTunableOp_BFloat16_TN,tn_10240_7168_5120_ld_5120_5120_10240,Default,28.2174
GemmTunableOp_BFloat16_TN,tn_10240_7168_4096_ld_4096_4096_10240,Gemm_Rocblas_-1162085588,26.9198
GemmTunableOp_BFloat16_TN,tn_10240_7168_3072_ld_3072_3072_10240,Gemm_Rocblas_-1162085592,16.727
GemmTunableOp_BFloat16_TN,tn_10240_7168_2048_ld_2048_2048_10240,Gemm_Hipblaslt_502,14.3551
GemmTunableOp_BFloat16_TN,tn_10240_7168_1024_ld_1024_1024_10240,Gemm_Rocblas_-1162085569,5.33002
GemmTunableOp_BFloat16_TN,tn_9216_7168_15360_ld_15360_15360_9216,Gemm_Rocblas_-1162085575,87.1387
GemmTunableOp_BFloat16_TN,tn_9216_7168_14336_ld_14336_14336_9216,Gemm_Rocblas_-1162085575,95.6715
GemmTunableOp_BFloat16_TN,tn_9216_7168_13312_ld_13312_13312_9216,Gemm_Rocblas_-1162085575,70.9814
GemmTunableOp_BFloat16_TN,tn_9216_7168_11264_ld_11264_11264_9216,Default,59.5484
GemmTunableOp_BFloat16_TN,tn_9216_7168_6144_ld_6144_6144_9216,Gemm_Rocblas_-1162085592,35.5128
GemmTunableOp_BFloat16_TN,tn_9216_7168_3072_ld_3072_3072_9216,Gemm_Rocblas_-1162085590,15.0679
GemmTunableOp_BFloat16_TN,tn_9216_7168_2048_ld_2048_2048_9216,Gemm_Hipblaslt_502,12.5934
GemmTunableOp_BFloat16_TN,tn_9216_7168_1024_ld_1024_1024_9216,Gemm_Rocblas_-1162085569,4.63587
GemmTunableOp_BFloat16_TN,tn_8192_7168_14336_ld_14336_14336_8192,Gemm_Rocblas_-1162085575,85.8662
GemmTunableOp_BFloat16_TN,tn_15360_7168_1024_ld_1024_1024_15360,Gemm_Rocblas_-1162085569,8.09432
GemmTunableOp_BFloat16_TN,tn_8192_7168_13312_ld_13312_13312_8192,Gemm_Rocblas_-1162085575,62.7502
GemmTunableOp_BFloat16_TN,tn_8192_7168_11264_ld_11264_11264_8192,Default,54.3138
GemmTunableOp_BFloat16_TN,tn_8192_7168_8192_ld_8192_8192_8192,Gemm_Rocblas_-1162085590,44.2542
GemmTunableOp_BFloat16_TN,tn_8192_7168_6144_ld_6144_6144_8192,Gemm_Rocblas_-1162085592,31.9656
GemmTunableOp_BFloat16_TN,tn_8192_7168_3072_ld_3072_3072_8192,Gemm_Rocblas_-1162085592,13.4671
GemmTunableOp_BFloat16_TN,tn_2048_8192_12288_ld_12288_12288_2048,Gemm_Rocblas_-1162085587,23.7023
GemmTunableOp_BFloat16_TN,tn_8192_7168_2048_ld_2048_2048_8192,Gemm_Rocblas_-1162085569,10.4017
GemmTunableOp_BFloat16_TN,tn_7168_7168_15360_ld_15360_15360_7168,Gemm_Rocblas_-1162085575,66.7478
GemmTunableOp_BFloat16_TN,tn_9216_8192_15360_ld_15360_15360_9216,Gemm_Rocblas_-1162085575,98.6549
GemmTunableOp_BFloat16_TN,tn_7168_7168_13312_ld_13312_13312_7168,Gemm_Rocblas_-1162085587,57.0184
GemmTunableOp_BFloat16_TN,tn_7168_7168_10240_ld_10240_10240_7168,Default,47.7404
GemmTunableOp_BFloat16_TN,tn_7168_7168_8192_ld_8192_8192_7168,Gemm_Rocblas_-1162085591,37.2118
GemmTunableOp_BFloat16_TN,tn_10240_8192_2048_ld_2048_2048_10240,Gemm_Hipblaslt_502,15.8754
GemmTunableOp_BFloat16_TN,tn_7168_7168_4096_ld_4096_4096_7168,Gemm_Rocblas_-1162085592,18.6981
GemmTunableOp_BFloat16_TN,tn_14336_7168_9216_ld_9216_9216_14336,Gemm_Rocblas_-1162085587,72.355
GemmTunableOp_BFloat16_TN,tn_7168_7168_14336_ld_14336_14336_7168,Gemm_Rocblas_-1162085580,79.5995
GemmTunableOp_BFloat16_TN,tn_7168_7168_1024_ld_1024_1024_7168,Gemm_Rocblas_-1162085567,3.71675
GemmTunableOp_BFloat16_TN,tn_6144_7168_14336_ld_14336_14336_6144,Gemm_Rocblas_-1162085580,71.1554
GemmTunableOp_BFloat16_TN,tn_7168_9216_9216_ld_9216_9216_7168,Default,46.6405
GemmTunableOp_BFloat16_TN,tn_3072_9216_4096_ld_4096_4096_3072,Gemm_Rocblas_-1162085569,8.98414
GemmTunableOp_BFloat16_TN,tn_6144_7168_12288_ld_12288_12288_6144,Gemm_Rocblas_-1162085580,56.0034
GemmTunableOp_BFloat16_TN,tn_6144_8192_4096_ld_4096_4096_6144,Gemm_Rocblas_-1162085591,18.6485
GemmTunableOp_BFloat16_TN,tn_6144_7168_11264_ld_11264_11264_6144,Gemm_Rocblas_-1162085575,40.3731
GemmTunableOp_BFloat16_TN,tn_6144_7168_10240_ld_10240_10240_6144,Gemm_Rocblas_-1162085587,43.2001
GemmTunableOp_BFloat16_TN,tn_6144_7168_4096_ld_4096_4096_6144,Gemm_Rocblas_-1162085590,16.589
GemmTunableOp_BFloat16_TN,tn_1024_9216_2048_ld_2048_2048_1024,Gemm_Rocblas_-1162085569,1.58539
GemmTunableOp_BFloat16_TN,tn_5120_7168_15360_ld_15360_15360_5120,Gemm_Rocblas_-1162085580,48.8181
GemmTunableOp_BFloat16_TN,tn_5120_7168_13312_ld_13312_13312_5120,Gemm_Rocblas_-1162085580,40.794
GemmTunableOp_BFloat16_TN,tn_5120_7168_11264_ld_11264_11264_5120,Default,33.8921
GemmTunableOp_BFloat16_TN,tn_7168_8192_11264_ld_11264_11264_7168,Gemm_Rocblas_-1162085575,54.1242
GemmTunableOp_BFloat16_TN,tn_5120_7168_10240_ld_10240_10240_5120,Default,35.9887
GemmTunableOp_BFloat16_TN,tn_5120_7168_8192_ld_8192_8192_5120,Gemm_Rocblas_-1162085582,27.4528
GemmTunableOp_BFloat16_TN,tn_5120_7168_6144_ld_6144_6144_5120,Default,20.0096
GemmTunableOp_BFloat16_TN,tn_5120_7168_4096_ld_4096_4096_5120,Gemm_Rocblas_-1162085590,13.603
GemmTunableOp_BFloat16_TN,tn_5120_7168_2048_ld_2048_2048_5120,Gemm_Rocblas_-1162085569,5.3577
GemmTunableOp_BFloat16_TN,tn_4096_7168_14336_ld_14336_14336_4096,Gemm_Rocblas_-1162085575,46.1913
GemmTunableOp_BFloat16_TN,tn_4096_7168_11264_ld_11264_11264_4096,Default,28.09
GemmTunableOp_BFloat16_TN,tn_4096_7168_10240_ld_10240_10240_4096,Default,29.9104
GemmTunableOp_BFloat16_TN,tn_4096_7168_9216_ld_9216_9216_4096,Gemm_Rocblas_-1162085587,21.7426
GemmTunableOp_BFloat16_TN,tn_4096_7168_8192_ld_8192_8192_4096,Gemm_Rocblas_-1162085585,22.6713
GemmTunableOp_BFloat16_TN,tn_4096_7168_7168_ld_7168_7168_4096,Default,15.8351
GemmTunableOp_BFloat16_TN,tn_4096_7168_5120_ld_5120_5120_4096,Default,11.52
GemmTunableOp_BFloat16_TN,tn_4096_7168_2048_ld_2048_2048_4096,Gemm_Rocblas_-1162085569,4.33823
GemmTunableOp_BFloat16_TN,tn_3072_7168_12288_ld_12288_12288_3072,Gemm_Rocblas_-1162085575,29.2084
GemmTunableOp_BFloat16_TN,tn_7168_7168_5120_ld_5120_5120_7168,Default,19.5131
GemmTunableOp_BFloat16_TN,tn_3072_7168_11264_ld_11264_11264_3072,Gemm_Rocblas_-1162085580,20.9311
GemmTunableOp_BFloat16_TN,tn_3072_7168_10240_ld_10240_10240_3072,Gemm_Rocblas_-1162085592,22.5955
GemmTunableOp_BFloat16_TN,tn_3072_7168_9216_ld_9216_9216_3072,Gemm_Rocblas_-1162085587,16.2899
GemmTunableOp_BFloat16_TN,tn_3072_7168_6144_ld_6144_6144_3072,Gemm_Rocblas_-1162085592,12.9457
GemmTunableOp_BFloat16_TN,tn_3072_7168_3072_ld_3072_3072_3072,Default,4.75751
GemmTunableOp_BFloat16_TN,tn_2048_7168_13312_ld_13312_13312_2048,Gemm_Rocblas_-1162085573,16.8504
GemmTunableOp_BFloat16_TN,tn_3072_9216_10240_ld_10240_10240_3072,Gemm_Rocblas_-1162085592,28.8618
GemmTunableOp_BFloat16_TN,tn_2048_7168_11264_ld_11264_11264_2048,Gemm_Rocblas_-1162085587,14.4817
GemmTunableOp_BFloat16_TN,tn_2048_7168_6144_ld_6144_6144_2048,Gemm_Rocblas_-1162085566,7.65
GemmTunableOp_BFloat16_TN,tn_15360_8192_10240_ld_10240_10240_15360,Gemm_Rocblas_-1162085587,115.462
GemmTunableOp_BFloat16_TN,tn_2048_7168_1024_ld_1024_1024_2048,Gemm_Rocblas_-1162085567,1.07992
GemmTunableOp_BFloat16_TN,tn_1024_7168_12288_ld_12288_12288_1024,Gemm_Rocblas_-1162085566,9.4834
GemmTunableOp_BFloat16_TN,tn_1024_7168_8192_ld_8192_8192_1024,Gemm_Rocblas_-1162085569,5.39273
GemmTunableOp_BFloat16_TN,tn_2048_7168_7168_ld_7168_7168_2048,Gemm_Rocblas_-1162085566,8.12192
GemmTunableOp_BFloat16_TN,tn_1024_7168_7168_ld_7168_7168_1024,Gemm_Rocblas_-1162085579,4.17457
GemmTunableOp_BFloat16_TN,tn_1024_7168_4096_ld_4096_4096_1024,Gemm_Rocblas_-1162085569,2.52246
GemmTunableOp_BFloat16_TN,tn_1024_7168_2048_ld_2048_2048_1024,Gemm_Rocblas_-1162085569,1.24463
GemmTunableOp_BFloat16_TN,tn_1024_7168_1024_ld_1024_1024_1024,Gemm_Rocblas_-1162085578,0.522736
GemmTunableOp_BFloat16_TN,tn_15360_6144_14336_ld_14336_14336_15360,Gemm_Rocblas_-1162085581,140.391
GemmTunableOp_BFloat16_TN,tn_15360_6144_12288_ld_12288_12288_15360,Gemm_Rocblas_-1162085575,114.541
GemmTunableOp_BFloat16_TN,tn_15360_6144_10240_ld_10240_10240_15360,Default,86.8977
GemmTunableOp_BFloat16_TN,tn_15360_6144_8192_ld_8192_8192_15360,Gemm_Rocblas_-1162085592,66.5561
GemmTunableOp_BFloat16_TN,tn_11264_7168_1024_ld_1024_1024_11264,Gemm_Rocblas_-1162085569,5.70463
GemmTunableOp_BFloat16_TN,tn_15360_6144_6144_ld_6144_6144_15360,Gemm_Rocblas_-1162085592,49.9872
GemmTunableOp_BFloat16_TN,tn_15360_6144_5120_ld_5120_5120_15360,Default,35.8079
GemmTunableOp_BFloat16_TN,tn_15360_6144_2048_ld_2048_2048_15360,Gemm_Hipblaslt_502,17.6601
GemmTunableOp_BFloat16_TN,tn_4096_9216_14336_ld_14336_14336_4096,Gemm_Rocblas_-1162085581,60.4976
GemmTunableOp_BFloat16_TN,tn_15360_6144_1024_ld_1024_1024_15360,Gemm_Rocblas_-1162085569,6.90208
GemmTunableOp_BFloat16_TN,tn_14336_6144_13312_ld_13312_13312_14336,Gemm_Rocblas_-1162085580,96.1147
GemmTunableOp_BFloat16_TN,tn_14336_6144_12288_ld_12288_12288_14336,Gemm_Rocblas_-1162085587,106.634
GemmTunableOp_BFloat16_TN,tn_14336_6144_11264_ld_11264_11264_14336,Gemm_Rocblas_-1162085587,77.1953
GemmTunableOp_BFloat16_TN,tn_14336_6144_10240_ld_10240_10240_14336,Gemm_Rocblas_-1162085587,81.5437
GemmTunableOp_BFloat16_TN,tn_2048_7168_5120_ld_5120_5120_2048,Gemm_Rocblas_-1162085580,5.58512
GemmTunableOp_BFloat16_TN,tn_14336_6144_8192_ld_8192_8192_14336,Gemm_Rocblas_-1162085590,63.5149
GemmTunableOp_BFloat16_TN,tn_14336_6144_5120_ld_5120_5120_14336,Gemm_Rocblas_-1162085592,33.3104
GemmTunableOp_BFloat16_TN,tn_13312_6144_13312_ld_13312_13312_13312,Gemm_Rocblas_-1162085575,88.5813
GemmTunableOp_BFloat16_TN,tn_13312_6144_12288_ld_12288_12288_13312,Gemm_Rocblas_-1162085575,99.205
GemmTunableOp_BFloat16_TN,tn_8192_8192_1024_ld_1024_1024_8192,Gemm_Rocblas_-1162085569,4.85175
GemmTunableOp_BFloat16_TN,tn_13312_6144_11264_ld_11264_11264_13312,Gemm_Rocblas_-1162085592,73.7884
GemmTunableOp_BFloat16_TN,tn_13312_6144_10240_ld_10240_10240_13312,Gemm_Rocblas_-1162085587,75.58
GemmTunableOp_BFloat16_TN,tn_13312_6144_9216_ld_9216_9216_13312,Default,56.866
GemmTunableOp_BFloat16_TN,tn_13312_6144_5120_ld_5120_5120_13312,Default,31.0995
GemmTunableOp_BFloat16_TN,tn_13312_6144_3072_ld_3072_3072_13312,Gemm_Rocblas_-1162085590,18.3904
GemmTunableOp_BFloat16_TN,tn_12288_6144_15360_ld_15360_15360_12288,Gemm_Rocblas_-1162085580,100.409
GemmTunableOp_BFloat16_TN,tn_12288_6144_12288_ld_12288_12288_12288,Default,92.226
GemmTunableOp_BFloat16_TN,tn_12288_6144_11264_ld_11264_11264_12288,Gemm_Rocblas_-1162085575,68.7096
GemmTunableOp_BFloat16_TN,tn_12288_6144_10240_ld_10240_10240_12288,Default,70.9426
GemmTunableOp_BFloat16_TN,tn_12288_6144_9216_ld_9216_9216_12288,Default,51.22
GemmTunableOp_BFloat16_TN,tn_5120_7168_1024_ld_1024_1024_5120,Gemm_Rocblas_-1162085578,2.63577
GemmTunableOp_BFloat16_TN,tn_12288_6144_6144_ld_6144_6144_12288,Gemm_Rocblas_-1162085592,40.598
GemmTunableOp_BFloat16_TN,tn_12288_6144_5120_ld_5120_5120_12288,Gemm_Rocblas_-1162085592,28.7633
GemmTunableOp_BFloat16_TN,tn_12288_6144_2048_ld_2048_2048_12288,Gemm_Hipblaslt_502,14.3253
GemmTunableOp_BFloat16_TN,tn_14336_7168_8192_ld_8192_8192_14336,Gemm_Rocblas_-1162085582,74.2759
GemmTunableOp_BFloat16_TN,tn_15360_6144_11264_ld_11264_11264_15360,Default,83.2373
GemmTunableOp_BFloat16_TN,tn_11264_6144_15360_ld_15360_15360_11264,Gemm_Rocblas_-1162085580,89.7715
GemmTunableOp_BFloat16_TN,tn_7168_8192_9216_ld_9216_9216_7168,Default,42.4286
GemmTunableOp_BFloat16_TN,tn_11264_6144_13312_ld_13312_13312_11264,Gemm_Rocblas_-1162085575,75.8141
GemmTunableOp_BFloat16_TN,tn_11264_6144_10240_ld_10240_10240_11264,Gemm_Rocblas_-1162085592,63.1856
GemmTunableOp_BFloat16_TN,tn_11264_6144_6144_ld_6144_6144_11264,Gemm_Rocblas_-1162085592,37.2542
GemmTunableOp_BFloat16_TN,tn_12288_8192_9216_ld_9216_9216_12288,Default,72.7385
GemmTunableOp_BFloat16_TN,tn_11264_6144_5120_ld_5120_5120_11264,Default,26.2986
GemmTunableOp_BFloat16_TN,tn_11264_6144_4096_ld_4096_4096_11264,Gemm_Rocblas_-1162085590,24.6335
GemmTunableOp_BFloat16_TN,tn_8192_8192_11264_ld_11264_11264_8192,Gemm_Rocblas_-1162085587,61.8293
GemmTunableOp_BFloat16_TN,tn_11264_6144_1024_ld_1024_1024_11264,Gemm_Rocblas_-1162085569,4.87497
GemmTunableOp_BFloat16_TN,tn_10240_6144_15360_ld_15360_15360_10240,Gemm_Rocblas_-1162085575,83.2683
GemmTunableOp_BFloat16_TN,tn_10240_6144_14336_ld_14336_14336_10240,Gemm_Rocblas_-1162085580,91.8884
GemmTunableOp_BFloat16_TN,tn_1024_8192_1024_ld_1024_1024_1024,Gemm_Rocblas_-1162085567,0.586392
GemmTunableOp_BFloat16_TN,tn_10240_6144_12288_ld_12288_12288_10240,Gemm_Rocblas_-1162085575,77.7355
GemmTunableOp_BFloat16_TN,tn_4096_7168_6144_ld_6144_6144_4096,Gemm_Rocblas_-1162085592,16.8967
GemmTunableOp_BFloat16_TN,tn_10240_6144_10240_ld_10240_10240_10240,Gemm_Rocblas_-1162085587,58.3895
GemmTunableOp_BFloat16_TN,tn_10240_6144_9216_ld_9216_9216_10240,Gemm_Rocblas_-1162085587,44.7276
GemmTunableOp_BFloat16_TN,tn_10240_6144_8192_ld_8192_8192_10240,Gemm_Rocblas_-1162085584,46.0395
GemmTunableOp_BFloat16_TN,tn_10240_6144_7168_ld_7168_7168_10240,Gemm_Rocblas_-1162085587,34.1081
GemmTunableOp_BFloat16_TN,tn_10240_6144_6144_ld_6144_6144_10240,Gemm_Rocblas_-1162085592,34.3011
GemmTunableOp_BFloat16_TN,tn_10240_6144_5120_ld_5120_5120_10240,Gemm_Rocblas_-1162085587,23.9464
GemmTunableOp_BFloat16_TN,tn_10240_6144_2048_ld_2048_2048_10240,Gemm_Hipblaslt_502,12.1971
GemmTunableOp_BFloat16_TN,tn_15360_8192_13312_ld_13312_13312_15360,Gemm_Rocblas_-1162085575,135.153
GemmTunableOp_BFloat16_TN,tn_10240_6144_1024_ld_1024_1024_10240,Gemm_Rocblas_-1162085569,4.64255
GemmTunableOp_BFloat16_TN,tn_9216_6144_12288_ld_12288_12288_9216,Gemm_Rocblas_-1162085592,68.0875
GemmTunableOp_BFloat16_TN,tn_9216_6144_9216_ld_9216_9216_9216,Default,40.1238
GemmTunableOp_BFloat16_TN,tn_9216_6144_8192_ld_8192_8192_9216,Gemm_Rocblas_-1162085592,40.736
GemmTunableOp_BFloat16_TN,tn_9216_6144_7168_ld_7168_7168_9216,Default,30.2066
GemmTunableOp_BFloat16_TN,tn_12288_8192_6144_ld_6144_6144_12288,Gemm_Rocblas_-1162085592,54.5439
GemmTunableOp_BFloat16_TN,tn_9216_6144_4096_ld_4096_4096_9216,Gemm_Rocblas_-1162085590,20.3174
GemmTunableOp_BFloat16_TN,tn_9216_6144_3072_ld_3072_3072_9216,Gemm_Rocblas_-1162085588,12.8175
GemmTunableOp_BFloat16_TN,tn_9216_6144_2048_ld_2048_2048_9216,Gemm_Hipblaslt_502,10.6574
GemmTunableOp_BFloat16_TN,tn_11264_7168_4096_ld_4096_4096_11264,Gemm_Rocblas_-1162085590,28.5378
GemmTunableOp_BFloat16_TN,tn_8192_6144_15360_ld_15360_15360_8192,Gemm_Rocblas_-1162085580,66.756
GemmTunableOp_BFloat16_TN,tn_13312_7168_12288_ld_12288_12288_13312,Gemm_Rocblas_-1162085592,113.071
GemmTunableOp_BFloat16_TN,tn_8192_6144_14336_ld_14336_14336_8192,Gemm_Rocblas_-1162085580,75.9178
GemmTunableOp_BFloat16_TN,tn_8192_6144_13312_ld_13312_13312_8192,Gemm_Rocblas_-1162085575,55.2271
GemmTunableOp_BFloat16_TN,tn_11264_8192_8192_ld_8192_8192_11264,Gemm_Rocblas_-1162085592,66.2303
GemmTunableOp_BFloat16_TN,tn_8192_6144_11264_ld_11264_11264_8192,Gemm_Rocblas_-1162085575,46.3801
GemmTunableOp_BFloat16_TN,tn_8192_6144_8192_ld_8192_8192_8192,Gemm_Rocblas_-1162085590,37.8585
GemmTunableOp_BFloat16_TN,tn_8192_6144_6144_ld_6144_6144_8192,Gemm_Rocblas_-1162085592,27.7494
GemmTunableOp_BFloat16_TN,tn_10240_8192_12288_ld_12288_12288_10240,Gemm_Rocblas_-1162085592,103.749
GemmTunableOp_BFloat16_TN,tn_10240_7168_12288_ld_12288_12288_10240,Gemm_Rocblas_-1162085592,87.467
GemmTunableOp_BFloat16_TN,tn_8192_6144_1024_ld_1024_1024_8192,Gemm_Rocblas_-1162085569,3.65343
GemmTunableOp_BFloat16_TN,tn_7168_6144_15360_ld_15360_15360_7168,Gemm_Rocblas_-1162085575,57.7116
GemmTunableOp_BFloat16_TN,tn_7168_6144_13312_ld_13312_13312_7168,Gemm_Rocblas_-1162085575,47.8851
GemmTunableOp_BFloat16_TN,tn_7168_6144_12288_ld_12288_12288_7168,Gemm_Rocblas_-1162085592,55.052
GemmTunableOp_BFloat16_TN,tn_7168_6144_9216_ld_9216_9216_7168,Default,31.4598
GemmTunableOp_BFloat16_TN,tn_7168_6144_8192_ld_8192_8192_7168,Gemm_Rocblas_-1162085584,32.0159
GemmTunableOp_BFloat16_TN,tn_7168_6144_7168_ld_7168_7168_7168,Gemm_Rocblas_-1162085587,23.9038
GemmTunableOp_BFloat16_TN,tn_7168_6144_6144_ld_6144_6144_7168,Gemm_Rocblas_-1162085587,23.7898
GemmTunableOp_BFloat16_TN,tn_13312_8192_10240_ld_10240_10240_13312,Default,100.505
GemmTunableOp_BFloat16_TN,tn_14336_6144_1024_ld_1024_1024_14336,Gemm_Rocblas_-1162085569,6.35282
GemmTunableOp_BFloat16_TN,tn_7168_6144_4096_ld_4096_4096_7168,Gemm_Rocblas_-1162085590,15.8173
GemmTunableOp_BFloat16_TN,tn_7168_6144_2048_ld_2048_2048_7168,Gemm_Rocblas_-1162085569,6.67659
GemmTunableOp_BFloat16_TN,tn_7168_6144_1024_ld_1024_1024_7168,Gemm_Rocblas_-1162085569,3.16044
GemmTunableOp_BFloat16_TN,tn_6144_6144_14336_ld_14336_14336_6144,Gemm_Rocblas_-1162085581,59.5133
GemmTunableOp_BFloat16_TN,tn_6144_6144_11264_ld_11264_11264_6144,Gemm_Rocblas_-1162085587,35.3623
GemmTunableOp_BFloat16_TN,tn_6144_6144_9216_ld_9216_9216_6144,Default,27.2136
GemmTunableOp_BFloat16_TN,tn_6144_6144_8192_ld_8192_8192_6144,Gemm_Rocblas_-1162085590,27.88
GemmTunableOp_BFloat16_TN,tn_3072_9216_7168_ld_7168_7168_3072,Gemm_Rocblas_-1162085587,15.7992
GemmTunableOp_BFloat16_TN,tn_3072_8192_4096_ld_4096_4096_3072,Gemm_Rocblas_-1162085569,7.87813
GemmTunableOp_BFloat16_TN,tn_6144_6144_7168_ld_7168_7168_6144,Default,20.7046
GemmTunableOp_BFloat16_TN,tn_8192_8192_14336_ld_14336_14336_8192,Gemm_Rocblas_-1162085580,99.3558
GemmTunableOp_BFloat16_TN,tn_6144_6144_5120_ld_5120_5120_6144,Gemm_Rocblas_-1162085592,14.7945
GemmTunableOp_BFloat16_TN,tn_6144_6144_4096_ld_4096_4096_6144,Gemm_Rocblas_-1162085591,14.1557
GemmTunableOp_BFloat16_TN,tn_6144_6144_2048_ld_2048_2048_6144,Gemm_Rocblas_-1162085569,5.59347
GemmTunableOp_BFloat16_TN,tn_5120_6144_15360_ld_15360_15360_5120,Gemm_Rocblas_-1162085575,42.506
GemmTunableOp_BFloat16_TN,tn_5120_6144_14336_ld_14336_14336_5120,Gemm_Rocblas_-1162085575,50.1264
GemmTunableOp_BFloat16_TN,tn_5120_6144_13312_ld_13312_13312_5120,Gemm_Rocblas_-1162085575,35.4658
GemmTunableOp_BFloat16_TN,tn_5120_6144_11264_ld_11264_11264_5120,Default,28.6446
GemmTunableOp_BFloat16_TN,tn_5120_9216_14336_ld_14336_14336_5120,Gemm_Rocblas_-1162085581,71.5559
GemmTunableOp_BFloat16_TN,tn_5120_6144_8192_ld_8192_8192_5120,Gemm_Rocblas_-1162085589,23.417
GemmTunableOp_BFloat16_TN,tn_9216_7168_12288_ld_12288_12288_9216,Gemm_Rocblas_-1162085575,82.3574
GemmTunableOp_BFloat16_TN,tn_5120_6144_6144_ld_6144_6144_5120,Default,17.4547
GemmTunableOp_BFloat16_TN,tn_5120_6144_5120_ld_5120_5120_5120,Gemm_Rocblas_-1162085592,12.2287
GemmTunableOp_BFloat16_TN,tn_5120_6144_4096_ld_4096_4096_5120,Gemm_Rocblas_-1162085584,11.9367
GemmTunableOp_BFloat16_TN,tn_4096_9216_10240_ld_10240_10240_4096,Default,37.74
GemmTunableOp_BFloat16_TN,tn_5120_6144_3072_ld_3072_3072_5120,Gemm_Rocblas_-1162085592,7.24076
GemmTunableOp_BFloat16_TN,tn_9216_6144_6144_ld_6144_6144_9216,Gemm_Rocblas_-1162085592,30.5313
GemmTunableOp_BFloat16_TN,tn_5120_6144_2048_ld_2048_2048_5120,Gemm_Rocblas_-1162085569,4.49892
GemmTunableOp_BFloat16_TN,tn_4096_6144_11264_ld_11264_11264_4096,Gemm_Rocblas_-1162085575,23.1648
GemmTunableOp_BFloat16_TN,tn_4096_6144_9216_ld_9216_9216_4096,Gemm_Rocblas_-1162085592,18.4605
GemmTunableOp_BFloat16_TN,tn_4096_6144_7168_ld_7168_7168_4096,Default,14.2143
GemmTunableOp_BFloat16_TN,tn_4096_6144_6144_ld_6144_6144_4096,Gemm_Rocblas_-1162085592,14.2969
GemmTunableOp_BFloat16_TN,tn_4096_6144_5120_ld_5120_5120_4096,Default,10.1197
GemmTunableOp_BFloat16_TN,tn_4096_6144_3072_ld_3072_3072_4096,Gemm_Rocblas_-1162085578,5.56414
GemmTunableOp_BFloat16_TN,tn_4096_6144_2048_ld_2048_2048_4096,Gemm_Rocblas_-1162085569,3.76939
GemmTunableOp_BFloat16_TN,tn_2048_9216_15360_ld_15360_15360_2048,Gemm_Rocblas_-1162085575,26.6103
GemmTunableOp_BFloat16_TN,tn_3072_6144_15360_ld_15360_15360_3072,Gemm_Rocblas_-1162085575,25.5319
GemmTunableOp_BFloat16_TN,tn_3072_6144_14336_ld_14336_14336_3072,Default,31.9652
GemmTunableOp_BFloat16_TN,tn_3072_6144_11264_ld_11264_11264_3072,Gemm_Rocblas_-1162085587,17.3977
GemmTunableOp_BFloat16_TN,tn_3072_6144_9216_ld_9216_9216_3072,Gemm_Rocblas_-1162085592,14.105
GemmTunableOp_BFloat16_TN,tn_3072_6144_8192_ld_8192_8192_3072,Gemm_Rocblas_-1162085591,14.5376
GemmTunableOp_BFloat16_TN,tn_3072_6144_7168_ld_7168_7168_3072,Gemm_Rocblas_-1162085592,10.4162
GemmTunableOp_BFloat16_TN,tn_3072_6144_6144_ld_6144_6144_3072,Gemm_Rocblas_-1162085592,11.0002
GemmTunableOp_BFloat16_TN,tn_1024_8192_2048_ld_2048_2048_1024,Gemm_Rocblas_-1162085569,1.41014
GemmTunableOp_BFloat16_TN,tn_15360_6144_9216_ld_9216_9216_15360,Default,66.1995
GemmTunableOp_BFloat16_TN,tn_3072_6144_5120_ld_5120_5120_3072,Gemm_Rocblas_-1162085591,7.43744
GemmTunableOp_BFloat16_TN,tn_3072_6144_2048_ld_2048_2048_3072,Gemm_Rocblas_-1162085569,2.79078
GemmTunableOp_BFloat16_TN,tn_3072_6144_1024_ld_1024_1024_3072,Gemm_Rocblas_-1162085569,1.37048
GemmTunableOp_BFloat16_TN,tn_5120_9216_12288_ld_12288_12288_5120,Gemm_Rocblas_-1162085575,61.102
GemmTunableOp_BFloat16_TN,tn_2048_6144_14336_ld_14336_14336_2048,Gemm_Rocblas_-1162085572,21.8865
GemmTunableOp_BFloat16_TN,tn_2048_6144_13312_ld_13312_13312_2048,Gemm_Rocblas_-1162085575,15.0444
GemmTunableOp_BFloat16_TN,tn_2048_6144_10240_ld_10240_10240_2048,Gemm_Rocblas_-1162085592,14.2659
GemmTunableOp_BFloat16_TN,tn_8192_7168_7168_ld_7168_7168_8192,Default,31.858
GemmTunableOp_BFloat16_TN,tn_2048_6144_9216_ld_9216_9216_2048,Gemm_Rocblas_-1162085575,9.87861
GemmTunableOp_BFloat16_TN,tn_4096_7168_1024_ld_1024_1024_4096,Gemm_Rocblas_-1162085569,2.13332
GemmTunableOp_BFloat16_TN,tn_2048_6144_8192_ld_8192_8192_2048,Gemm_Rocblas_-1162085589,10.431
GemmTunableOp_BFloat16_TN,tn_2048_6144_7168_ld_7168_7168_2048,Gemm_Rocblas_-1162085566,7.36747
GemmTunableOp_BFloat16_TN,tn_2048_6144_6144_ld_6144_6144_2048,Gemm_Rocblas_-1162085566,6.63857
GemmTunableOp_BFloat16_TN,tn_2048_6144_3072_ld_3072_3072_2048,Gemm_Rocblas_-1162085590,2.83169
GemmTunableOp_BFloat16_TN,tn_1024_6144_15360_ld_15360_15360_1024,Gemm_Rocblas_-1162085575,9.13123
GemmTunableOp_BFloat16_TN,tn_1024_6144_14336_ld_14336_14336_1024,Gemm_Rocblas_-1162085570,11.3446
GemmTunableOp_BFloat16_TN,tn_1024_6144_13312_ld_13312_13312_1024,Gemm_Rocblas_-1162085566,7.75863
GemmTunableOp_BFloat16_TN,tn_1024_6144_11264_ld_11264_11264_1024,Gemm_Rocblas_-1162085570,6.28222
GemmTunableOp_BFloat16_TN,tn_7168_8192_14336_ld_14336_14336_7168,Gemm_Rocblas_-1162085581,88.2251
GemmTunableOp_BFloat16_TN,tn_3072_7168_13312_ld_13312_13312_3072,Gemm_Rocblas_-1162085575,24.8869
GemmTunableOp_BFloat16_TN,tn_1024_6144_10240_ld_10240_10240_1024,Gemm_Rocblas_-1162085566,6.12372
GemmTunableOp_BFloat16_TN,tn_14336_7168_4096_ld_4096_4096_14336,Gemm_Rocblas_-1162085591,37.1431
GemmTunableOp_BFloat16_TN,tn_1024_6144_4096_ld_4096_4096_1024,Gemm_Rocblas_-1162085569,2.1286
GemmTunableOp_BFloat16_TN,tn_1024_6144_3072_ld_3072_3072_1024,Gemm_Rocblas_-1162085570,1.3973
GemmTunableOp_BFloat16_TN,tn_1024_6144_5120_ld_5120_5120_1024,Gemm_Rocblas_-1162085580,2.4696
GemmTunableOp_BFloat16_TN,tn_1024_6144_2048_ld_2048_2048_1024,Gemm_Rocblas_-1162085567,1.03526
GemmTunableOp_BFloat16_TN,tn_1024_6144_1024_ld_1024_1024_1024,Gemm_Rocblas_-1162085576,0.439748
GemmTunableOp_BFloat16_TN,tn_15360_5120_14336_ld_14336_14336_15360,Gemm_Rocblas_-1162085575,112.893
GemmTunableOp_BFloat16_TN,tn_15360_5120_13312_ld_13312_13312_15360,Gemm_Rocblas_-1162085580,85.9807
GemmTunableOp_BFloat16_TN,tn_15360_5120_12288_ld_12288_12288_15360,Gemm_Rocblas_-1162085575,95.6456
GemmTunableOp_BFloat16_TN,tn_15360_5120_11264_ld_11264_11264_15360,Gemm_Rocblas_-1162085592,71.4841
GemmTunableOp_BFloat16_TN,tn_15360_5120_10240_ld_10240_10240_15360,Gemm_Rocblas_-1162085587,72.4211
GemmTunableOp_BFloat16_TN,tn_15360_5120_9216_ld_9216_9216_15360,Default,52.9809
GemmTunableOp_BFloat16_TN,tn_15360_5120_8192_ld_8192_8192_15360,Gemm_Rocblas_-1162085584,55.8714
GemmTunableOp_BFloat16_TN,tn_15360_5120_6144_ld_6144_6144_15360,Gemm_Rocblas_-1162085592,41.4591
GemmTunableOp_BFloat16_TN,tn_15360_5120_5120_ld_5120_5120_15360,Gemm_Rocblas_-1162085592,29.9023
GemmTunableOp_BFloat16_TN,tn_15360_5120_3072_ld_3072_3072_15360,Gemm_Rocblas_-1162085592,17.751
GemmTunableOp_BFloat16_TN,tn_7168_9216_12288_ld_12288_12288_7168,Gemm_Rocblas_-1162085575,83.1536
GemmTunableOp_BFloat16_TN,tn_3072_8192_2048_ld_2048_2048_3072,Gemm_Rocblas_-1162085569,3.71915
GemmTunableOp_BFloat16_TN,tn_15360_5120_2048_ld_2048_2048_15360,Gemm_Hipblaslt_502,14.8987
GemmTunableOp_BFloat16_TN,tn_7168_9216_11264_ld_11264_11264_7168,Default,59.3099
GemmTunableOp_BFloat16_TN,tn_1024_9216_9216_ld_9216_9216_1024,Gemm_Rocblas_-1162085570,6.84734
GemmTunableOp_BFloat16_TN,tn_14336_5120_15360_ld_15360_15360_14336,Gemm_Rocblas_-1162085575,94.229
GemmTunableOp_BFloat16_TN,tn_14336_5120_14336_ld_14336_14336_14336,Gemm_Rocblas_-1162085575,106.279
GemmTunableOp_BFloat16_TN,tn_14336_5120_12288_ld_12288_12288_14336,Gemm_Rocblas_-1162085592,88.0444
GemmTunableOp_BFloat16_TN,tn_14336_5120_11264_ld_11264_11264_14336,Default,66.7837
GemmTunableOp_BFloat16_TN,tn_8192_8192_13312_ld_13312_13312_8192,Gemm_Rocblas_-1162085575,74.5007
GemmTunableOp_BFloat16_TN,tn_14336_5120_10240_ld_10240_10240_14336,Default,68.3407
GemmTunableOp_BFloat16_TN,tn_14336_5120_8192_ld_8192_8192_14336,Gemm_Rocblas_-1162085584,52.625
GemmTunableOp_BFloat16_TN,tn_14336_5120_7168_ld_7168_7168_14336,Gemm_Rocblas_-1162085587,39.1405
GemmTunableOp_BFloat16_TN,tn_4096_8192_2048_ld_2048_2048_4096,Gemm_Rocblas_-1162085569,4.99493
GemmTunableOp_BFloat16_TN,tn_14336_5120_4096_ld_4096_4096_14336,Gemm_Rocblas_-1162085591,26.5515
GemmTunableOp_BFloat16_TN,tn_1024_9216_11264_ld_11264_11264_1024,Gemm_Rocblas_-1162085566,8.91362
GemmTunableOp_BFloat16_TN,tn_14336_5120_3072_ld_3072_3072_14336,Gemm_Rocblas_-1162085592,16.9151
GemmTunableOp_BFloat16_TN,tn_14336_5120_1024_ld_1024_1024_14336,Gemm_Rocblas_-1162085569,5.35403
GemmTunableOp_BFloat16_TN,tn_14336_6144_2048_ld_2048_2048_14336,Gemm_Hipblaslt_502,16.5497
GemmTunableOp_BFloat16_TN,tn_13312_5120_10240_ld_10240_10240_13312,Default,62.7679
GemmTunableOp_BFloat16_TN,tn_12288_8192_15360_ld_15360_15360_12288,Gemm_Rocblas_-1162085575,129.109
GemmTunableOp_BFloat16_TN,tn_13312_5120_8192_ld_8192_8192_13312,Gemm_Rocblas_-1162085590,48.2202
GemmTunableOp_BFloat16_TN,tn_13312_7168_13312_ld_13312_13312_13312,Default,105.322
GemmTunableOp_BFloat16_TN,tn_13312_5120_6144_ld_6144_6144_13312,Gemm_Rocblas_-1162085587,36.261
GemmTunableOp_BFloat16_TN,tn_13312_5120_4096_ld_4096_4096_13312,Gemm_Rocblas_-1162085590,24.0175
GemmTunableOp_BFloat16_TN,tn_13312_5120_3072_ld_3072_3072_13312,Gemm_Rocblas_-1162085592,15.5857
GemmTunableOp_BFloat16_TN,tn_13312_5120_1024_ld_1024_1024_13312,Gemm_Rocblas_-1162085569,4.90411
GemmTunableOp_BFloat16_TN,tn_12288_5120_15360_ld_15360_15360_12288,Gemm_Rocblas_-1162085580,81.9322
GemmTunableOp_BFloat16_TN,tn_12288_5120_13312_ld_13312_13312_12288,Gemm_Rocblas_-1162085575,69.0247
GemmTunableOp_BFloat16_TN,tn_12288_5120_11264_ld_11264_11264_12288,Default,57.4123
GemmTunableOp_BFloat16_TN,tn_12288_5120_9216_ld_9216_9216_12288,Gemm_Rocblas_-1162085587,43.076
GemmTunableOp_BFloat16_TN,tn_14336_5120_9216_ld_9216_9216_14336,Default,49.4855
GemmTunableOp_BFloat16_TN,tn_12288_5120_6144_ld_6144_6144_12288,Gemm_Rocblas_-1162085592,33.895
GemmTunableOp_BFloat16_TN,tn_12288_5120_5120_ld_5120_5120_12288,Default,23.891
GemmTunableOp_BFloat16_TN,tn_12288_5120_4096_ld_4096_4096_12288,Gemm_Rocblas_-1162085591,23.1861
GemmTunableOp_BFloat16_TN,tn_12288_5120_3072_ld_3072_3072_12288,Gemm_Rocblas_-1162085591,14.546
GemmTunableOp_BFloat16_TN,tn_7168_6144_3072_ld_3072_3072_7168,Gemm_Rocblas_-1162085591,10.066
GemmTunableOp_BFloat16_TN,tn_12288_5120_2048_ld_2048_2048_12288,Gemm_Hipblaslt_502,11.9736
GemmTunableOp_BFloat16_TN,tn_8192_9216_3072_ld_3072_3072_8192,Gemm_Rocblas_-1162085590,17.1955
GemmTunableOp_BFloat16_TN,tn_11264_5120_15360_ld_15360_15360_11264,Gemm_Rocblas_-1162085575,76.6355
GemmTunableOp_BFloat16_TN,tn_11264_6144_2048_ld_2048_2048_11264,Gemm_Hipblaslt_502,13.0622
GemmTunableOp_BFloat16_TN,tn_11264_5120_14336_ld_14336_14336_11264,Gemm_Rocblas_-1162085575,84.8434
GemmTunableOp_BFloat16_TN,tn_2048_9216_2048_ld_2048_2048_2048,Gemm_Rocblas_-1162085569,2.88336
GemmTunableOp_BFloat16_TN,tn_11264_5120_13312_ld_13312_13312_11264,Gemm_Rocblas_-1162085575,63.1887
GemmTunableOp_BFloat16_TN,tn_11264_5120_8192_ld_8192_8192_11264,Gemm_Rocblas_-1162085582,41.5738
GemmTunableOp_BFloat16_TN,tn_11264_5120_6144_ld_6144_6144_11264,Gemm_Rocblas_-1162085592,30.7356
GemmTunableOp_BFloat16_TN,tn_12288_6144_7168_ld_7168_7168_12288,Default,40.6382
GemmTunableOp_BFloat16_TN,tn_11264_5120_4096_ld_4096_4096_11264,Gemm_Rocblas_-1162085591,20.7854
GemmTunableOp_BFloat16_TN,tn_12288_6144_4096_ld_4096_4096_12288,Gemm_Rocblas_-1162085590,27.6683
GemmTunableOp_BFloat16_TN,tn_11264_5120_3072_ld_3072_3072_11264,Gemm_Rocblas_-1162085592,13.067
GemmTunableOp_BFloat16_TN,tn_10240_5120_15360_ld_15360_15360_10240,Gemm_Rocblas_-1162085575,70.2389
GemmTunableOp_BFloat16_TN,tn_10240_5120_14336_ld_14336_14336_10240,Gemm_Rocblas_-1162085575,77.2751
GemmTunableOp_BFloat16_TN,tn_10240_5120_13312_ld_13312_13312_10240,Default,59.0896
GemmTunableOp_BFloat16_TN,tn_10240_5120_12288_ld_12288_12288_10240,Gemm_Rocblas_-1162085575,64.9817
GemmTunableOp_BFloat16_TN,tn_13312_5120_15360_ld_15360_15360_13312,Gemm_Rocblas_-1162085575,89.2767
GemmTunableOp_BFloat16_TN,tn_10240_5120_11264_ld_11264_11264_10240,Gemm_Rocblas_-1162085575,48.0437
GemmTunableOp_BFloat16_TN,tn_10240_5120_10240_ld_10240_10240_10240,Default,49.764
GemmTunableOp_BFloat16_TN,tn_10240_5120_9216_ld_9216_9216_10240,Default,37.4702
GemmTunableOp_BFloat16_TN,tn_1024_7168_6144_ld_6144_6144_1024,Gemm_Rocblas_-1162085575,4.1526
GemmTunableOp_BFloat16_TN,tn_10240_5120_8192_ld_8192_8192_10240,Gemm_Rocblas_-1162085590,36.8939
GemmTunableOp_BFloat16_TN,tn_10240_5120_5120_ld_5120_5120_10240,Default,19.8618
GemmTunableOp_BFloat16_TN,tn_10240_5120_3072_ld_3072_3072_10240,Gemm_Rocblas_-1162085591,11.9837
GemmTunableOp_BFloat16_TN,tn_10240_5120_2048_ld_2048_2048_10240,Gemm_Hipblaslt_502,10.3298
GemmTunableOp_BFloat16_TN,tn_10240_5120_1024_ld_1024_1024_10240,Gemm_Rocblas_-1162085569,3.86768
GemmTunableOp_BFloat16_TN,tn_1024_3072_8192_ld_8192_8192_1024,Gemm_Rocblas_-1162085569,2.23876
GemmTunableOp_BFloat16_TN,tn_11264_3072_9216_ld_9216_9216_11264,Gemm_Rocblas_-1162085587,24.8643
GemmTunableOp_BFloat16_TN,tn_1024_2048_14336_ld_14336_14336_1024,Gemm_Hipblaslt_503,3.83451
GemmTunableOp_BFloat16_TN,tn_1024_3072_2048_ld_2048_2048_1024,Default,0.404081
GemmTunableOp_BFloat16_TN,tn_11264_3072_11264_ld_11264_11264_11264,Default,31.9234
GemmTunableOp_BFloat16_TN,tn_4096_16640_4096_ld_4096_4096_4096,Gemm_Rocblas_-1162085590,25.9987
GemmTunableOp_BFloat16_TN,tn_2048_3072_12288_ld_12288_12288_2048,Gemm_Rocblas_-1162085592,9.55111
GemmTunableOp_BFloat16_TN,tn_15360_2048_12288_ld_12288_12288_15360,Gemm_Rocblas_-1162085575,38.9619
GemmTunableOp_BFloat16_TN,tn_8192_3072_9216_ld_9216_9216_8192,Gemm_Rocblas_-1162085587,18.0863
GemmTunableOp_BFloat16_TN,tn_15360_2048_10240_ld_10240_10240_15360,Gemm_Rocblas_-1162085592,29.5247
GemmTunableOp_BFloat16_TN,tn_2048_4096_3072_ld_3072_3072_2048,Gemm_Rocblas_-1162085578,1.94406
GemmTunableOp_BFloat16_TN,tn_13312_8192_14336_ld_14336_14336_13312,Gemm_Rocblas_-1162085581,157.851
GemmTunableOp_BFloat16_TN,tn_15360_4096_4096_ld_4096_4096_15360,Gemm_Rocblas_-1162085590,22.0635
GemmTunableOp_BFloat16_TN,tn_1024_6144_7168_ld_7168_7168_1024,Gemm_Rocblas_-1162085578,3.5324
GemmTunableOp_BFloat16_TN,tn_15360_2048_7168_ld_7168_7168_15360,Gemm_Rocblas_-1162085582,16.7554
GemmTunableOp_BFloat16_TN,tn_15360_2048_6144_ld_6144_6144_15360,Default,16.6602
GemmTunableOp_BFloat16_TN,tn_15360_2048_5120_ld_5120_5120_15360,Gemm_Rocblas_-1162085592,12.0314
GemmTunableOp_BFloat16_TN,tn_15360_2048_1024_ld_1024_1024_15360,Gemm_Rocblas_-1162085569,2.36961
GemmTunableOp_BFloat16_TN,tn_9216_3072_10240_ld_10240_10240_9216,Default,27.2077
GemmTunableOp_BFloat16_TN,tn_14336_2048_6144_ld_6144_6144_14336,Default,15.9342
GemmTunableOp_BFloat16_TN,tn_8192_4096_12288_ld_12288_12288_8192,Gemm_Rocblas_-1162085575,41.988
GemmTunableOp_BFloat16_TN,tn_1024_7168_14336_ld_14336_14336_1024,Gemm_Rocblas_-1162085570,12.7627
GemmTunableOp_BFloat16_TN,tn_8192_5120_9216_ld_9216_9216_8192,Default,29.411
GemmTunableOp_BFloat16_TN,tn_14336_2048_4096_ld_4096_4096_14336,Gemm_Rocblas_-1162085591,10.7869
GemmTunableOp_BFloat16_TN,tn_14336_2048_11264_ld_11264_11264_14336,Gemm_Rocblas_-1162085575,27.2654
GemmTunableOp_BFloat16_TN,tn_13312_2048_12288_ld_12288_12288_13312,Gemm_Rocblas_-1162085575,33.6804
GemmTunableOp_BFloat16_TN,tn_14336_3072_11264_ld_11264_11264_14336,Gemm_Rocblas_-1162085580,40.414
GemmTunableOp_BFloat16_TN,tn_7168_8192_13312_ld_13312_13312_7168,Gemm_Rocblas_-1162085575,64.0442
GemmTunableOp_BFloat16_TN,tn_4096_8192_13312_ld_13312_13312_4096,Gemm_Rocblas_-1162085575,38.1469
GemmTunableOp_BFloat16_TN,tn_2048_5120_1024_ld_1024_1024_2048,Gemm_Rocblas_-1162085567,0.732669
GemmTunableOp_BFloat16_TN,tn_13312_2048_9216_ld_9216_9216_13312,Default,20.1406
GemmTunableOp_BFloat16_TN,tn_5120_9216_9216_ld_9216_9216_5120,Default,33.1943
GemmTunableOp_BFloat16_TN,tn_13312_2048_7168_ld_7168_7168_13312,Default,14.9122
GemmTunableOp_BFloat16_TN,tn_2048_2048_13312_ld_13312_13312_2048,Gemm_Rocblas_-1162085573,5.47044
GemmTunableOp_BFloat16_TN,tn_2048_9216_12288_ld_12288_12288_2048,Gemm_Rocblas_-1162085592,26.3816
GemmTunableOp_BFloat16_TN,tn_7168_4096_1024_ld_1024_1024_7168,Gemm_Rocblas_-1162085569,2.10291
GemmTunableOp_BFloat16_TN,tn_1024_9216_12288_ld_12288_12288_1024,Gemm_Rocblas_-1162085564,12.4328
GemmTunableOp_BFloat16_TN,tn_13312_2048_4096_ld_4096_4096_13312,Gemm_Rocblas_-1162085590,9.8762
GemmTunableOp_BFloat16_TN,tn_12288_2048_3072_ld_3072_3072_12288,Gemm_Rocblas_-1162085578,5.90146
GemmTunableOp_BFloat16_TN,tn_6144_9216_12288_ld_12288_12288_6144,Gemm_Rocblas_-1162085575,70.5909
GemmTunableOp_BFloat16_TN,tn_15360_2048_2048_ld_2048_2048_15360,Gemm_Hipblaslt_502,6.12985
GemmTunableOp_BFloat16_TN,tn_4096_4096_10240_ld_10240_10240_4096,Default,16.8412
GemmTunableOp_BFloat16_TN,tn_11264_2048_8192_ld_8192_8192_11264,Gemm_Rocblas_-1162085588,16.7663
GemmTunableOp_BFloat16_TN,tn_2048_7168_10240_ld_10240_10240_2048,Gemm_Rocblas_-1162085592,16.4424
GemmTunableOp_BFloat16_TN,tn_5120_2048_2048_ld_2048_2048_5120,Gemm_Rocblas_-1162085569,1.58079
GemmTunableOp_BFloat16_TN,tn_9216_5120_12288_ld_12288_12288_9216,Gemm_Rocblas_-1162085592,57.7868
GemmTunableOp_BFloat16_TN,tn_11264_6144_8192_ld_8192_8192_11264,Gemm_Rocblas_-1162085592,49.5381
GemmTunableOp_BFloat16_TN,tn_11264_2048_7168_ld_7168_7168_11264,Gemm_Rocblas_-1162085587,12.6129
GemmTunableOp_BFloat16_TN,tn_10240_2048_5120_ld_5120_5120_10240,Default,8.13586
GemmTunableOp_BFloat16_TN,tn_2048_4096_5120_ld_5120_5120_2048,Gemm_Rocblas_-1162085580,3.27259
GemmTunableOp_BFloat16_TN,tn_5120_2048_10240_ld_10240_10240_5120,Default,11.0388
GemmTunableOp_BFloat16_TN,tn_5120_7168_3072_ld_3072_3072_5120,Default,8.42045
GemmTunableOp_BFloat16_TN,tn_13312_4096_11264_ld_11264_11264_13312,Default,49.6265
GemmTunableOp_BFloat16_TN,tn_11264_2048_6144_ld_6144_6144_11264,Default,12.7121
GemmTunableOp_BFloat16_TN,tn_15360_6144_13312_ld_13312_13312_15360,Gemm_Rocblas_-1162085575,101.497
GemmTunableOp_BFloat16_TN,tn_7168_4096_7168_ld_7168_7168_7168,Default,15.4994
GemmTunableOp_BFloat16_TN,tn_15360_4096_6144_ld_6144_6144_15360,Gemm_Rocblas_-1162085592,33.2853
GemmTunableOp_BFloat16_TN,tn_2048_9216_14336_ld_14336_14336_2048,Gemm_Rocblas_-1162085580,31.9774
GemmTunableOp_BFloat16_TN,tn_11264_2048_4096_ld_4096_4096_11264,Gemm_Rocblas_-1162085590,8.38643
GemmTunableOp_BFloat16_TN,tn_12288_4096_9216_ld_9216_9216_12288,Gemm_Rocblas_-1162085592,35.7162
GemmTunableOp_BFloat16_TN,tn_1024_3072_9216_ld_9216_9216_1024,Gemm_Rocblas_-1162085570,2.29683
GemmTunableOp_BFloat16_TN,tn_3072_7168_1024_ld_1024_1024_3072,Gemm_Rocblas_-1162085569,1.59358
GemmTunableOp_BFloat16_TN,tn_11264_2048_3072_ld_3072_3072_11264,Gemm_Rocblas_-1162085576,5.02332
GemmTunableOp_BFloat16_TN,tn_14336_2048_5120_ld_5120_5120_14336,Default,11.4107
GemmTunableOp_BFloat16_TN,tn_13312_3072_13312_ld_13312_13312_13312,Gemm_Rocblas_-1162085575,45.3651
GemmTunableOp_BFloat16_TN,tn_7168_8192_4096_ld_4096_4096_7168,Gemm_Rocblas_-1162085585,21.3454
GemmTunableOp_BFloat16_TN,tn_11264_4096_5120_ld_5120_5120_11264,Default,17.6299
GemmTunableOp_BFloat16_TN,tn_8192_7168_4096_ld_4096_4096_8192,Gemm_Rocblas_-1162085591,21.9737
GemmTunableOp_BFloat16_TN,tn_11264_6144_9216_ld_9216_9216_11264,Gemm_Rocblas_-1162085587,48.9748
GemmTunableOp_BFloat16_TN,tn_10240_2048_14336_ld_14336_14336_10240,Gemm_Rocblas_-1162085580,33.7077
GemmTunableOp_BFloat16_TN,tn_6144_5120_9216_ld_9216_9216_6144,Gemm_Rocblas_-1162085592,22.2705
GemmTunableOp_BFloat16_TN,tn_12288_2048_9216_ld_9216_9216_12288,Default,18.2527
GemmTunableOp_BFloat16_TN,tn_12288_2048_10240_ld_10240_10240_12288,Default,24.6635
GemmTunableOp_BFloat16_TN,tn_10240_2048_10240_ld_10240_10240_10240,Gemm_Rocblas_-1162085592,20.7753
GemmTunableOp_BFloat16_TN,tn_7168_6144_14336_ld_14336_14336_7168,Gemm_Rocblas_-1162085575,68.1661
GemmTunableOp_BFloat16_TN,tn_8192_3072_2048_ld_2048_2048_8192,Gemm_Rocblas_-1162085569,4.4874
GemmTunableOp_BFloat16_TN,tn_4096_8192_1024_ld_1024_1024_4096,Gemm_Rocblas_-1162085569,2.45267
GemmTunableOp_BFloat16_TN,tn_12288_2048_5120_ld_5120_5120_12288,Default,9.76893
GemmTunableOp_BFloat16_TN,tn_8192_9216_2048_ld_2048_2048_8192,Gemm_Rocblas_-1162085569,13.5699
GemmTunableOp_BFloat16_TN,tn_11264_4096_10240_ld_10240_10240_11264,Gemm_Rocblas_-1162085592,44.0653
GemmTunableOp_BFloat16_TN,tn_10240_2048_9216_ld_9216_9216_10240,Gemm_Rocblas_-1162085587,15.2761
GemmTunableOp_BFloat16_TN,tn_10240_2048_7168_ld_7168_7168_10240,Gemm_Rocblas_-1162085592,11.5981
GemmTunableOp_BFloat16_TN,tn_3072_4096_14336_ld_14336_14336_3072,Gemm_Rocblas_-1162085592,21.5796
GemmTunableOp_BFloat16_TN,tn_10240_5120_4096_ld_4096_4096_10240,Gemm_Rocblas_-1162085591,19.5275
GemmTunableOp_BFloat16_TN,tn_11264_2048_9216_ld_9216_9216_11264,Gemm_Rocblas_-1162085575,17.0418
GemmTunableOp_BFloat16_TN,tn_10240_2048_2048_ld_2048_2048_10240,Gemm_Hipblaslt_502,4.18452
GemmTunableOp_BFloat16_TN,tn_6144_2048_6144_ld_6144_6144_6144,Gemm_Rocblas_-1162085590,7.40578
GemmTunableOp_BFloat16_TN,tn_4096_15360_4096_ld_4096_4096_4096,Gemm_Rocblas_-1162085590,24.1613
GemmTunableOp_BFloat16_TN,tn_10240_8192_10240_ld_10240_10240_10240,Default,78.8743
GemmTunableOp_BFloat16_TN,tn_6144_8192_1024_ld_1024_1024_6144,Gemm_Rocblas_-1162085569,3.68327
GemmTunableOp_BFloat16_TN,tn_11264_7168_15360_ld_15360_15360_11264,Gemm_Rocblas_-1162085575,102.319
GemmTunableOp_BFloat16_TN,tn_9216_2048_15360_ld_15360_15360_9216,Gemm_Rocblas_-1162085581,25.834
GemmTunableOp_BFloat16_TN,tn_14336_2048_9216_ld_9216_9216_14336,Gemm_Rocblas_-1162085592,21.442
GemmTunableOp_BFloat16_TN,tn_7168_7168_3072_ld_3072_3072_7168,Gemm_Rocblas_-1162085591,11.7908
GemmTunableOp_BFloat16_TN,tn_9216_2048_14336_ld_14336_14336_9216,Gemm_Rocblas_-1162085578,31.3303
GemmTunableOp_BFloat16_TN,tn_9216_2048_4096_ld_4096_4096_9216,Default,6.99202
GemmTunableOp_BFloat16_TN,tn_6144_7168_2048_ld_2048_2048_6144,Gemm_Rocblas_-1162085569,6.42828
GemmTunableOp_BFloat16_TN,tn_9216_2048_11264_ld_11264_11264_9216,Gemm_Rocblas_-1162085580,17.7369
GemmTunableOp_BFloat16_TN,tn_3072_5120_11264_ld_11264_11264_3072,Gemm_Rocblas_-1162085587,14.9397
GemmTunableOp_BFloat16_TN,tn_9216_2048_10240_ld_10240_10240_9216,Default,18.2203
GemmTunableOp_BFloat16_TN,tn_3072_7168_15360_ld_15360_15360_3072,Default,29.8389
GemmTunableOp_BFloat16_TN,tn_1024_1024_12288_ld_12288_12288_1024,Gemm_Rocblas_-1162085569,1.62802
GemmTunableOp_BFloat16_TN,tn_9216_2048_8192_ld_8192_8192_9216,Gemm_Rocblas_-1162085590,13.8277
GemmTunableOp_BFloat16_TN,tn_2048_8192_7168_ld_7168_7168_2048,Gemm_Rocblas_-1162085575,9.60978
GemmTunableOp_BFloat16_TN,tn_9216_2048_7168_ld_7168_7168_9216,Default,10.4983
GemmTunableOp_BFloat16_TN,tn_15360_7168_15360_ld_15360_15360_15360,Gemm_Rocblas_-1162085580,144.252
GemmTunableOp_BFloat16_TN,tn_4096_2048_14336_ld_14336_14336_4096,Gemm_Rocblas_-1162085580,14.5191
GemmTunableOp_BFloat16_TN,tn_6144_4096_2048_ld_2048_2048_6144,Gemm_Rocblas_-1162085569,3.70612
GemmTunableOp_BFloat16_TN,tn_13312_2048_13312_ld_13312_13312_13312,Gemm_Rocblas_-1162085575,30.9359
GemmTunableOp_BFloat16_TN,tn_7168_1024_3072_ld_3072_3072_7168,Default,1.77409
GemmTunableOp_BFloat16_TN,tn_12288_2048_15360_ld_15360_15360_12288,Gemm_Rocblas_-1162085580,33.9884
GemmTunableOp_BFloat16_TN,tn_7168_2048_13312_ld_13312_13312_7168,Gemm_Rocblas_-1162085575,16.8556
GemmTunableOp_BFloat16_TN,tn_4096_3072_8192_ld_8192_8192_4096,Gemm_Rocblas_-1162085591,10.1258
GemmTunableOp_BFloat16_TN,tn_6144_2048_14336_ld_14336_14336_6144,Gemm_Rocblas_-1162085581,20.6312
GemmTunableOp_BFloat16_TN,tn_2048_8192_6144_ld_6144_6144_2048,Gemm_Rocblas_-1162085566,8.65833
GemmTunableOp_BFloat16_TN,tn_6144_2048_13312_ld_13312_13312_6144,Gemm_Rocblas_-1162085575,14.6732
GemmTunableOp_BFloat16_TN,tn_9216_1024_13312_ld_13312_13312_9216,Gemm_Rocblas_-1162085575,10.2085
GemmTunableOp_BFloat16_TN,tn_15360_5120_4096_ld_4096_4096_15360,Gemm_Rocblas_-1162085590,27.7834
GemmTunableOp_BFloat16_TN,tn_9216_2048_6144_ld_6144_6144_9216,Default,10.3895
GemmTunableOp_BFloat16_TN,tn_5120_4096_6144_ld_6144_6144_5120,Gemm_Rocblas_-1162085592,11.2414
GemmTunableOp_BFloat16_TN,tn_6144_9216_9216_ld_9216_9216_6144,Default,39.8263
GemmTunableOp_BFloat16_TN,tn_5120_8192_8192_ld_8192_8192_5120,Gemm_Rocblas_-1162085585,31.3268
GemmTunableOp_BFloat16_TN,tn_5120_7168_9216_ld_9216_9216_5120,Gemm_Rocblas_-1162085587,26.2246
GemmTunableOp_BFloat16_TN,tn_9216_6144_5120_ld_5120_5120_9216,Default,21.6307
GemmTunableOp_BFloat16_TN,tn_8192_2048_11264_ld_11264_11264_8192,Gemm_Rocblas_-1162085575,16.207
GemmTunableOp_BFloat16_TN,tn_13312_7168_14336_ld_14336_14336_13312,Gemm_Rocblas_-1162085581,142.484
GemmTunableOp_BFloat16_TN,tn_8192_7168_10240_ld_10240_10240_8192,Gemm_Rocblas_-1162085587,56.2922
GemmTunableOp_BFloat16_TN,tn_8192_2048_10240_ld_10240_10240_8192,Default,16.6112
GemmTunableOp_BFloat16_TN,tn_4096_2048_7168_ld_7168_7168_4096,Gemm_Rocblas_-1162085592,4.68535
GemmTunableOp_BFloat16_TN,tn_8192_2048_9216_ld_9216_9216_8192,Default,12.6348
GemmTunableOp_BFloat16_TN,tn_15360_2048_14336_ld_14336_14336_15360,Gemm_Rocblas_-1162085581,47.3428
GemmTunableOp_BFloat16_TN,tn_12288_4096_15360_ld_15360_15360_12288,Gemm_Rocblas_-1162085575,68.2068
GemmTunableOp_BFloat16_TN,tn_4096_9216_12288_ld_12288_12288_4096,Gemm_Rocblas_-1162085575,48.7732
GemmTunableOp_BFloat16_TN,tn_5120_8192_12288_ld_12288_12288_5120,Gemm_Rocblas_-1162085592,54.3769
GemmTunableOp_BFloat16_TN,tn_8192_2048_7168_ld_7168_7168_8192,Gemm_Rocblas_-1162085573,9.47344
GemmTunableOp_BFloat16_TN,tn_1024_9216_10240_ld_10240_10240_1024,Gemm_Rocblas_-1162085566,8.75405
GemmTunableOp_BFloat16_TN,tn_8192_2048_4096_ld_4096_4096_8192,Gemm_Rocblas_-1162085590,6.33973
GemmTunableOp_BFloat16_TN,tn_7168_6144_10240_ld_10240_10240_7168,Default,40.8013
GemmTunableOp_BFloat16_TN,tn_5120_4096_1024_ld_1024_1024_5120,Gemm_Rocblas_-1162085578,1.50956
GemmTunableOp_BFloat16_TN,tn_9216_2048_12288_ld_12288_12288_9216,Gemm_Rocblas_-1162085592,24.3192
GemmTunableOp_BFloat16_TN,tn_11264_8192_13312_ld_13312_13312_11264,Gemm_Rocblas_-1162085575,99.8634
GemmTunableOp_BFloat16_TN,tn_6144_1024_13312_ld_13312_13312_6144,Gemm_Rocblas_-1162085578,6.82728
GemmTunableOp_BFloat16_TN,tn_9216_5120_15360_ld_15360_15360_9216,Gemm_Rocblas_-1162085575,62.2447
GemmTunableOp_BFloat16_TN,tn_8192_2048_1024_ld_1024_1024_8192,Gemm_Rocblas_-1162085569,1.25362
GemmTunableOp_BFloat16_TN,tn_8192_7168_5120_ld_5120_5120_8192,Gemm_Rocblas_-1162085592,22.5513
GemmTunableOp_BFloat16_TN,tn_2048_7168_9216_ld_9216_9216_2048,Gemm_Rocblas_-1162085575,11.418
GemmTunableOp_BFloat16_TN,tn_7168_2048_15360_ld_15360_15360_7168,Default,20.2223
GemmTunableOp_BFloat16_TN,tn_13312_7168_1024_ld_1024_1024_13312,Gemm_Rocblas_-1162085569,6.77822
GemmTunableOp_BFloat16_TN,tn_14336_6144_14336_ld_14336_14336_14336,Gemm_Rocblas_-1162085575,128.039
GemmTunableOp_BFloat16_TN,tn_3072_4096_15360_ld_15360_15360_3072,Default,17.6866
GemmTunableOp_BFloat16_TN,tn_7168_2048_11264_ld_11264_11264_7168,Gemm_Rocblas_-1162085580,14.1045
GemmTunableOp_BFloat16_TN,tn_9216_5120_1024_ld_1024_1024_9216,Gemm_Rocblas_-1162085569,3.35584
GemmTunableOp_BFloat16_TN,tn_4096_1024_10240_ld_10240_10240_4096,Gemm_Rocblas_-1162085588,4.5485
GemmTunableOp_BFloat16_TN,tn_2048_9216_11264_ld_11264_11264_2048,Gemm_Rocblas_-1162085575,18.5352
GemmTunableOp_BFloat16_TN,tn_5120_6144_1024_ld_1024_1024_5120,Gemm_Rocblas_-1162085578,2.24631
GemmTunableOp_BFloat16_TN,tn_3072_2048_14336_ld_14336_14336_3072,Gemm_Rocblas_-1162085592,11.5001
GemmTunableOp_BFloat16_TN,tn_1024_3072_12288_ld_12288_12288_1024,Gemm_Rocblas_-1162085566,4.34634
GemmTunableOp_BFloat16_TN,tn_5120_1024_13312_ld_13312_13312_5120,Gemm_Rocblas_-1162085578,5.92809
GemmTunableOp_BFloat16_TN,tn_11264_8192_1024_ld_1024_1024_11264,Gemm_Rocblas_-1162085569,6.50519
GemmTunableOp_BFloat16_TN,tn_11264_4096_3072_ld_3072_3072_11264,Gemm_Rocblas_-1162085590,10.4184
GemmTunableOp_BFloat16_TN,tn_9216_1024_1024_ld_1024_1024_9216,Default,0.659524
GemmTunableOp_BFloat16_TN,tn_4096_6144_10240_ld_10240_10240_4096,Default,25.975
GemmTunableOp_BFloat16_TN,tn_9216_2048_9216_ld_9216_9216_9216,Gemm_Rocblas_-1162085573,13.9149
GemmTunableOp_BFloat16_TN,tn_4096_6144_13312_ld_13312_13312_4096,Gemm_Rocblas_-1162085575,29.1025
GemmTunableOp_BFloat16_TN,tn_13312_1024_9216_ld_9216_9216_13312,Gemm_Rocblas_-1162085592,9.83575
GemmTunableOp_BFloat16_TN,tn_3072_3072_4096_ld_4096_4096_3072,Gemm_Rocblas_-1162085569,3.09978
GemmTunableOp_BFloat16_TN,tn_10240_8192_15360_ld_15360_15360_10240,Gemm_Rocblas_-1162085580,110.363
GemmTunableOp_BFloat16_TN,tn_9216_2048_5120_ld_5120_5120_9216,Gemm_Rocblas_-1162085592,7.22871
GemmTunableOp_BFloat16_TN,tn_14336_4096_7168_ld_7168_7168_14336,Default,29.4915
GemmTunableOp_BFloat16_TN,tn_1024_8192_9216_ld_9216_9216_1024,Gemm_Rocblas_-1162085569,5.74555
GemmTunableOp_BFloat16_TN,tn_1024_2048_10240_ld_10240_10240_1024,Gemm_Rocblas_-1162085570,2.35453
GemmTunableOp_BFloat16_TN,tn_14336_4096_13312_ld_13312_13312_14336,Gemm_Rocblas_-1162085575,64.9768
GemmTunableOp_BFloat16_TN,tn_7168_2048_3072_ld_3072_3072_7168,Gemm_Rocblas_-1162085579,3.37918
GemmTunableOp_BFloat16_TN,tn_8192_8192_15360_ld_15360_15360_8192,Gemm_Rocblas_-1162085575,88.2784
GemmTunableOp_BFloat16_TN,tn_7168_2048_1024_ld_1024_1024_7168,Gemm_Rocblas_-1162085576,1.03328
GemmTunableOp_BFloat16_TN,tn_6144_2048_15360_ld_15360_15360_6144,Gemm_Rocblas_-1162085580,16.7343
GemmTunableOp_BFloat16_TN,tn_6144_2048_11264_ld_11264_11264_6144,Gemm_Rocblas_-1162085587,12.1946
GemmTunableOp_BFloat16_TN,tn_4096_1024_11264_ld_11264_11264_4096,Gemm_Rocblas_-1162085591,4.1788
GemmTunableOp_BFloat16_TN,tn_7168_7168_12288_ld_12288_12288_7168,Gemm_Rocblas_-1162085575,63.3866
GemmTunableOp_BFloat16_TN,tn_6144_2048_10240_ld_10240_10240_6144,Default,13.2473
GemmTunableOp_BFloat16_TN,tn_6144_2048_9216_ld_9216_9216_6144,Gemm_Rocblas_-1162085575,9.49953
GemmTunableOp_BFloat16_TN,tn_15360_7168_7168_ld_7168_7168_15360,Default,58.9146
GemmTunableOp_BFloat16_TN,tn_7168_1024_9216_ld_9216_9216_7168,Gemm_Rocblas_-1162085587,5.53813
GemmTunableOp_BFloat16_TN,tn_12288_2048_12288_ld_12288_12288_12288,Default,31.7149
GemmTunableOp_BFloat16_TN,tn_6144_2048_5120_ld_5120_5120_6144,Default,5.0897
GemmTunableOp_BFloat16_TN,tn_7168_3072_11264_ld_11264_11264_7168,Gemm_Rocblas_-1162085575,21.2562
GemmTunableOp_BFloat16_TN,tn_1024_3072_3072_ld_3072_3072_1024,Gemm_Rocblas_-1162085576,0.613018
GemmTunableOp_BFloat16_TN,tn_6144_2048_3072_ld_3072_3072_6144,Gemm_Rocblas_-1162085579,2.95281
GemmTunableOp_BFloat16_TN,tn_4096_2048_1024_ld_1024_1024_4096,Gemm_Rocblas_-1162085578,0.549394
GemmTunableOp_BFloat16_TN,tn_3072_1024_15360_ld_15360_15360_3072,Gemm_Rocblas_-1162085575,4.63017
GemmTunableOp_BFloat16_TN,tn_5120_2048_15360_ld_15360_15360_5120,Gemm_Rocblas_-1162085575,14.5307
GemmTunableOp_BFloat16_TN,tn_5120_2048_12288_ld_12288_12288_5120,Gemm_Rocblas_-1162085575,14.334
GemmTunableOp_BFloat16_TN,tn_11264_5120_5120_ld_5120_5120_11264,Gemm_Rocblas_-1162085587,22.0983
GemmTunableOp_BFloat16_TN,tn_2048_3072_8192_ld_8192_8192_2048,Gemm_Rocblas_-1162085568,5.3171
GemmTunableOp_BFloat16_TN,tn_5120_2048_8192_ld_8192_8192_5120,Default,7.86582
GemmTunableOp_BFloat16_TN,tn_5120_2048_7168_ld_7168_7168_5120,Gemm_Rocblas_-1162085587,6.00578
GemmTunableOp_BFloat16_TN,tn_5120_2048_5120_ld_5120_5120_5120,Default,4.26762
GemmTunableOp_BFloat16_TN,tn_14336_2048_7168_ld_7168_7168_14336,Gemm_Rocblas_-1162085587,15.8996
GemmTunableOp_BFloat16_TN,tn_5120_6144_12288_ld_12288_12288_5120,Gemm_Rocblas_-1162085575,40.205
GemmTunableOp_BFloat16_TN,tn_8192_5120_15360_ld_15360_15360_8192,Gemm_Rocblas_-1162085580,56.4815
GemmTunableOp_BFloat16_TN,tn_14336_2048_3072_ld_3072_3072_14336,Gemm_Rocblas_-1162085576,6.57939
GemmTunableOp_BFloat16_TN,tn_6144_9216_10240_ld_10240_10240_6144,Gemm_Rocblas_-1162085587,55.2639
GemmTunableOp_BFloat16_TN,tn_1024_3072_15360_ld_15360_15360_1024,Gemm_Rocblas_-1162085575,4.70938
GemmTunableOp_BFloat16_TN,tn_6144_4096_6144_ld_6144_6144_6144,Gemm_Rocblas_-1162085592,14.2435
GemmTunableOp_BFloat16_TN,tn_8192_2048_15360_ld_15360_15360_8192,Gemm_Rocblas_-1162085580,22.7586
GemmTunableOp_BFloat16_TN,tn_4096_11264_4096_ld_4096_4096_4096,Gemm_Rocblas_-1162085592,20.5564
GemmTunableOp_BFloat16_TN,tn_8192_6144_9216_ld_9216_9216_8192,Default,36.2205
GemmTunableOp_BFloat16_TN,tn_4096_2048_10240_ld_10240_10240_4096,Gemm_Rocblas_-1162085592,9.30919
GemmTunableOp_BFloat16_TN,tn_11264_3072_13312_ld_13312_13312_11264,Gemm_Rocblas_-1162085575,37.3955
GemmTunableOp_BFloat16_TN,tn_6144_5120_5120_ld_5120_5120_6144,Default,12.1654
GemmTunableOp_BFloat16_TN,tn_14336_6144_3072_ld_3072_3072_14336,Gemm_Rocblas_-1162085591,20.2749
GemmTunableOp_BFloat16_TN,tn_4096_16128_4096_ld_4096_4096_4096,Gemm_Rocblas_-1162085591,25.4427
GemmTunableOp_BFloat16_TN,tn_6144_2048_1024_ld_1024_1024_6144,Gemm_Rocblas_-1162085569,0.947181
GemmTunableOp_BFloat16_TN,tn_13312_2048_10240_ld_10240_10240_13312,Default,25.8615
GemmTunableOp_BFloat16_TN,tn_4096_8192_5120_ld_5120_5120_4096,Gemm_Rocblas_-1162085587,13.2123
GemmTunableOp_BFloat16_TN,tn_3072_2048_9216_ld_9216_9216_3072,Gemm_Rocblas_-1162085580,5.07244
GemmTunableOp_BFloat16_TN,tn_7168_5120_7168_ld_7168_7168_7168,Default,20.0497
GemmTunableOp_BFloat16_TN,tn_11264_8192_7168_ld_7168_7168_11264,Default,48.485
GemmTunableOp_BFloat16_TN,tn_3072_2048_5120_ld_5120_5120_3072,Gemm_Rocblas_-1162085592,2.52846
GemmTunableOp_BFloat16_TN,tn_3072_8192_15360_ld_15360_15360_3072,Gemm_Rocblas_-1162085575,33.5498
GemmTunableOp_BFloat16_TN,tn_11264_2048_14336_ld_14336_14336_11264,Gemm_Rocblas_-1162085580,33.8989
GemmTunableOp_BFloat16_TN,tn_5120_8192_4096_ld_4096_4096_5120,Gemm_Rocblas_-1162085590,15.5682
GemmTunableOp_BFloat16_TN,tn_15360_4096_11264_ld_11264_11264_15360,Default,56.6262
GemmTunableOp_BFloat16_TN,tn_14336_7168_7168_ld_7168_7168_14336,Default,54.5644
GemmTunableOp_BFloat16_TN,tn_13312_5120_12288_ld_12288_12288_13312,Gemm_Rocblas_-1162085575,83.046
GemmTunableOp_BFloat16_TN,tn_3072_2048_3072_ld_3072_3072_3072,Gemm_Rocblas_-1162085578,1.37783
GemmTunableOp_BFloat16_TN,tn_4096_1024_8192_ld_8192_8192_4096,Gemm_Rocblas_-1162085588,3.30058
GemmTunableOp_BFloat16_TN,tn_3072_2048_1024_ld_1024_1024_3072,Gemm_Rocblas_-1162085576,0.434492
GemmTunableOp_BFloat16_TN,tn_10240_3072_3072_ld_3072_3072_10240,Gemm_Rocblas_-1162085591,7.3219
GemmTunableOp_BFloat16_TN,tn_9216_7168_5120_ld_5120_5120_9216,Default,25.1758
GemmTunableOp_BFloat16_TN,tn_4096_12288_4096_ld_4096_4096_4096,Gemm_Rocblas_-1162085567,18.8309
GemmTunableOp_BFloat16_TN,tn_12288_2048_4096_ld_4096_4096_12288,Gemm_Rocblas_-1162085590,9.41329
GemmTunableOp_BFloat16_TN,tn_6144_3072_4096_ld_4096_4096_6144,Gemm_Rocblas_-1162085590,7.21803
GemmTunableOp_BFloat16_TN,tn_10240_8192_8192_ld_8192_8192_10240,Gemm_Rocblas_-1162085591,61.3343
GemmTunableOp_BFloat16_TN,tn_2048_2048_11264_ld_11264_11264_2048,Gemm_Rocblas_-1162085575,4.68315
GemmTunableOp_BFloat16_TN,tn_11264_2048_2048_ld_2048_2048_11264,Gemm_Hipblaslt_502,4.53036
GemmTunableOp_BFloat16_TN,tn_2048_5120_10240_ld_10240_10240_2048,Gemm_Rocblas_-1162085588,12.3183
GemmTunableOp_BFloat16_TN,tn_7168_3072_3072_ld_3072_3072_7168,Gemm_Rocblas_-1162085592,5.09532
GemmTunableOp_BFloat16_TN,tn_2048_2048_6144_ld_6144_6144_2048,Gemm_Rocblas_-1162085570,2.4087
GemmTunableOp_BFloat16_TN,tn_1024_5120_4096_ld_4096_4096_1024,Gemm_Rocblas_-1162085567,1.73381
GemmTunableOp_BFloat16_TN,tn_2048_2048_5120_ld_5120_5120_2048,Gemm_Rocblas_-1162085578,1.71344
GemmTunableOp_BFloat16_TN,tn_1024_2048_15360_ld_15360_15360_1024,Gemm_Rocblas_-1162085575,3.51084
GemmTunableOp_BFloat16_TN,tn_4096_7168_15360_ld_15360_15360_4096,Gemm_Rocblas_-1162085575,39.9363
GemmTunableOp_BFloat16_TN,tn_13312_5120_7168_ld_7168_7168_13312,Default,35.1856
GemmTunableOp_BFloat16_TN,tn_12288_1024_15360_ld_15360_15360_12288,Gemm_Rocblas_-1162085580,17.25
GemmTunableOp_BFloat16_TN,tn_10240_4096_13312_ld_13312_13312_10240,Gemm_Rocblas_-1162085575,46.9987
GemmTunableOp_BFloat16_TN,tn_1024_2048_13312_ld_13312_13312_1024,Gemm_Rocblas_-1162085575,2.93643
GemmTunableOp_BFloat16_TN,tn_13312_3072_4096_ld_4096_4096_13312,Gemm_Rocblas_-1162085592,14.6181
GemmTunableOp_BFloat16_TN,tn_10240_3072_8192_ld_8192_8192_10240,Gemm_Rocblas_-1162085588,23.1785
GemmTunableOp_BFloat16_TN,tn_15360_8192_1024_ld_1024_1024_15360,Gemm_Rocblas_-1162085569,9.28934
GemmTunableOp_BFloat16_TN,tn_10240_2048_4096_ld_4096_4096_10240,Gemm_Rocblas_-1162085590,7.82578
GemmTunableOp_BFloat16_TN,tn_4096_2048_8192_ld_8192_8192_4096,Gemm_Rocblas_-1162085590,6.69397
GemmTunableOp_BFloat16_TN,tn_2048_3072_15360_ld_15360_15360_2048,Default,9.21945
GemmTunableOp_BFloat16_TN,tn_6144_3072_15360_ld_15360_15360_6144,Gemm_Rocblas_-1162085575,25.5266
GemmTunableOp_BFloat16_TN,tn_14336_6144_7168_ld_7168_7168_14336,Default,46.8888
GemmTunableOp_BFloat16_TN,tn_13312_2048_6144_ld_6144_6144_13312,Default,14.7399
GemmTunableOp_BFloat16_TN,tn_12288_2048_13312_ld_13312_13312_12288,Default,29.7069
GemmTunableOp_BFloat16_TN,tn_12288_2048_7168_ld_7168_7168_12288,Gemm_Rocblas_-1162085587,14.0455
GemmTunableOp_BFloat16_TN,tn_7168_5120_5120_ld_5120_5120_7168,Default,14.144
GemmTunableOp_BFloat16_TN,tn_8192_7168_15360_ld_15360_15360_8192,Gemm_Rocblas_-1162085575,73.9354
GemmTunableOp_BFloat16_TN,tn_4096_2048_9216_ld_9216_9216_4096,Gemm_Rocblas_-1162085575,6.55154
GemmTunableOp_BFloat16_TN,tn_11264_2048_15360_ld_15360_15360_11264,Gemm_Rocblas_-1162085575,31.6351
GemmTunableOp_BFloat16_TN,tn_1024_2048_6144_ld_6144_6144_1024,Gemm_Rocblas_-1162085590,1.21054
GemmTunableOp_BFloat16_TN,tn_11264_6144_3072_ld_3072_3072_11264,Gemm_Rocblas_-1162085591,15.7399
GemmTunableOp_BFloat16_TN,tn_7168_3072_12288_ld_12288_12288_7168,Gemm_Rocblas_-1162085592,27.1358
GemmTunableOp_BFloat16_TN,tn_8192_1024_15360_ld_15360_15360_8192,Gemm_Rocblas_-1162085573,11.2181
GemmTunableOp_BFloat16_TN,tn_4096_6144_12288_ld_12288_12288_4096,Gemm_Rocblas_-1162085592,32.9826
GemmTunableOp_BFloat16_TN,tn_5120_3072_9216_ld_9216_9216_5120,Gemm_Rocblas_-1162085587,11.3905
GemmTunableOp_BFloat16_TN,tn_5120_1024_12288_ld_12288_12288_5120,Gemm_Rocblas_-1162085590,6.99876
GemmTunableOp_BFloat16_TN,tn_1024_2048_3072_ld_3072_3072_1024,Gemm_Rocblas_-1162085575,0.460688
GemmTunableOp_BFloat16_TN,tn_7168_8192_10240_ld_10240_10240_7168,Gemm_Rocblas_-1162085592,55.9481
GemmTunableOp_BFloat16_TN,tn_1024_2048_2048_ld_2048_2048_1024,Gemm_Rocblas_-1162085569,0.313684
GemmTunableOp_BFloat16_TN,tn_3072_9216_12288_ld_12288_12288_3072,Default,37.5287
GemmTunableOp_BFloat16_TN,tn_1024_5120_9216_ld_9216_9216_1024,Gemm_Rocblas_-1162085570,3.8143
GemmTunableOp_BFloat16_TN,tn_15360_1024_15360_ld_15360_15360_15360,Gemm_Rocblas_-1162085575,21.7048
GemmTunableOp_BFloat16_TN,tn_15360_1024_14336_ld_14336_14336_15360,Gemm_Rocblas_-1162085575,25.3797
GemmTunableOp_BFloat16_TN,tn_2048_2048_1024_ld_1024_1024_2048,Gemm_Rocblas_-1162085576,0.287412
GemmTunableOp_BFloat16_TN,tn_8192_9216_10240_ld_10240_10240_8192,Default,72.3848
GemmTunableOp_BFloat16_TN,tn_15360_1024_13312_ld_13312_13312_15360,Gemm_Rocblas_-1162085580,18.0635
GemmTunableOp_BFloat16_TN,tn_10240_1024_11264_ld_11264_11264_10240,Gemm_Rocblas_-1162085578,9.34084
GemmTunableOp_BFloat16_TN,tn_5120_3072_4096_ld_4096_4096_5120,Gemm_Rocblas_-1162085591,5.9143
GemmTunableOp_BFloat16_TN,tn_3072_2048_10240_ld_10240_10240_3072,Gemm_Rocblas_-1162085592,7.22317
GemmTunableOp_BFloat16_TN,tn_15360_1024_7168_ld_7168_7168_15360,Default,8.61669
GemmTunableOp_BFloat16_TN,tn_3072_4096_13312_ld_13312_13312_3072,Gemm_Rocblas_-1162085580,14.5586
GemmTunableOp_BFloat16_TN,tn_15360_1024_4096_ld_4096_4096_15360,Gemm_Rocblas_-1162085591,5.7356
GemmTunableOp_BFloat16_TN,tn_6144_7168_13312_ld_13312_13312_6144,Gemm_Rocblas_-1162085587,47.9977
GemmTunableOp_BFloat16_TN,tn_15360_1024_3072_ld_3072_3072_15360,Default,3.66093
GemmTunableOp_BFloat16_TN,tn_4096_7936_4096_ld_4096_4096_4096,Gemm_Rocblas_-1162085591,14.9343
GemmTunableOp_BFloat16_TN,tn_9216_4096_11264_ld_11264_11264_9216,Default,34.3817
GemmTunableOp_BFloat16_TN,tn_15360_1024_2048_ld_2048_2048_15360,Gemm_Rocblas_-1162085584,3.09817
GemmTunableOp_BFloat16_TN,tn_15360_3072_8192_ld_8192_8192_15360,Default,33.3409
GemmTunableOp_BFloat16_TN,tn_1024_3072_10240_ld_10240_10240_1024,Gemm_Rocblas_-1162085566,3.15607
GemmTunableOp_BFloat16_TN,tn_4096_16384_4096_ld_4096_4096_4096,Gemm_Rocblas_-1162085590,26.0275
GemmTunableOp_BFloat16_TN,tn_1024_9216_3072_ld_3072_3072_1024,Gemm_Rocblas_-1162085578,2.11568
GemmTunableOp_BFloat16_TN,tn_15360_1024_8192_ld_8192_8192_15360,Gemm_Rocblas_-1162085590,11.3482
GemmTunableOp_BFloat16_TN,tn_11264_2048_11264_ld_11264_11264_11264,Gemm_Rocblas_-1162085575,21.7367
GemmTunableOp_BFloat16_TN,tn_8192_4096_14336_ld_14336_14336_8192,Gemm_Rocblas_-1162085580,51.5393
GemmTunableOp_BFloat16_TN,tn_14336_1024_14336_ld_14336_14336_14336,Gemm_Rocblas_-1162085592,24.3948
GemmTunableOp_BFloat16_TN,tn_9216_3072_14336_ld_14336_14336_9216,Gemm_Rocblas_-1162085575,43.9314
GemmTunableOp_BFloat16_TN,tn_1024_7168_10240_ld_10240_10240_1024,Gemm_Rocblas_-1162085566,6.99237
GemmTunableOp_BFloat16_TN,tn_15360_6144_7168_ld_7168_7168_15360,Gemm_Rocblas_-1162085587,50.7062
GemmTunableOp_BFloat16_TN,tn_1024_2048_9216_ld_9216_9216_1024,Gemm_Rocblas_-1162085570,1.72079
GemmTunableOp_BFloat16_TN,tn_1024_4096_4096_ld_4096_4096_1024,Gemm_Rocblas_-1162085569,1.44014
GemmTunableOp_BFloat16_TN,tn_6144_8192_14336_ld_14336_14336_6144,Gemm_Rocblas_-1162085581,77.3547
GemmTunableOp_BFloat16_TN,tn_14336_1024_13312_ld_13312_13312_14336,Gemm_Rocblas_-1162085575,16.7609
GemmTunableOp_BFloat16_TN,tn_3072_2048_13312_ld_13312_13312_3072,Gemm_Rocblas_-1162085571,7.92102
GemmTunableOp_BFloat16_TN,tn_7168_2048_7168_ld_7168_7168_7168,Gemm_Rocblas_-1162085580,8.30162
GemmTunableOp_BFloat16_TN,tn_14336_1024_10240_ld_10240_10240_14336,Gemm_Rocblas_-1162085587,14.4953
GemmTunableOp_BFloat16_TN,tn_9216_6144_11264_ld_11264_11264_9216,Default,49.9095
GemmTunableOp_BFloat16_TN,tn_14336_1024_9216_ld_9216_9216_14336,Gemm_Rocblas_-1162085587,10.9184
GemmTunableOp_BFloat16_TN,tn_4096_20224_4096_ld_4096_4096_4096,Gemm_Rocblas_-1162085590,31.3362
GemmTunableOp_BFloat16_TN,tn_6144_9216_15360_ld_15360_15360_6144,Gemm_Rocblas_-1162085580,74.241
GemmTunableOp_BFloat16_TN,tn_8192_3072_6144_ld_6144_6144_8192,Default,13.8808
GemmTunableOp_BFloat16_TN,tn_8192_2048_14336_ld_14336_14336_8192,Gemm_Rocblas_-1162085579,27.5872
GemmTunableOp_BFloat16_TN,tn_7168_3072_6144_ld_6144_6144_7168,Default,12.1966
GemmTunableOp_BFloat16_TN,tn_10240_2048_6144_ld_6144_6144_10240,Gemm_Rocblas_-1162085592,11.6219
GemmTunableOp_BFloat16_TN,tn_4096_9216_3072_ld_3072_3072_4096,Gemm_Rocblas_-1162085578,8.33671
GemmTunableOp_BFloat16_TN,tn_4096_12032_4096_ld_4096_4096_4096,Gemm_Rocblas_-1162085590,22.2651
GemmTunableOp_BFloat16_TN,tn_7168_2048_8192_ld_8192_8192_7168,Default,11.0858
GemmTunableOp_BFloat16_TN,tn_9216_3072_1024_ld_1024_1024_9216,Gemm_Rocblas_-1162085569,2.05763
GemmTunableOp_BFloat16_TN,tn_8192_6144_5120_ld_5120_5120_8192,Default,19.2992
GemmTunableOp_BFloat16_TN,tn_3072_2048_12288_ld_12288_12288_3072,Gemm_Rocblas_-1162085591,9.13156
GemmTunableOp_BFloat16_TN,tn_10240_1024_2048_ld_2048_2048_10240,Gemm_Rocblas_-1162085591,2.12668
GemmTunableOp_BFloat16_TN,tn_13312_5120_13312_ld_13312_13312_13312,Gemm_Rocblas_-1162085575,74.4251
GemmTunableOp_BFloat16_TN,tn_2048_3072_2048_ld_2048_2048_2048,Gemm_Rocblas_-1162085578,0.83865
GemmTunableOp_BFloat16_TN,tn_9216_6144_13312_ld_13312_13312_9216,Gemm_Rocblas_-1162085575,62.035
GemmTunableOp_BFloat16_TN,tn_3072_5120_10240_ld_10240_10240_3072,Gemm_Rocblas_-1162085592,16.8001
GemmTunableOp_BFloat16_TN,tn_14336_1024_6144_ld_6144_6144_14336,Gemm_Rocblas_-1162085590,8.19576
GemmTunableOp_BFloat16_TN,tn_1024_7168_3072_ld_3072_3072_1024,Gemm_Rocblas_-1162085569,1.64902
GemmTunableOp_BFloat16_TN,tn_15360_1024_10240_ld_10240_10240_15360,Gemm_Rocblas_-1162085587,14.7475
GemmTunableOp_BFloat16_TN,tn_5120_3072_11264_ld_11264_11264_5120,Default,15.0394
GemmTunableOp_BFloat16_TN,tn_11264_6144_11264_ld_11264_11264_11264,Gemm_Rocblas_-1162085575,62.1945
GemmTunableOp_BFloat16_TN,tn_5120_2048_6144_ld_6144_6144_5120,Default,6.09124
GemmTunableOp_BFloat16_TN,tn_10240_6144_13312_ld_13312_13312_10240,Gemm_Rocblas_-1162085575,69.2442
GemmTunableOp_BFloat16_TN,tn_14336_1024_4096_ld_4096_4096_14336,Gemm_Rocblas_-1162085591,5.39877
GemmTunableOp_BFloat16_TN,tn_14336_1024_3072_ld_3072_3072_14336,Gemm_Rocblas_-1162085587,3.48634
GemmTunableOp_BFloat16_TN,tn_9216_6144_10240_ld_10240_10240_9216,Gemm_Rocblas_-1162085587,53.3195
GemmTunableOp_BFloat16_TN,tn_8192_2048_2048_ld_2048_2048_8192,Gemm_Rocblas_-1162085567,2.93928
GemmTunableOp_BFloat16_TN,tn_11264_1024_5120_ld_5120_5120_11264,Gemm_Rocblas_-1162085587,4.54328
GemmTunableOp_BFloat16_TN,tn_14336_1024_1024_ld_1024_1024_14336,Gemm_Rocblas_-1162085569,1.09813
GemmTunableOp_BFloat16_TN,tn_3072_4096_3072_ld_3072_3072_3072,Default,2.68311
GemmTunableOp_BFloat16_TN,tn_3072_9216_13312_ld_13312_13312_3072,Default,31.9474
GemmTunableOp_BFloat16_TN,tn_13312_1024_8192_ld_8192_8192_13312,Default,9.72631
GemmTunableOp_BFloat16_TN,tn_9216_8192_3072_ld_3072_3072_9216,Gemm_Rocblas_-1162085592,16.9539
GemmTunableOp_BFloat16_TN,tn_5120_2048_9216_ld_9216_9216_5120,Gemm_Rocblas_-1162085592,7.79641
GemmTunableOp_BFloat16_TN,tn_4096_5376_4096_ld_4096_4096_4096,Gemm_Rocblas_-1162085590,10.0563
GemmTunableOp_BFloat16_TN,tn_3072_2048_15360_ld_15360_15360_3072,Gemm_Rocblas_-1162085575,9.01742
GemmTunableOp_BFloat16_TN,tn_8192_9216_9216_ld_9216_9216_8192,Default,53.9077
GemmTunableOp_BFloat16_TN,tn_13312_1024_7168_ld_7168_7168_13312,Gemm_Rocblas_-1162085587,7.49844
GemmTunableOp_BFloat16_TN,tn_13312_1024_6144_ld_6144_6144_13312,Gemm_Rocblas_-1162085592,7.4996
GemmTunableOp_BFloat16_TN,tn_10240_1024_3072_ld_3072_3072_10240,Gemm_Rocblas_-1162085592,2.50999
GemmTunableOp_BFloat16_TN,tn_2048_6144_15360_ld_15360_15360_2048,Gemm_Rocblas_-1162085575,17.5746
GemmTunableOp_BFloat16_TN,tn_13312_1024_2048_ld_2048_2048_13312,Gemm_Rocblas_-1162085579,2.68623
GemmTunableOp_BFloat16_TN,tn_3072_1024_14336_ld_14336_14336_3072,Gemm_Rocblas_-1162085588,5.6995
GemmTunableOp_BFloat16_TN,tn_3072_7168_7168_ld_7168_7168_3072,Gemm_Rocblas_-1162085592,12.3674
GemmTunableOp_BFloat16_TN,tn_14336_3072_9216_ld_9216_9216_14336,Gemm_Rocblas_-1162085592,30.6437
GemmTunableOp_BFloat16_TN,tn_1024_5120_8192_ld_8192_8192_1024,Gemm_Rocblas_-1162085569,3.66431
GemmTunableOp_BFloat16_TN,tn_7168_5120_12288_ld_12288_12288_7168,Gemm_Rocblas_-1162085575,45.9535
GemmTunableOp_BFloat16_TN,tn_8192_5120_1024_ld_1024_1024_8192,Gemm_Rocblas_-1162085569,3.03692
GemmTunableOp_BFloat16_TN,tn_4096_9472_4096_ld_4096_4096_4096,Gemm_Rocblas_-1162085589,17.9809
GemmTunableOp_BFloat16_TN,tn_12288_8192_4096_ld_4096_4096_12288,Gemm_Rocblas_-1162085591,36.9163
GemmTunableOp_BFloat16_TN,tn_6144_4096_15360_ld_15360_15360_6144,Gemm_Rocblas_-1162085581,34.5385
GemmTunableOp_BFloat16_TN,tn_10240_4096_7168_ld_7168_7168_10240,Gemm_Rocblas_-1162085587,22.1265
GemmTunableOp_BFloat16_TN,tn_3072_9216_3072_ld_3072_3072_3072,Default,5.90129
GemmTunableOp_BFloat16_TN,tn_4096_5120_10240_ld_10240_10240_4096,Default,21.6377
GemmTunableOp_BFloat16_TN,tn_2048_7168_15360_ld_15360_15360_2048,Gemm_Rocblas_-1162085575,20.5085
GemmTunableOp_BFloat16_TN,tn_12288_2048_11264_ld_11264_11264_12288,Gemm_Rocblas_-1162085575,23.377
GemmTunableOp_BFloat16_TN,tn_4096_19712_4096_ld_4096_4096_4096,Gemm_Rocblas_-1162085589,30.9437
GemmTunableOp_BFloat16_TN,tn_4096_3072_13312_ld_13312_13312_4096,Gemm_Rocblas_-1162085592,14.3338
GemmTunableOp_BFloat16_TN,tn_2048_2048_9216_ld_9216_9216_2048,Gemm_Rocblas_-1162085575,3.58799
GemmTunableOp_BFloat16_TN,tn_7168_1024_11264_ld_11264_11264_7168,Gemm_Rocblas_-1162085591,6.9793
GemmTunableOp_BFloat16_TN,tn_4096_1792_4096_ld_4096_4096_4096,Gemm_Rocblas_-1162085569,3.36784
GemmTunableOp_BFloat16_TN,tn_2048_2048_4096_ld_4096_4096_2048,Gemm_Rocblas_-1162085567,1.47828
GemmTunableOp_BFloat16_TN,tn_1024_2048_1024_ld_1024_1024_1024,Gemm_Rocblas_-1162085567,0.162719
GemmTunableOp_BFloat16_TN,tn_3072_5120_9216_ld_9216_9216_3072,Default,11.547
GemmTunableOp_BFloat16_TN,tn_5120_2048_14336_ld_14336_14336_5120,Gemm_Rocblas_-1162085577,18.1985
GemmTunableOp_BFloat16_TN,tn_2048_8192_4096_ld_4096_4096_2048,Gemm_Rocblas_-1162085569,5.61739
GemmTunableOp_BFloat16_TN,tn_12288_5120_7168_ld_7168_7168_12288,Default,34.1654
GemmTunableOp_BFloat16_TN,tn_2048_2048_7168_ld_7168_7168_2048,Gemm_Rocblas_-1162085566,2.54787
GemmTunableOp_BFloat16_TN,tn_7168_5120_9216_ld_9216_9216_7168,Default,25.0247
GemmTunableOp_BFloat16_TN,tn_15360_8192_4096_ld_4096_4096_15360,Gemm_Rocblas_-1162085591,44.2587
GemmTunableOp_BFloat16_TN,tn_12288_1024_10240_ld_10240_10240_12288,Gemm_Rocblas_-1162085592,12.4536
GemmTunableOp_BFloat16_TN,tn_4096_1024_12288_ld_12288_12288_4096,Gemm_Rocblas_-1162085590,5.93268
GemmTunableOp_BFloat16_TN,tn_8192_1024_8192_ld_8192_8192_8192,Gemm_Rocblas_-1162085589,6.2397
GemmTunableOp_BFloat16_TN,tn_6144_7168_1024_ld_1024_1024_6144,Gemm_Rocblas_-1162085569,3.17351
GemmTunableOp_BFloat16_TN,tn_14336_6144_9216_ld_9216_9216_14336,Gemm_Rocblas_-1162085587,63.8755
GemmTunableOp_BFloat16_TN,tn_4096_3072_4096_ld_4096_4096_4096,Gemm_Rocblas_-1162085591,5.62148
GemmTunableOp_BFloat16_TN,tn_4096_6144_1024_ld_1024_1024_4096,Gemm_Rocblas_-1162085569,1.85842
GemmTunableOp_BFloat16_TN,tn_14336_3072_5120_ld_5120_5120_14336,Gemm_Rocblas_-1162085592,16.4033
GemmTunableOp_BFloat16_TN,tn_5120_7168_7168_ld_7168_7168_5120,Default,19.1731
GemmTunableOp_BFloat16_TN,tn_10240_1024_15360_ld_15360_15360_10240,Gemm_Rocblas_-1162085575,13.6457
GemmTunableOp_BFloat16_TN,tn_7168_8192_2048_ld_2048_2048_7168,Gemm_Rocblas_-1162085569,8.96982
GemmTunableOp_BFloat16_TN,tn_15360_2048_11264_ld_11264_11264_15360,Gemm_Rocblas_-1162085592,28.348
GemmTunableOp_BFloat16_TN,tn_15360_1024_9216_ld_9216_9216_15360,Gemm_Rocblas_-1162085587,11.635
GemmTunableOp_BFloat16_TN,tn_3072_3072_12288_ld_12288_12288_3072,Gemm_Rocblas_-1162085575,13.7603
GemmTunableOp_BFloat16_TN,tn_2048_8192_10240_ld_10240_10240_2048,Gemm_Rocblas_-1162085592,18.1849
GemmTunableOp_BFloat16_TN,tn_12288_2048_1024_ld_1024_1024_12288,Gemm_Rocblas_-1162085569,1.87509
GemmTunableOp_BFloat16_TN,tn_13312_7168_5120_ld_5120_5120_13312,Default,36.273
GemmTunableOp_BFloat16_TN,tn_2048_1024_4096_ld_4096_4096_2048,Gemm_Rocblas_-1162085569,0.547298
GemmTunableOp_BFloat16_TN,tn_4096_8192_6144_ld_6144_6144_4096,Gemm_Rocblas_-1162085592,19.0962
GemmTunableOp_BFloat16_TN,tn_9216_1024_8192_ld_8192_8192_9216,Gemm_Rocblas_-1162085590,6.79015
GemmTunableOp_BFloat16_TN,tn_3072_1024_6144_ld_6144_6144_3072,Gemm_Rocblas_-1162085590,1.82219
GemmTunableOp_BFloat16_TN,tn_1024_8192_4096_ld_4096_4096_1024,Gemm_Rocblas_-1162085569,2.81735
GemmTunableOp_BFloat16_TN,tn_14336_1024_5120_ld_5120_5120_14336,Gemm_Rocblas_-1162085592,5.89404
GemmTunableOp_BFloat16_TN,tn_7168_8192_7168_ld_7168_7168_7168,Default,31.6917
GemmTunableOp_BFloat16_TN,tn_14336_2048_10240_ld_10240_10240_14336,Default,28.2141
GemmTunableOp_BFloat16_TN,tn_11264_5120_7168_ld_7168_7168_11264,Default,30.8034
GemmTunableOp_BFloat16_TN,tn_4096_7168_4096_ld_4096_4096_4096,Gemm_Rocblas_-1162085591,13.372
GemmTunableOp_BFloat16_TN,tn_4096_19968_4096_ld_4096_4096_4096,Gemm_Rocblas_-1162085591,31.3282
GemmTunableOp_BFloat16_TN,tn_2048_7168_2048_ld_2048_2048_2048,Gemm_Rocblas_-1162085569,2.23667
GemmTunableOp_BFloat16_TN,tn_13312_3072_8192_ld_8192_8192_13312,Gemm_Rocblas_-1162085582,29.2644
GemmTunableOp_BFloat16_TN,tn_14336_7168_2048_ld_2048_2048_14336,Gemm_Hipblaslt_502,19.8316
GemmTunableOp_BFloat16_TN,tn_14336_2048_15360_ld_15360_15360_14336,Gemm_Rocblas_-1162085575,39.216
GemmTunableOp_BFloat16_TN,tn_9216_2048_1024_ld_1024_1024_9216,Gemm_Rocblas_-1162085569,1.35677
GemmTunableOp_BFloat16_TN,tn_13312_6144_14336_ld_14336_14336_13312,Gemm_Rocblas_-1162085581,121.352
GemmTunableOp_BFloat16_TN,tn_4096_4096_4096_ld_4096_4096_4096,Gemm_Rocblas_-1162085569,7.42109
GemmTunableOp_BFloat16_TN,tn_12288_7168_13312_ld_13312_13312_12288,Gemm_Rocblas_-1162085575,93.8289
GemmTunableOp_BFloat16_TN,tn_2048_4096_8192_ld_8192_8192_2048,Gemm_Rocblas_-1162085568,6.9788
GemmTunableOp_BFloat16_TN,tn_4096_6144_4096_ld_4096_4096_4096,Gemm_Rocblas_-1162085592,11.5294
GemmTunableOp_BFloat16_TN,tn_2048_9216_10240_ld_10240_10240_2048,Gemm_Rocblas_-1162085592,21.0355
GemmTunableOp_BFloat16_TN,tn_7168_5120_2048_ld_2048_2048_7168,Gemm_Rocblas_-1162085569,5.63921
GemmTunableOp_BFloat16_TN,tn_1024_1024_15360_ld_15360_15360_1024,Gemm_Rocblas_-1162085569,1.6955
GemmTunableOp_BFloat16_TN,tn_5120_4096_14336_ld_14336_14336_5120,Gemm_Rocblas_-1162085576,35.0673
GemmTunableOp_BFloat16_TN,tn_10240_1024_10240_ld_10240_10240_10240,Gemm_Rocblas_-1162085587,10.0412
GemmTunableOp_BFloat16_TN,tn_4096_1024_6144_ld_6144_6144_4096,Gemm_Rocblas_-1162085591,2.5238
GemmTunableOp_BFloat16_TN,tn_12288_6144_8192_ld_8192_8192_12288,Gemm_Rocblas_-1162085590,55.5972
GemmTunableOp_BFloat16_TN,tn_8192_6144_4096_ld_4096_4096_8192,Gemm_Rocblas_-1162085590,18.5495
GemmTunableOp_BFloat16_TN,tn_15360_1024_12288_ld_12288_12288_15360,Gemm_Rocblas_-1162085587,20.0712
GemmTunableOp_BFloat16_TN,tn_6144_1024_14336_ld_14336_14336_6144,Gemm_Hipblaslt_496,10.9419
GemmTunableOp_BFloat16_TN,tn_4096_1024_14336_ld_14336_14336_4096,Gemm_Hipblaslt_503,7.31987
GemmTunableOp_BFloat16_TN,tn_4096_3072_14336_ld_14336_14336_4096,Gemm_Rocblas_-1162085572,21.4629
GemmTunableOp_BFloat16_TN,tn_4096_9216_5120_ld_5120_5120_4096,Default,14.7468
GemmTunableOp_BFloat16_TN,tn_15360_2048_9216_ld_9216_9216_15360,Gemm_Rocblas_-1162085575,22.9272
GemmTunableOp_BFloat16_TN,tn_5120_1024_2048_ld_2048_2048_5120,Gemm_Rocblas_-1162085578,0.692097
GemmTunableOp_BFloat16_TN,tn_5120_1024_3072_ld_3072_3072_5120,Gemm_Rocblas_-1162085592,1.1044
GemmTunableOp_BFloat16_TN,tn_15360_2048_13312_ld_13312_13312_15360,Gemm_Rocblas_-1162085580,35.705
GemmTunableOp_BFloat16_TN,tn_13312_2048_15360_ld_15360_15360_13312,Gemm_Rocblas_-1162085575,36.7413
GemmTunableOp_BFloat16_TN,tn_15360_4096_5120_ld_5120_5120_15360,Default,23.9749
GemmTunableOp_BFloat16_TN,tn_15360_5120_15360_ld_15360_15360_15360,Gemm_Rocblas_-1162085580,101.046
GemmTunableOp_BFloat16_TN,tn_5120_1024_8192_ld_8192_8192_5120,Gemm_Rocblas_-1162085588,3.79463
GemmTunableOp_BFloat16_TN,tn_5120_1024_11264_ld_11264_11264_5120,Gemm_Rocblas_-1162085590,5.04409
GemmTunableOp_BFloat16_TN,tn_2048_3072_13312_ld_13312_13312_2048,Gemm_Rocblas_-1162085574,7.97689
GemmTunableOp_BFloat16_TN,tn_14336_7168_3072_ld_3072_3072_14336,Gemm_Rocblas_-1162085592,23.4338
GemmTunableOp_BFloat16_TN,tn_5120_1024_15360_ld_15360_15360_5120,Gemm_Rocblas_-1162085579,7.22083
GemmTunableOp_BFloat16_TN,tn_1024_5120_12288_ld_12288_12288_1024,Gemm_Rocblas_-1162085566,7.08332
GemmTunableOp_BFloat16_TN,tn_5120_1024_5120_ld_5120_5120_5120,Gemm_Rocblas_-1162085590,2.03928
GemmTunableOp_BFloat16_TN,tn_5120_5120_15360_ld_15360_15360_5120,Default,35.6031
GemmTunableOp_BFloat16_TN,tn_10240_1024_6144_ld_6144_6144_10240,Gemm_Rocblas_-1162085590,5.80942
GemmTunableOp_BFloat16_TN,tn_4096_17408_4096_ld_4096_4096_4096,Gemm_Rocblas_-1162085590,27.3608
GemmTunableOp_BFloat16_TN,tn_8192_3072_12288_ld_12288_12288_8192,Default,31.4177
GemmTunableOp_BFloat16_TN,tn_9216_1024_3072_ld_3072_3072_9216,Gemm_Rocblas_-1162085590,2.19534
GemmTunableOp_BFloat16_TN,tn_9216_7168_9216_ld_9216_9216_9216,Default,47.0901
GemmTunableOp_BFloat16_TN,tn_1024_7168_5120_ld_5120_5120_1024,Gemm_Rocblas_-1162085578,2.87955
GemmTunableOp_BFloat16_TN,tn_1024_4096_7168_ld_7168_7168_1024,Gemm_Rocblas_-1162085579,2.36674
GemmTunableOp_BFloat16_TN,tn_7168_1024_1024_ld_1024_1024_7168,Default,0.514103
GemmTunableOp_BFloat16_TN,tn_11264_7168_2048_ld_2048_2048_11264,Gemm_Rocblas_-1162085587,15.434
GemmTunableOp_BFloat16_TN,tn_5120_3072_12288_ld_12288_12288_5120,Default,20.4591
GemmTunableOp_BFloat16_TN,tn_4096_6144_15360_ld_15360_15360_4096,Gemm_Rocblas_-1162085575,33.8091
GemmTunableOp_BFloat16_TN,tn_9216_1024_15360_ld_15360_15360_9216,Gemm_Rocblas_-1162085572,12.3617
GemmTunableOp_BFloat16_TN,tn_12288_4096_1024_ld_1024_1024_12288,Gemm_Rocblas_-1162085569,3.59293
GemmTunableOp_BFloat16_TN,tn_12288_1024_4096_ld_4096_4096_12288,Gemm_Rocblas_-1162085591,4.65356
GemmTunableOp_BFloat16_TN,tn_5120_1024_4096_ld_4096_4096_5120,Gemm_Rocblas_-1162085590,1.90334
GemmTunableOp_BFloat16_TN,tn_8192_1024_13312_ld_13312_13312_8192,Gemm_Rocblas_-1162085580,9.41976
GemmTunableOp_BFloat16_TN,tn_3072_9216_11264_ld_11264_11264_3072,Gemm_Rocblas_-1162085592,26.923
GemmTunableOp_BFloat16_TN,tn_1024_2048_11264_ld_11264_11264_1024,Gemm_Rocblas_-1162085569,2.32573
GemmTunableOp_BFloat16_TN,tn_6144_1024_2048_ld_2048_2048_6144,Gemm_Rocblas_-1162085576,0.869035
GemmTunableOp_BFloat16_TN,tn_11264_1024_6144_ld_6144_6144_11264,Gemm_Rocblas_-1162085590,6.33314
GemmTunableOp_BFloat16_TN,tn_5120_2048_3072_ld_3072_3072_5120,Gemm_Rocblas_-1162085578,2.45966
GemmTunableOp_BFloat16_TN,tn_2048_5120_9216_ld_9216_9216_2048,Gemm_Rocblas_-1162085575,8.07096
GemmTunableOp_BFloat16_TN,tn_14336_2048_1024_ld_1024_1024_14336,Gemm_Rocblas_-1162085569,2.19218
GemmTunableOp_BFloat16_TN,tn_12288_1024_14336_ld_14336_14336_12288,Gemm_Rocblas_-1162085576,20.0011
GemmTunableOp_BFloat16_TN,tn_11264_1024_10240_ld_10240_10240_11264,Gemm_Rocblas_-1162085587,11.151
GemmTunableOp_BFloat16_TN,tn_11264_1024_8192_ld_8192_8192_11264,Gemm_Rocblas_-1162085591,8.2674
GemmTunableOp_BFloat16_TN,tn_12288_1024_5120_ld_5120_5120_12288,Gemm_Rocblas_-1162085587,4.95842
GemmTunableOp_BFloat16_TN,tn_15360_3072_15360_ld_15360_15360_15360,Gemm_Rocblas_-1162085580,62.0532
GemmTunableOp_BFloat16_TN,tn_15360_2048_4096_ld_4096_4096_15360,Gemm_Rocblas_-1162085590,11.2262
GemmTunableOp_BFloat16_TN,tn_5120_1024_7168_ld_7168_7168_5120,Gemm_Rocblas_-1162085587,2.88992
GemmTunableOp_BFloat16_TN,tn_14336_2048_14336_ld_14336_14336_14336,Gemm_Rocblas_-1162085581,43.981
GemmTunableOp_BFloat16_TN,tn_13312_7168_4096_ld_4096_4096_13312,Gemm_Rocblas_-1162085591,33.9847
GemmTunableOp_BFloat16_TN,tn_9216_1024_11264_ld_11264_11264_9216,Gemm_Rocblas_-1162085591,8.61513
GemmTunableOp_BFloat16_TN,tn_12288_4096_4096_ld_4096_4096_12288,Gemm_Rocblas_-1162085591,18.4992
GemmTunableOp_BFloat16_TN,tn_11264_1024_9216_ld_9216_9216_11264,Gemm_Rocblas_-1162085587,8.53361
GemmTunableOp_BFloat16_TN,tn_7168_1024_4096_ld_4096_4096_7168,Gemm_Rocblas_-1162085592,2.71821
GemmTunableOp_BFloat16_TN,tn_2048_2048_2048_ld_2048_2048_2048,Gemm_Rocblas_-1162085578,0.58129
GemmTunableOp_BFloat16_TN,tn_15360_2048_3072_ld_3072_3072_15360,Gemm_Rocblas_-1162085590,7.01827
GemmTunableOp_BFloat16_TN,tn_4096_8192_12288_ld_12288_12288_4096,Gemm_Rocblas_-1162085575,43.8358
GemmTunableOp_BFloat16_TN,tn_12288_4096_13312_ld_13312_13312_12288,Gemm_Rocblas_-1162085575,54.5494
GemmTunableOp_BFloat16_TN,tn_1024_7168_13312_ld_13312_13312_1024,Gemm_Rocblas_-1162085566,8.83098
GemmTunableOp_BFloat16_TN,tn_12288_1024_8192_ld_8192_8192_12288,Gemm_Rocblas_-1162085589,9.25093
GemmTunableOp_BFloat16_TN,tn_6144_1024_4096_ld_4096_4096_6144,Gemm_Rocblas_-1162085591,2.30355
GemmTunableOp_BFloat16_TN,tn_15360_3072_6144_ld_6144_6144_15360,Default,25.0703
GemmTunableOp_BFloat16_TN,tn_5120_8192_2048_ld_2048_2048_5120,Gemm_Rocblas_-1162085569,6.06086
GemmTunableOp_BFloat16_TN,tn_12288_1024_9216_ld_9216_9216_12288,Gemm_Rocblas_-1162085592,9.49416
GemmTunableOp_BFloat16_TN,tn_12288_8192_8192_ld_8192_8192_12288,Gemm_Rocblas_-1162085585,73.9226
GemmTunableOp_BFloat16_TN,tn_7168_4096_11264_ld_11264_11264_7168,Default,26.3009
GemmTunableOp_BFloat16_TN,tn_15360_7168_3072_ld_3072_3072_15360,Gemm_Rocblas_-1162085590,24.878
GemmTunableOp_BFloat16_TN,tn_9216_4096_4096_ld_4096_4096_9216,Gemm_Rocblas_-1162085592,13.7005
GemmTunableOp_BFloat16_TN,tn_4096_2048_2048_ld_2048_2048_4096,Gemm_Rocblas_-1162085569,1.21625
GemmTunableOp_BFloat16_TN,tn_3072_3072_15360_ld_15360_15360_3072,Gemm_Rocblas_-1162085575,13.4317
GemmTunableOp_BFloat16_TN,tn_10240_3072_11264_ld_11264_11264_10240,Gemm_Rocblas_-1162085592,29.8517
GemmTunableOp_BFloat16_TN,tn_7168_8192_12288_ld_12288_12288_7168,Gemm_Rocblas_-1162085592,73.579
GemmTunableOp_BFloat16_TN,tn_2048_7168_8192_ld_8192_8192_2048,Gemm_Rocblas_-1162085589,12.0875
GemmTunableOp_BFloat16_TN,tn_10240_1024_1024_ld_1024_1024_10240,Gemm_Rocblas_-1162085569,0.786415
GemmTunableOp_BFloat16_TN,tn_13312_6144_6144_ld_6144_6144_13312,Gemm_Rocblas_-1162085592,43.6657
GemmTunableOp_BFloat16_TN,tn_7168_3072_7168_ld_7168_7168_7168,Gemm_Rocblas_-1162085587,12.1327
GemmTunableOp_BFloat16_TN,tn_2048_5120_8192_ld_8192_8192_2048,Gemm_Rocblas_-1162085568,8.84688
GemmTunableOp_BFloat16_TN,tn_7168_2048_4096_ld_4096_4096_7168,Gemm_Rocblas_-1162085591,5.54346
GemmTunableOp_BFloat16_TN,tn_1024_4096_2048_ld_2048_2048_1024,Default,0.542933
GemmTunableOp_BFloat16_TN,tn_1024_7168_15360_ld_15360_15360_1024,Gemm_Rocblas_-1162085566,10.5731
GemmTunableOp_BFloat16_TN,tn_6144_1024_6144_ld_6144_6144_6144,Gemm_Rocblas_-1162085590,3.54638
GemmTunableOp_BFloat16_TN,tn_6144_7168_9216_ld_9216_9216_6144,Default,31.3982
GemmTunableOp_BFloat16_TN,tn_8192_1024_4096_ld_4096_4096_8192,Gemm_Rocblas_-1162085590,3.15811
GemmTunableOp_BFloat16_TN,tn_4096_4096_9216_ld_9216_9216_4096,Default,12.7146
GemmTunableOp_BFloat16_TN,tn_8192_3072_8192_ld_8192_8192_8192,Gemm_Rocblas_-1162085591,19.1701
GemmTunableOp_BFloat16_TN,tn_4096_2048_6144_ld_6144_6144_4096,Gemm_Rocblas_-1162085590,5.05437
GemmTunableOp_BFloat16_TN,tn_6144_1024_5120_ld_5120_5120_6144,Gemm_Rocblas_-1162085592,2.52655
GemmTunableOp_BFloat16_TN,tn_7168_1024_6144_ld_6144_6144_7168,Gemm_Rocblas_-1162085590,4.16312
GemmTunableOp_BFloat16_TN,tn_1024_6144_12288_ld_12288_12288_1024,Gemm_Rocblas_-1162085570,8.71047
GemmTunableOp_BFloat16_TN,tn_4096_512_4096_ld_4096_4096_4096,Gemm_Rocblas_-1162085579,0.950681
GemmTunableOp_BFloat16_TN,tn_6144_1024_15360_ld_15360_15360_6144,Gemm_Rocblas_-1162085578,8.45853
GemmTunableOp_BFloat16_TN,tn_6144_1024_7168_ld_7168_7168_6144,Gemm_Rocblas_-1162085585,3.5562
GemmTunableOp_BFloat16_TN,tn_10240_1024_12288_ld_12288_12288_10240,Gemm_Rocblas_-1162085590,13.5719
GemmTunableOp_BFloat16_TN,tn_6144_5120_10240_ld_10240_10240_6144,Default,31.4583
GemmTunableOp_BFloat16_TN,tn_11264_1024_2048_ld_2048_2048_11264,Default,2.31643
GemmTunableOp_BFloat16_TN,tn_2048_9216_3072_ld_3072_3072_2048,Gemm_Rocblas_-1162085590,4.19886
GemmTunableOp_BFloat16_TN,tn_10240_4096_11264_ld_11264_11264_10240,Gemm_Rocblas_-1162085592,38.5431
GemmTunableOp_BFloat16_TN,tn_4096_4096_2048_ld_2048_2048_4096,Gemm_Rocblas_-1162085567,2.51916
GemmTunableOp_BFloat16_TN,tn_7168_7168_6144_ld_6144_6144_7168,Default,28.0766
GemmTunableOp_BFloat16_TN,tn_9216_4096_15360_ld_15360_15360_9216,Gemm_Rocblas_-1162085575,49.6577
GemmTunableOp_BFloat16_TN,tn_4096_1024_7168_ld_7168_7168_4096,Gemm_Rocblas_-1162085591,2.50601
GemmTunableOp_BFloat16_TN,tn_1024_1024_3072_ld_3072_3072_1024,Gemm_Rocblas_-1162085569,0.216237
GemmTunableOp_BFloat16_TN,tn_8192_9216_5120_ld_5120_5120_8192,Gemm_Rocblas_-1162085587,28.8816
GemmTunableOp_BFloat16_TN,tn_4096_8448_4096_ld_4096_4096_4096,Gemm_Rocblas_-1162085591,15.8648
GemmTunableOp_BFloat16_TN,tn_8192_4096_4096_ld_4096_4096_8192,Gemm_Rocblas_-1162085591,12.473
GemmTunableOp_BFloat16_TN,tn_1024_7168_11264_ld_11264_11264_1024,Gemm_Rocblas_-1162085566,7.40153
GemmTunableOp_BFloat16_TN,tn_13312_5120_11264_ld_11264_11264_13312,Default,61.3014
GemmTunableOp_BFloat16_TN,tn_13312_2048_11264_ld_11264_11264_13312,Gemm_Rocblas_-1162085587,24.9131
GemmTunableOp_BFloat16_TN,tn_10240_3072_10240_ld_10240_10240_10240,Default,30.8438
GemmTunableOp_BFloat16_TN,tn_4096_13056_4096_ld_4096_4096_4096,Gemm_Rocblas_-1162085569,20.9311
GemmTunableOp_BFloat16_TN,tn_9216_1024_4096_ld_4096_4096_9216,Gemm_Rocblas_-1162085591,3.41143
GemmTunableOp_BFloat16_TN,tn_10240_3072_14336_ld_14336_14336_10240,Gemm_Rocblas_-1162085575,47.2436
GemmTunableOp_BFloat16_TN,tn_12288_7168_7168_ld_7168_7168_12288,Gemm_Rocblas_-1162085587,47.8588
GemmTunableOp_BFloat16_TN,tn_10240_1024_9216_ld_9216_9216_10240,Gemm_Rocblas_-1162085587,7.74506
GemmTunableOp_BFloat16_TN,tn_10240_1024_8192_ld_8192_8192_10240,Default,7.64049
GemmTunableOp_BFloat16_TN,tn_9216_1024_9216_ld_9216_9216_9216,Gemm_Rocblas_-1162085582,6.79031
GemmTunableOp_BFloat16_TN,tn_7168_7168_2048_ld_2048_2048_7168,Gemm_Rocblas_-1162085569,7.84612
GemmTunableOp_BFloat16_TN,tn_8192_1024_9216_ld_9216_9216_8192,Gemm_Rocblas_-1162085592,6.22932
GemmTunableOp_BFloat16_TN,tn_8192_1024_1024_ld_1024_1024_8192,Default,0.597455
GemmTunableOp_BFloat16_TN,tn_11264_1024_1024_ld_1024_1024_11264,Default,0.870965
GemmTunableOp_BFloat16_TN,tn_4096_2048_11264_ld_11264_11264_4096,Gemm_Rocblas_-1162085587,8.42253
GemmTunableOp_BFloat16_TN,tn_13312_1024_3072_ld_3072_3072_13312,Gemm_Rocblas_-1162085590,3.1928
GemmTunableOp_BFloat16_TN,tn_13312_8192_7168_ld_7168_7168_13312,Default,58.3261
GemmTunableOp_BFloat16_TN,tn_4096_15872_4096_ld_4096_4096_4096,Gemm_Rocblas_-1162085591,25.0161
GemmTunableOp_BFloat16_TN,tn_13312_3072_6144_ld_6144_6144_13312,Default,21.5401
GemmTunableOp_BFloat16_TN,tn_8192_6144_7168_ld_7168_7168_8192,Default,27.2466
GemmTunableOp_BFloat16_TN,tn_7168_1024_14336_ld_14336_14336_7168,Gemm_Rocblas_-1162085576,12.6603
GemmTunableOp_BFloat16_TN,tn_4096_8960_4096_ld_4096_4096_4096,Gemm_Rocblas_-1162085585,16.8981
GemmTunableOp_BFloat16_TN,tn_11264_1024_15360_ld_15360_15360_11264,Gemm_Rocblas_-1162085580,15.1327
GemmTunableOp_BFloat16_TN,tn_4096_4096_8192_ld_8192_8192_4096,Gemm_Rocblas_-1162085591,13.0236
GemmTunableOp_BFloat16_TN,tn_8192_1024_5120_ld_5120_5120_8192,Gemm_Rocblas_-1162085592,3.27917
GemmTunableOp_BFloat16_TN,tn_2048_6144_12288_ld_12288_12288_2048,Gemm_Rocblas_-1162085591,18.2758
GemmTunableOp_BFloat16_TN,tn_8192_1024_3072_ld_3072_3072_8192,Gemm_Rocblas_-1162085590,2.04344
GemmTunableOp_BFloat16_TN,tn_14336_4096_5120_ld_5120_5120_14336,Gemm_Rocblas_-1162085592,22.4985
GemmTunableOp_BFloat16_TN,tn_13312_8192_6144_ld_6144_6144_13312,Gemm_Rocblas_-1162085587,57.4471
GemmTunableOp_BFloat16_TN,tn_8192_2048_8192_ld_8192_8192_8192,Gemm_Rocblas_-1162085590,12.8661
GemmTunableOp_BFloat16_TN,tn_8192_1024_2048_ld_2048_2048_8192,Gemm_Rocblas_-1162085569,1.50678
GemmTunableOp_BFloat16_TN,tn_4096_2048_12288_ld_12288_12288_4096,Gemm_Rocblas_-1162085592,11.6271
GemmTunableOp_BFloat16_TN,tn_1024_3072_1024_ld_1024_1024_1024,Gemm_Rocblas_-1162085567,0.208155
GemmTunableOp_BFloat16_TN,tn_1024_3072_5120_ld_5120_5120_1024,Gemm_Rocblas_-1162085578,1.2586
GemmTunableOp_BFloat16_TN,tn_6144_4096_11264_ld_11264_11264_6144,Default,22.9354
GemmTunableOp_BFloat16_TN,tn_6144_1024_11264_ld_11264_11264_6144,Gemm_Rocblas_-1162085576,6.03587
GemmTunableOp_BFloat16_TN,tn_4096_2048_15360_ld_15360_15360_4096,Gemm_Rocblas_-1162085575,12.1598
GemmTunableOp_BFloat16_TN,tn_3072_2048_8192_ld_8192_8192_3072,Gemm_Rocblas_-1162085589,5.10292
GemmTunableOp_BFloat16_TN,tn_3072_6144_13312_ld_13312_13312_3072,Default,21.3639
GemmTunableOp_BFloat16_TN,tn_4096_8192_4096_ld_4096_4096_4096,Gemm_Rocblas_-1162085591,15.2742
GemmTunableOp_BFloat16_TN,tn_13312_4096_12288_ld_12288_12288_13312,Gemm_Rocblas_-1162085592,66.9269
GemmTunableOp_BFloat16_TN,tn_1024_5120_14336_ld_14336_14336_1024,Gemm_Rocblas_-1162085570,8.83306
GemmTunableOp_BFloat16_TN,tn_12288_1024_13312_ld_13312_13312_12288,Gemm_Rocblas_-1162085575,13.8988
GemmTunableOp_BFloat16_TN,tn_12288_8192_7168_ld_7168_7168_12288,Default,53.7609
GemmTunableOp_BFloat16_TN,tn_7168_1024_12288_ld_12288_12288_7168,Gemm_Rocblas_-1162085591,9.3155
GemmTunableOp_BFloat16_TN,tn_14336_7168_13312_ld_13312_13312_14336,Gemm_Rocblas_-1162085575,110.9
GemmTunableOp_BFloat16_TN,tn_10240_4096_10240_ld_10240_10240_10240,Default,40.56
GemmTunableOp_BFloat16_TN,tn_7168_2048_6144_ld_6144_6144_7168,Gemm_Rocblas_-1162085592,8.3662
GemmTunableOp_BFloat16_TN,tn_7168_5120_8192_ld_8192_8192_7168,Gemm_Rocblas_-1162085587,26.2106
GemmTunableOp_BFloat16_TN,tn_5120_1024_10240_ld_10240_10240_5120,Gemm_Rocblas_-1162085592,5.27669
GemmTunableOp_BFloat16_TN,tn_11264_1024_13312_ld_13312_13312_11264,Gemm_Rocblas_-1162085587,12.5187
GemmTunableOp_BFloat16_TN,tn_9216_2048_13312_ld_13312_13312_9216,Gemm_Rocblas_-1162085575,20.6099
GemmTunableOp_BFloat16_TN,tn_7168_1024_10240_ld_10240_10240_7168,Gemm_Rocblas_-1162085587,7.40033
GemmTunableOp_BFloat16_TN,tn_4096_13568_4096_ld_4096_4096_4096,Gemm_Rocblas_-1162085590,21.6223
GemmTunableOp_BFloat16_TN,tn_10240_2048_11264_ld_11264_11264_10240,Gemm_Rocblas_-1162085575,19.7913
GemmTunableOp_BFloat16_TN,tn_7168_3072_15360_ld_15360_15360_7168,Gemm_Rocblas_-1162085575,30.3092
GemmTunableOp_BFloat16_TN,tn_5120_7168_12288_ld_12288_12288_5120,Gemm_Rocblas_-1162085580,47.6293
GemmTunableOp_BFloat16_TN,tn_4096_10752_4096_ld_4096_4096_4096,Gemm_Rocblas_-1162085592,19.9473
GemmTunableOp_BFloat16_TN,tn_10240_5120_7168_ld_7168_7168_10240,Gemm_Rocblas_-1162085587,28.3785
GemmTunableOp_BFloat16_TN,tn_15360_1024_11264_ld_11264_11264_15360,Gemm_Rocblas_-1162085575,15.2172
GemmTunableOp_BFloat16_TN,tn_9216_7168_7168_ld_7168_7168_9216,Default,35.3968
GemmTunableOp_BFloat16_TN,tn_7168_1024_7168_ld_7168_7168_7168,Gemm_Rocblas_-1162085590,4.27882
GemmTunableOp_BFloat16_TN,tn_5120_4096_5120_ld_5120_5120_5120,Gemm_Rocblas_-1162085592,7.90862
GemmTunableOp_BFloat16_TN,tn_10240_1024_5120_ld_5120_5120_10240,Gemm_Rocblas_-1162085587,4.0346
GemmTunableOp_BFloat16_TN,tn_13312_2048_5120_ld_5120_5120_13312,Default,10.6562
GemmTunableOp_BFloat16_TN,tn_1024_3072_4096_ld_4096_4096_1024,Gemm_Rocblas_-1162085567,1.01094
GemmTunableOp_BFloat16_TN,tn_2048_7168_14336_ld_14336_14336_2048,Gemm_Rocblas_-1162085573,25.5877
GemmTunableOp_BFloat16_TN,tn_6144_4096_12288_ld_12288_12288_6144,Gemm_Rocblas_-1162085575,32.2722
GemmTunableOp_BFloat16_TN,tn_12288_5120_14336_ld_14336_14336_12288,Gemm_Rocblas_-1162085581,94.942
GemmTunableOp_BFloat16_TN,tn_6144_1024_3072_ld_3072_3072_6144,Gemm_Rocblas_-1162085592,1.52088
GemmTunableOp_BFloat16_TN,tn_4096_2048_13312_ld_13312_13312_4096,Gemm_Rocblas_-1162085575,10.2297
GemmTunableOp_BFloat16_TN,tn_15360_7168_12288_ld_12288_12288_15360,Gemm_Rocblas_-1162085575,133.398
GemmTunableOp_BFloat16_TN,tn_1024_3072_14336_ld_14336_14336_1024,Gemm_Rocblas_-1162085570,5.84016
GemmTunableOp_BFloat16_TN,tn_14336_5120_5120_ld_5120_5120_14336,Default,28.0292
GemmTunableOp_BFloat16_TN,tn_4096_9216_4096_ld_4096_4096_4096,Gemm_Rocblas_-1162085590,17.3894
GemmTunableOp_BFloat16_TN,tn_2048_1024_1024_ld_1024_1024_2048,Gemm_Rocblas_-1162085567,0.131033
GemmTunableOp_BFloat16_TN,tn_4096_19200_4096_ld_4096_4096_4096,Gemm_Rocblas_-1162085591,30.2948
GemmTunableOp_BFloat16_TN,tn_4096_3072_2048_ld_2048_2048_4096,Gemm_Rocblas_-1162085569,1.76176
GemmTunableOp_BFloat16_TN,tn_8192_7168_12288_ld_12288_12288_8192,Gemm_Rocblas_-1162085575,73.9545
GemmTunableOp_BFloat16_TN,tn_4096_17152_4096_ld_4096_4096_4096,Gemm_Rocblas_-1162085585,27.305
GemmTunableOp_BFloat16_TN,tn_8192_8192_7168_ld_7168_7168_8192,Default,36.8702
GemmTunableOp_BFloat16_TN,tn_8192_1024_12288_ld_12288_12288_8192,Gemm_Rocblas_-1162085592,10.713
GemmTunableOp_BFloat16_TN,tn_10240_1024_7168_ld_7168_7168_10240,Default,5.86166
GemmTunableOp_BFloat16_TN,tn_4096_15616_4096_ld_4096_4096_4096,Gemm_Rocblas_-1162085569,24.8009
GemmTunableOp_BFloat16_TN,tn_7168_6144_11264_ld_11264_11264_7168,Gemm_Rocblas_-1162085592,39.8048
GemmTunableOp_BFloat16_TN,tn_5120_5120_14336_ld_14336_14336_5120,Gemm_Rocblas_-1162085580,41.2075
GemmTunableOp_BFloat16_TN,tn_8192_2048_12288_ld_12288_12288_8192,Gemm_Rocblas_-1162085580,21.8351
GemmTunableOp_BFloat16_TN,tn_12288_8192_13312_ld_13312_13312_12288,Gemm_Rocblas_-1162085575,111.739
GemmTunableOp_BFloat16_TN,tn_8192_5120_13312_ld_13312_13312_8192,Gemm_Rocblas_-1162085575,46.3148
GemmTunableOp_BFloat16_TN,tn_10240_4096_9216_ld_9216_9216_10240,Default,29.9069
GemmTunableOp_BFloat16_TN,tn_5120_4096_11264_ld_11264_11264_5120,Default,19.7957
GemmTunableOp_BFloat16_TN,tn_10240_4096_14336_ld_14336_14336_10240,Gemm_Rocblas_-1162085580,64.1824
GemmTunableOp_BFloat16_TN,tn_4096_11520_4096_ld_4096_4096_4096,Gemm_Rocblas_-1162085592,21.4695
GemmTunableOp_BFloat16_TN,tn_15360_5120_7168_ld_7168_7168_15360,Default,41.6423
GemmTunableOp_BFloat16_TN,tn_8192_2048_3072_ld_3072_3072_8192,Gemm_Rocblas_-1162085578,3.99585
GemmTunableOp_BFloat16_TN,tn_1024_3072_11264_ld_11264_11264_1024,Gemm_Rocblas_-1162085567,3.2105
GemmTunableOp_BFloat16_TN,tn_5120_9216_11264_ld_11264_11264_5120,Gemm_Rocblas_-1162085592,43.6195
GemmTunableOp_BFloat16_TN,tn_3072_6144_12288_ld_12288_12288_3072,Gemm_Rocblas_-1162085592,24.9722
GemmTunableOp_BFloat16_TN,tn_7168_2048_12288_ld_12288_12288_7168,Gemm_Rocblas_-1162085581,19.3915
GemmTunableOp_BFloat16_TN,tn_5120_5120_3072_ld_3072_3072_5120,Gemm_Rocblas_-1162085578,5.95589
GemmTunableOp_BFloat16_TN,tn_13312_1024_4096_ld_4096_4096_13312,Gemm_Rocblas_-1162085585,4.97688
GemmTunableOp_BFloat16_TN,tn_10240_2048_12288_ld_12288_12288_10240,Default,27.5037
GemmTunableOp_BFloat16_TN,tn_12288_3072_13312_ld_13312_13312_12288,Gemm_Rocblas_-1162085575,42.6518
GemmTunableOp_BFloat16_TN,tn_1024_1024_4096_ld_4096_4096_1024,Gemm_Rocblas_-1162085567,0.261655
GemmTunableOp_BFloat16_TN,tn_9216_7168_4096_ld_4096_4096_9216,Gemm_Rocblas_-1162085590,23.7728
GemmTunableOp_BFloat16_TN,tn_6144_2048_12288_ld_12288_12288_6144,Gemm_Rocblas_-1162085592,16.8622
GemmTunableOp_BFloat16_TN,tn_7168_5120_4096_ld_4096_4096_7168,Gemm_Rocblas_-1162085590,13.4259
GemmTunableOp_BFloat16_TN,tn_12288_1024_3072_ld_3072_3072_12288,Gemm_Rocblas_-1162085592,2.98446
GemmTunableOp_BFloat16_TN,tn_10240_8192_4096_ld_4096_4096_10240,Gemm_Rocblas_-1162085590,30.7385
GemmTunableOp_BFloat16_TN,tn_4096_1280_4096_ld_4096_4096_4096,Gemm_Rocblas_-1162085590,2.17971
GemmTunableOp_BFloat16_TN,tn_3072_5120_2048_ld_2048_2048_3072,Gemm_Rocblas_-1162085569,2.38922
GemmTunableOp_BFloat16_TN,tn_12288_1024_11264_ld_11264_11264_12288,Gemm_Rocblas_-1162085575,12.2674
GemmTunableOp_BFloat16_TN,tn_4096_3328_4096_ld_4096_4096_4096,Gemm_Rocblas_-1162085569,6.03835
GemmTunableOp_BFloat16_TN,tn_4096_14336_4096_ld_4096_4096_4096,Gemm_Rocblas_-1162085591,22.7157
GemmTunableOp_BFloat16_TN,tn_1024_3072_6144_ld_6144_6144_1024,Gemm_Rocblas_-1162085570,1.75721
GemmTunableOp_BFloat16_TN,tn_5120_3072_7168_ld_7168_7168_5120,Default,8.28527
GemmTunableOp_BFloat16_TN,tn_3072_6144_4096_ld_4096_4096_3072,Gemm_Rocblas_-1162085569,5.95584
GemmTunableOp_BFloat16_TN,tn_9216_1024_12288_ld_12288_12288_9216,Gemm_Rocblas_-1162085591,11.8557
GemmTunableOp_BFloat16_TN,tn_12288_4096_8192_ld_8192_8192_12288,Gemm_Rocblas_-1162085585,37.2381
GemmTunableOp_BFloat16_TN,tn_1024_1024_2048_ld_2048_2048_1024,Gemm_Rocblas_-1162085569,0.124191
GemmTunableOp_BFloat16_TN,tn_4096_2816_4096_ld_4096_4096_4096,Gemm_Rocblas_-1162085569,5.12777
GemmTunableOp_BFloat16_TN,tn_12288_3072_3072_ld_3072_3072_12288,Gemm_Rocblas_-1162085590,8.48583
GemmTunableOp_BFloat16_TN,tn_5120_2048_11264_ld_11264_11264_5120,Gemm_Rocblas_-1162085575,10.333
GemmTunableOp_BFloat16_TN,tn_2048_9216_1024_ld_1024_1024_2048,Gemm_Rocblas_-1162085569,1.4123
GemmTunableOp_BFloat16_TN,tn_2048_2048_8192_ld_8192_8192_2048,Gemm_Rocblas_-1162085590,3.76797
GemmTunableOp_BFloat16_TN,tn_2048_1024_15360_ld_15360_15360_2048,Gemm_Rocblas_-1162085578,3.46055
GemmTunableOp_BFloat16_TN,tn_9216_6144_14336_ld_14336_14336_9216,Gemm_Rocblas_-1162085580,85.8416
GemmTunableOp_BFloat16_TN,tn_9216_1024_7168_ld_7168_7168_9216,Gemm_Rocblas_-1162085587,5.32365
GemmTunableOp_BFloat16_TN,tn_9216_1024_10240_ld_10240_10240_9216,Gemm_Rocblas_-1162085590,9.10822
GemmTunableOp_BFloat16_TN,tn_4096_12544_4096_ld_4096_4096_4096,Gemm_Rocblas_-1162085590,19.871
GemmTunableOp_BFloat16_TN,tn_6144_2048_7168_ld_7168_7168_6144,Default,7.24515
GemmTunableOp_BFloat16_TN,tn_3072_2048_4096_ld_4096_4096_3072,Gemm_Rocblas_-1162085569,1.97607
GemmTunableOp_BFloat16_TN,tn_13312_1024_5120_ld_5120_5120_13312,Gemm_Rocblas_-1162085590,5.45506
GemmTunableOp_BFloat16_TN,tn_12288_3072_14336_ld_14336_14336_12288,Gemm_Rocblas_-1162085580,55.423
GemmTunableOp_BFloat16_TN,tn_7168_3072_10240_ld_10240_10240_7168,Gemm_Rocblas_-1162085592,21.3518
GemmTunableOp_BFloat16_TN,tn_5120_1024_1024_ld_1024_1024_5120,Default,0.351241
GemmTunableOp_BFloat16_TN,tn_6144_1024_1024_ld_1024_1024_6144,Default,0.423726
GemmTunableOp_BFloat16_TN,tn_4096_6144_14336_ld_14336_14336_4096,Gemm_Rocblas_-1162085575,40.0108
GemmTunableOp_BFloat16_TN,tn_4096_10496_4096_ld_4096_4096_4096,Gemm_Rocblas_-1162085590,19.7139
GemmTunableOp_BFloat16_TN,tn_15360_4096_1024_ld_1024_1024_15360,Gemm_Rocblas_-1162085569,4.6186
GemmTunableOp_BFloat16_TN,tn_6144_3072_10240_ld_10240_10240_6144,Default,19.0399
GemmTunableOp_BFloat16_TN,tn_14336_5120_2048_ld_2048_2048_14336,Gemm_Hipblaslt_502,14.2395
GemmTunableOp_BFloat16_TN,tn_4096_2560_4096_ld_4096_4096_4096,Gemm_Rocblas_-1162085567,4.66566
GemmTunableOp_BFloat16_TN,tn_8192_2048_6144_ld_6144_6144_8192,Default,9.34909
GemmTunableOp_BFloat16_TN,tn_8192_7168_9216_ld_9216_9216_8192,Gemm_Rocblas_-1162085575,41.7069
GemmTunableOp_BFloat16_TN,tn_12288_2048_6144_ld_6144_6144_12288,Default,14.0715
GemmTunableOp_BFloat16_TN,tn_3072_5120_5120_ld_5120_5120_3072,Gemm_Rocblas_-1162085592,6.33321
GemmTunableOp_BFloat16_TN,tn_10240_1024_14336_ld_14336_14336_10240,Gemm_Rocblas_-1162085579,16.8874
GemmTunableOp_BFloat16_TN,tn_4096_6656_4096_ld_4096_4096_4096,Gemm_Rocblas_-1162085592,12.4768
GemmTunableOp_BFloat16_TN,tn_3072_1024_8192_ld_8192_8192_3072,Gemm_Rocblas_-1162085588,2.29884
GemmTunableOp_BFloat16_TN,tn_13312_4096_8192_ld_8192_8192_13312,Gemm_Rocblas_-1162085591,38.5655
GemmTunableOp_BFloat16_TN,tn_1024_1024_8192_ld_8192_8192_1024,Gemm_Rocblas_-1162085578,0.65763
GemmTunableOp_BFloat16_TN,tn_10240_1024_13312_ld_13312_13312_10240,Gemm_Rocblas_-1162085575,10.6906
GemmTunableOp_BFloat16_TN,tn_9216_1024_6144_ld_6144_6144_9216,Gemm_Rocblas_-1162085588,5.19777
GemmTunableOp_BFloat16_TN,tn_3072_1024_13312_ld_13312_13312_3072,Gemm_Rocblas_-1162085579,3.74642
GemmTunableOp_BFloat16_TN,tn_1024_6144_6144_ld_6144_6144_1024,Gemm_Rocblas_-1162085575,3.58019
GemmTunableOp_BFloat16_TN,tn_4096_6912_4096_ld_4096_4096_4096,Gemm_Rocblas_-1162085592,13.1003
GemmTunableOp_BFloat16_TN,tn_9216_6144_1024_ld_1024_1024_9216,Gemm_Rocblas_-1162085569,4.0074
GemmTunableOp_BFloat16_TN,tn_6144_6144_15360_ld_15360_15360_6144,Gemm_Rocblas_-1162085575,49.5812
GemmTunableOp_BFloat16_TN,tn_12288_3072_10240_ld_10240_10240_12288,Gemm_Rocblas_-1162085592,36.8347
GemmTunableOp_BFloat16_TN,tn_11264_3072_5120_ld_5120_5120_11264,Default,12.8218
GemmTunableOp_BFloat16_TN,tn_1024_6144_9216_ld_9216_9216_1024,Gemm_Rocblas_-1162085570,4.66157
GemmTunableOp_BFloat16_TN,tn_4096_5632_4096_ld_4096_4096_4096,Gemm_Rocblas_-1162085592,10.5465
GemmTunableOp_BFloat16_TN,tn_5120_4096_15360_ld_15360_15360_5120,Gemm_Rocblas_-1162085580,27.3821
GemmTunableOp_BFloat16_TN,tn_8192_1024_7168_ld_7168_7168_8192,Gemm_Rocblas_-1162085587,4.68279
GemmTunableOp_BFloat16_TN,tn_4096_4352_4096_ld_4096_4096_4096,Gemm_Rocblas_-1162085566,8.10899
GemmTunableOp_BFloat16_TN,tn_8192_7168_1024_ld_1024_1024_8192,Gemm_Rocblas_-1162085569,4.20286
GemmTunableOp_BFloat16_TN,tn_4096_18432_4096_ld_4096_4096_4096,Gemm_Rocblas_-1162085590,29.0859
GemmTunableOp_BFloat16_TN,tn_11264_7168_5120_ld_5120_5120_11264,Default,30.4855
GemmTunableOp_BFloat16_TN,tn_7168_2048_2048_ld_2048_2048_7168,Gemm_Rocblas_-1162085569,2.22423
GemmTunableOp_BFloat16_TN,tn_1024_2048_5120_ld_5120_5120_1024,Gemm_Rocblas_-1162085578,0.852109
GemmTunableOp_BFloat16_TN,tn_8192_1024_14336_ld_14336_14336_8192,Gemm_Rocblas_-1162085577,14.2841
GemmTunableOp_BFloat16_TN,tn_7168_4096_8192_ld_8192_8192_7168,Gemm_Rocblas_-1162085585,21.7726
GemmTunableOp_BFloat16_TN,tn_15360_4096_14336_ld_14336_14336_15360,Gemm_Rocblas_-1162085581,93.384
GemmTunableOp_BFloat16_TN,tn_11264_2048_10240_ld_10240_10240_11264,Default,22.1863
GemmTunableOp_BFloat16_TN,tn_9216_1024_14336_ld_14336_14336_9216,Gemm_Rocblas_-1162085579,14.8702
GemmTunableOp_BFloat16_TN,tn_10240_7168_7168_ld_7168_7168_10240,Default,39.6931
GemmTunableOp_BFloat16_TN,tn_9216_1024_5120_ld_5120_5120_9216,Gemm_Rocblas_-1162085591,3.68292
GemmTunableOp_BFloat16_TN,tn_4096_1024_9216_ld_9216_9216_4096,Gemm_Rocblas_-1162085590,3.30599
GemmTunableOp_BFloat16_TN,tn_6144_6144_3072_ld_3072_3072_6144,Gemm_Rocblas_-1162085592,8.7797
GemmTunableOp_BFloat16_TN,tn_14336_2048_12288_ld_12288_12288_14336,Gemm_Rocblas_-1162085580,37.2169
GemmTunableOp_BFloat16_TN,tn_14336_4096_2048_ld_2048_2048_14336,Gemm_Hipblaslt_502,11.4617
GemmTunableOp_BFloat16_TN,tn_4096_7680_4096_ld_4096_4096_4096,Gemm_Rocblas_-1162085592,14.5159
GemmTunableOp_BFloat16_TN,tn_13312_5120_14336_ld_14336_14336_13312,Gemm_Rocblas_-1162085581,100.903
GemmTunableOp_BFloat16_TN,tn_2048_1024_6144_ld_6144_6144_2048,Gemm_Hipblaslt_502,1.10149
GemmTunableOp_BFloat16_TN,tn_13312_6144_7168_ld_7168_7168_13312,Default,43.751
GemmTunableOp_BFloat16_TN,tn_5120_1024_9216_ld_9216_9216_5120,Gemm_Rocblas_-1162085585,3.93538
GemmTunableOp_BFloat16_TN,tn_12288_7168_5120_ld_5120_5120_12288,Default,33.7623
GemmTunableOp_BFloat16_TN,tn_3072_3072_2048_ld_2048_2048_3072,Gemm_Rocblas_-1162085569,1.34899
GemmTunableOp_BFloat16_TN,tn_14336_2048_13312_ld_13312_13312_14336,Gemm_Rocblas_-1162085592,33.9252
GemmTunableOp_BFloat16_TN,tn_4096_7424_4096_ld_4096_4096_4096,Gemm_Rocblas_-1162085590,14.0013
GemmTunableOp_BFloat16_TN,tn_2048_1024_8192_ld_8192_8192_2048,Gemm_Rocblas_-1162085591,1.63788
GemmTunableOp_BFloat16_TN,tn_2048_3072_14336_ld_14336_14336_2048,Gemm_Rocblas_-1162085590,11.8932
GemmTunableOp_BFloat16_TN,tn_2048_6144_2048_ld_2048_2048_2048,Gemm_Rocblas_-1162085569,1.94178
GemmTunableOp_BFloat16_TN,tn_2048_3072_10240_ld_10240_10240_2048,Gemm_Rocblas_-1162085589,7.54307
GemmTunableOp_BFloat16_TN,tn_4096_13824_4096_ld_4096_4096_4096,Gemm_Rocblas_-1162085591,22.2361
GemmTunableOp_BFloat16_TN,tn_7168_1024_8192_ld_8192_8192_7168,Gemm_Rocblas_-1162085587,5.52101
GemmTunableOp_BFloat16_TN,tn_11264_1024_14336_ld_14336_14336_11264,Gemm_Rocblas_-1162085575,18.3497
GemmTunableOp_BFloat16_TN,tn_4096_9984_4096_ld_4096_4096_4096,Gemm_Rocblas_-1162085592,18.8029
GemmTunableOp_BFloat16_TN,tn_9216_7168_10240_ld_10240_10240_9216,Default,62.027
GemmTunableOp_BFloat16_TN,tn_1024_1024_1024_ld_1024_1024_1024,Gemm_Rocblas_-1162085569,0.0657932
GemmTunableOp_BFloat16_TN,tn_4096_14080_4096_ld_4096_4096_4096,Gemm_Rocblas_-1162085591,22.2172
GemmTunableOp_BFloat16_TN,tn_2048_1024_9216_ld_9216_9216_2048,Gemm_Rocblas_-1162085592,1.74605
GemmTunableOp_BFloat16_TN,tn_12288_5120_10240_ld_10240_10240_12288,Gemm_Rocblas_-1162085587,59.2975
GemmTunableOp_BFloat16_TN,tn_1024_3072_13312_ld_13312_13312_1024,Gemm_Rocblas_-1162085575,3.9551
GemmTunableOp_BFloat16_TN,tn_10240_4096_6144_ld_6144_6144_10240,Gemm_Rocblas_-1162085592,23.1997
GemmTunableOp_BFloat16_TN,tn_11264_5120_2048_ld_2048_2048_11264,Gemm_Hipblaslt_502,10.9533
GemmTunableOp_BFloat16_TN,tn_4096_14592_4096_ld_4096_4096_4096,Gemm_Rocblas_-1162085590,23.349
GemmTunableOp_BFloat16_TN,tn_4096_13312_4096_ld_4096_4096_4096,Gemm_Rocblas_-1162085590,21.2579
GemmTunableOp_BFloat16_TN,tn_7168_2048_10240_ld_10240_10240_7168,Gemm_Rocblas_-1162085587,14.4923
GemmTunableOp_BFloat16_TN,tn_4096_18944_4096_ld_4096_4096_4096,Gemm_Rocblas_-1162085591,29.5217
GemmTunableOp_BFloat16_TN,tn_4096_2048_4096_ld_4096_4096_4096,Gemm_Rocblas_-1162085569,3.75375
GemmTunableOp_BFloat16_TN,tn_12288_8192_2048_ld_2048_2048_12288,Gemm_Hipblaslt_502,19.2027
GemmTunableOp_BFloat16_TN,tn_13312_6144_4096_ld_4096_4096_13312,Gemm_Rocblas_-1162085590,29.05
GemmTunableOp_BFloat16_TN,tn_15360_2048_8192_ld_8192_8192_15360,Gemm_Rocblas_-1162085592,22.7144
GemmTunableOp_BFloat16_TN,tn_5120_1024_6144_ld_6144_6144_5120,Gemm_Rocblas_-1162085588,2.91148
GemmTunableOp_BFloat16_TN,tn_1024_5120_2048_ld_2048_2048_1024,Gemm_Rocblas_-1162085569,0.680077
GemmTunableOp_BFloat16_TN,tn_11264_2048_13312_ld_13312_13312_11264,Gemm_Rocblas_-1162085580,25.9445
GemmTunableOp_BFloat16_TN,tn_12288_4096_11264_ld_11264_11264_12288,Gemm_Rocblas_-1162085580,45.3843
GemmTunableOp_BFloat16_TN,tn_14336_7168_1024_ld_1024_1024_14336,Gemm_Rocblas_-1162085569,7.39192
GemmTunableOp_BFloat16_TN,tn_4096_12800_4096_ld_4096_4096_4096,Gemm_Rocblas_-1162085569,20.5886
GemmTunableOp_BFloat16_TN,tn_12288_6144_14336_ld_14336_14336_12288,Gemm_Rocblas_-1162085580,110.621
GemmTunableOp_BFloat16_TN,tn_4096_17664_4096_ld_4096_4096_4096,Gemm_Rocblas_-1162085591,28.2535
GemmTunableOp_BFloat16_TN,tn_13312_2048_14336_ld_14336_14336_13312,Gemm_Rocblas_-1162085592,44.2411
GemmTunableOp_BFloat16_TN,tn_14336_8192_6144_ld_6144_6144_14336,Gemm_Rocblas_-1162085592,63.4489
GemmTunableOp_BFloat16_TN,tn_4096_2048_5120_ld_5120_5120_4096,Default,3.44552
GemmTunableOp_BFloat16_TN,tn_2048_2048_14336_ld_14336_14336_2048,Gemm_Rocblas_-1162085569,8.22094
GemmTunableOp_BFloat16_TN,tn_2048_5120_6144_ld_6144_6144_2048,Gemm_Rocblas_-1162085566,5.52607
GemmTunableOp_BFloat16_TN,tn_2048_1024_7168_ld_7168_7168_2048,Gemm_Rocblas_-1162085592,1.24425
GemmTunableOp_BFloat16_TN,tn_10240_3072_12288_ld_12288_12288_10240,Gemm_Rocblas_-1162085575,39.1857
GemmTunableOp_BFloat16_TN,tn_8192_4096_9216_ld_9216_9216_8192,Gemm_Rocblas_-1162085592,24.2486
GemmTunableOp_BFloat16_TN,tn_11264_4096_8192_ld_8192_8192_11264,Gemm_Rocblas_-1162085583,33.3189
GemmTunableOp_BFloat16_TN,tn_8192_5120_12288_ld_12288_12288_8192,Gemm_Rocblas_-1162085592,52.559
GemmTunableOp_BFloat16_TN,tn_11264_7168_8192_ld_8192_8192_11264,Gemm_Rocblas_-1162085589,57.9703
GemmTunableOp_BFloat16_TN,tn_4096_8704_4096_ld_4096_4096_4096,Gemm_Rocblas_-1162085591,16.3328
GemmTunableOp_BFloat16_TN,tn_12288_4096_10240_ld_10240_10240_12288,Default,47.2701
GemmTunableOp_BFloat16_TN,tn_14336_3072_13312_ld_13312_13312_14336,Gemm_Rocblas_-1162085575,48.9888
GemmTunableOp_BFloat16_TN,tn_8192_5120_14336_ld_14336_14336_8192,Gemm_Rocblas_-1162085580,61.6134
GemmTunableOp_BFloat16_TN,tn_6144_7168_7168_ld_7168_7168_6144,Default,24.1503
GemmTunableOp_BFloat16_TN,tn_13312_1024_14336_ld_14336_14336_13312,Gemm_Rocblas_-1162085581,21.673
GemmTunableOp_BFloat16_TN,tn_10240_2048_15360_ld_15360_15360_10240,Gemm_Rocblas_-1162085580,28.8416
GemmTunableOp_BFloat16_TN,tn_6144_3072_8192_ld_8192_8192_6144,Gemm_Rocblas_-1162085590,14.4363
GemmTunableOp_BFloat16_TN,tn_2048_7168_4096_ld_4096_4096_2048,Gemm_Rocblas_-1162085569,4.90511
GemmTunableOp_BFloat16_TN,tn_15360_3072_9216_ld_9216_9216_15360,Gemm_Rocblas_-1162085587,34.0697
GemmTunableOp_BFloat16_TN,tn_6144_9216_5120_ld_5120_5120_6144,Default,21.9048
GemmTunableOp_BFloat16_TN,tn_5120_2048_4096_ld_4096_4096_5120,Gemm_Rocblas_-1162085591,4.03403
GemmTunableOp_BFloat16_TN,tn_3072_1024_10240_ld_10240_10240_3072,Gemm_Rocblas_-1162085592,3.31853
GemmTunableOp_BFloat16_TN,tn_1024_1024_9216_ld_9216_9216_1024,Gemm_Rocblas_-1162085576,0.752988
GemmTunableOp_BFloat16_TN,tn_1024_1024_10240_ld_10240_10240_1024,Gemm_Rocblas_-1162085570,1.10908
GemmTunableOp_BFloat16_TN,tn_5120_8192_14336_ld_14336_14336_5120,Gemm_Rocblas_-1162085575,66.3907
GemmTunableOp_BFloat16_TN,tn_1024_8192_15360_ld_15360_15360_1024,Gemm_Rocblas_-1162085575,11.6633
GemmTunableOp_BFloat16_TN,tn_6144_7168_8192_ld_8192_8192_6144,Gemm_Rocblas_-1162085585,32.8323
GemmTunableOp_BFloat16_TN,tn_1024_1024_5120_ld_5120_5120_1024,Gemm_Rocblas_-1162085569,0.435552
GemmTunableOp_BFloat16_TN,tn_5120_2048_1024_ld_1024_1024_5120,Gemm_Rocblas_-1162085576,0.741452
GemmTunableOp_BFloat16_TN,tn_3072_5120_7168_ld_7168_7168_3072,Gemm_Rocblas_-1162085592,8.65044
GemmTunableOp_BFloat16_TN,tn_12288_1024_12288_ld_12288_12288_12288,Gemm_Rocblas_-1162085587,16.3791
GemmTunableOp_BFloat16_TN,tn_1024_1024_7168_ld_7168_7168_1024,Gemm_Rocblas_-1162085590,0.544495
GemmTunableOp_BFloat16_TN,tn_12288_1024_1024_ld_1024_1024_12288,Gemm_Rocblas_-1162085569,0.949629
GemmTunableOp_BFloat16_TN,tn_13312_7168_9216_ld_9216_9216_13312,Default,67.1991
GemmTunableOp_BFloat16_TN,tn_2048_4096_10240_ld_10240_10240_2048,Gemm_Rocblas_-1162085588,9.78664
GemmTunableOp_BFloat16_TN,tn_8192_5120_11264_ld_11264_11264_8192,Default,38.3672
GemmTunableOp_BFloat16_TN,tn_5120_1024_14336_ld_14336_14336_5120,Gemm_Hipblaslt_502,9.02214
GemmTunableOp_BFloat16_TN,tn_13312_4096_13312_ld_13312_13312_13312,Gemm_Rocblas_-1162085575,59.2828
GemmTunableOp_BFloat16_TN,tn_11264_1024_11264_ld_11264_11264_11264,Gemm_Rocblas_-1162085575,11.1908
GemmTunableOp_BFloat16_TN,tn_3072_1024_11264_ld_11264_11264_3072,Gemm_Rocblas_-1162085591,3.02102
GemmTunableOp_BFloat16_TN,tn_9216_3072_13312_ld_13312_13312_9216,Gemm_Rocblas_-1162085575,32.2929
GemmTunableOp_BFloat16_TN,tn_11264_1024_12288_ld_12288_12288_11264,Gemm_Rocblas_-1162085589,14.4276
GemmTunableOp_BFloat16_TN,tn_5120_5120_10240_ld_10240_10240_5120,Gemm_Rocblas_-1162085592,26.1752
GemmTunableOp_BFloat16_TN,tn_12288_6144_1024_ld_1024_1024_12288,Gemm_Rocblas_-1162085569,5.34009
GemmTunableOp_BFloat16_TN,tn_3072_1024_2048_ld_2048_2048_3072,Default,0.414452
GemmTunableOp_BFloat16_TN,tn_13312_3072_2048_ld_2048_2048_13312,Gemm_Hipblaslt_502,7.82739
GemmTunableOp_BFloat16_TN,tn_2048_1024_5120_ld_5120_5120_2048,Gemm_Rocblas_-1162085578,0.885165
GemmTunableOp_BFloat16_TN,tn_14336_3072_15360_ld_15360_15360_14336,Gemm_Rocblas_-1162085580,58.001
GemmTunableOp_BFloat16_TN,tn_4096_15104_4096_ld_4096_4096_4096,Gemm_Rocblas_-1162085592,24.0371
GemmTunableOp_BFloat16_TN,tn_10240_2048_3072_ld_3072_3072_10240,Gemm_Rocblas_-1162085578,4.82994
GemmTunableOp_BFloat16_TN,tn_11264_4096_1024_ld_1024_1024_11264,Gemm_Rocblas_-1162085569,3.2531
GemmTunableOp_BFloat16_TN,tn_12288_4096_7168_ld_7168_7168_12288,Gemm_Rocblas_-1162085587,26.3505
GemmTunableOp_BFloat16_TN,tn_4096_4864_4096_ld_4096_4096_4096,Gemm_Rocblas_-1162085590,8.96876
GemmTunableOp_BFloat16_TN,tn_6144_2048_8192_ld_8192_8192_6144,Gemm_Rocblas_-1162085590,9.71392
GemmTunableOp_BFloat16_TN,tn_11264_1024_4096_ld_4096_4096_11264,Gemm_Rocblas_-1162085590,4.15558
GemmTunableOp_BFloat16_TN,tn_4096_3072_15360_ld_15360_15360_4096,Gemm_Rocblas_-1162085575,17.8196
GemmTunableOp_BFloat16_TN,tn_2048_1024_10240_ld_10240_10240_2048,Gemm_Rocblas_-1162085590,2.36969
GemmTunableOp_BFloat16_TN,tn_14336_3072_8192_ld_8192_8192_14336,Gemm_Rocblas_-1162085590,32.0307
GemmTunableOp_BFloat16_TN,tn_8192_1024_11264_ld_11264_11264_8192,Gemm_Rocblas_-1162085575,7.94127
GemmTunableOp_BFloat16_TN,tn_2048_1024_14336_ld_14336_14336_2048,Gemm_Hipblaslt_500,3.84768
GemmTunableOp_BFloat16_TN,tn_11264_5120_12288_ld_12288_12288_11264,Gemm_Rocblas_-1162085575,70.9529
GemmTunableOp_BFloat16_TN,tn_7168_1024_13312_ld_13312_13312_7168,Gemm_Rocblas_-1162085575,8.06769
GemmTunableOp_BFloat16_TN,tn_6144_4096_10240_ld_10240_10240_6144,Default,24.5956
GemmTunableOp_BFloat16_TN,tn_3072_1024_5120_ld_5120_5120_3072,Gemm_Rocblas_-1162085592,1.2143
GemmTunableOp_BFloat16_TN,tn_3072_1024_7168_ld_7168_7168_3072,Gemm_Rocblas_-1162085591,1.78455
GemmTunableOp_BFloat16_TN,tn_14336_1024_15360_ld_15360_15360_14336,Gemm_Rocblas_-1162085573,20.0895
GemmTunableOp_BFloat16_TN,tn_5120_2048_13312_ld_13312_13312_5120,Gemm_Rocblas_-1162085587,12.5356
GemmTunableOp_BFloat16_TN,tn_11264_7168_9216_ld_9216_9216_11264,Default,57.3617
GemmTunableOp_BFloat16_TN,tn_2048_1024_11264_ld_11264_11264_2048,Gemm_Rocblas_-1162085591,2.25336
GemmTunableOp_BFloat16_TN,tn_8192_1024_6144_ld_6144_6144_8192,Gemm_Rocblas_-1162085592,4.70999
GemmTunableOp_BFloat16_TN,tn_14336_4096_10240_ld_10240_10240_14336,Default,55.1256
GemmTunableOp_BFloat16_TN,tn_4096_1024_3072_ld_3072_3072_4096,Gemm_Rocblas_-1162085578,0.940535
GemmTunableOp_BFloat16_TN,tn_8192_4096_5120_ld_5120_5120_8192,Default,13.0887
GemmTunableOp_BFloat16_TN,tn_5120_4096_2048_ld_2048_2048_5120,Gemm_Rocblas_-1162085569,2.97133
GemmTunableOp_BFloat16_TN,tn_8192_1024_10240_ld_10240_10240_8192,Gemm_Rocblas_-1162085592,8.39487
GemmTunableOp_BFloat16_TN,tn_1024_1024_11264_ld_11264_11264_1024,Gemm_Rocblas_-1162085568,1.03321
GemmTunableOp_BFloat16_TN,tn_2048_1024_12288_ld_12288_12288_2048,Gemm_Hipblaslt_500,3.28394
GemmTunableOp_BFloat16_TN,tn_14336_1024_8192_ld_8192_8192_14336,Gemm_Rocblas_-1162085588,10.8391
GemmTunableOp_BFloat16_TN,tn_4096_5120_15360_ld_15360_15360_4096,Gemm_Rocblas_-1162085575,27.8624
GemmTunableOp_BFloat16_TN,tn_5120_5120_8192_ld_8192_8192_5120,Default,19.2569
GemmTunableOp_BFloat16_TN,tn_15360_1024_5120_ld_5120_5120_15360,Gemm_Rocblas_-1162085592,6.21856
GemmTunableOp_BFloat16_TN,tn_8192_8192_6144_ld_6144_6144_8192,Gemm_Rocblas_-1162085592,36.8638
GemmTunableOp_BFloat16_TN,tn_2048_8192_15360_ld_15360_15360_2048,Gemm_Rocblas_-1162085592,23.2022
GemmTunableOp_BFloat16_TN,tn_4096_5120_2048_ld_2048_2048_4096,Gemm_Rocblas_-1162085569,3.1633
GemmTunableOp_BFloat16_TN,tn_7168_2048_14336_ld_14336_14336_7168,Gemm_Rocblas_-1162085575,23.5028
GemmTunableOp_BFloat16_TN,tn_1024_4096_12288_ld_12288_12288_1024,Gemm_Rocblas_-1162085566,5.54075
GemmTunableOp_BFloat16_TN,tn_14336_7168_10240_ld_10240_10240_14336,Gemm_Rocblas_-1162085587,95.4782
GemmTunableOp_BFloat16_TN,tn_4096_6144_8192_ld_8192_8192_4096,Gemm_Rocblas_-1162085591,19.5155
GemmTunableOp_BFloat16_TN,tn_1024_1024_6144_ld_6144_6144_1024,Gemm_Rocblas_-1162085588,0.448773
GemmTunableOp_BFloat16_TN,tn_6144_5120_6144_ld_6144_6144_6144,Gemm_Rocblas_-1162085592,17.4597
GemmTunableOp_BFloat16_TN,tn_3072_1024_9216_ld_9216_9216_3072,Gemm_Rocblas_-1162085590,2.39125
GemmTunableOp_BFloat16_TN,tn_4096_4608_4096_ld_4096_4096_4096,Gemm_Rocblas_-1162085592,8.5243
GemmTunableOp_BFloat16_TN,tn_12288_2048_2048_ld_2048_2048_12288,Gemm_Hipblaslt_502,5.02915
GemmTunableOp_BFloat16_TN,tn_13312_6144_1024_ld_1024_1024_13312,Gemm_Rocblas_-1162085569,5.81678
GemmTunableOp_BFloat16_TN,tn_2048_1024_13312_ld_13312_13312_2048,Gemm_Rocblas_-1162085569,2.90918
GemmTunableOp_BFloat16_TN,tn_14336_7168_11264_ld_11264_11264_14336,Gemm_Rocblas_-1162085575,94.2029
GemmTunableOp_BFloat16_TN,tn_3072_7168_4096_ld_4096_4096_3072,Gemm_Rocblas_-1162085569,7.0131
GemmTunableOp_BFloat16_TN,tn_4096_11776_4096_ld_4096_4096_4096,Gemm_Rocblas_-1162085590,21.7817
GemmTunableOp_BFloat16_TN,tn_13312_1024_11264_ld_11264_11264_13312,Gemm_Rocblas_-1162085575,13.2346
GemmTunableOp_BFloat16_TN,tn_9216_5120_14336_ld_14336_14336_9216,Gemm_Rocblas_-1162085581,70.7993
GemmTunableOp_BFloat16_TN,tn_13312_1024_15360_ld_15360_15360_13312,Gemm_Rocblas_-1162085575,17.8642
GemmTunableOp_BFloat16_TN,tn_4096_2304_4096_ld_4096_4096_4096,Gemm_Rocblas_-1162085569,4.01669
GemmTunableOp_BFloat16_TN,tn_13312_1024_13312_ld_13312_13312_13312,Gemm_Rocblas_-1162085587,15.5557
GemmTunableOp_BFloat16_TN,tn_11264_1024_7168_ld_7168_7168_11264,Default,6.28957
GemmTunableOp_BFloat16_TN,tn_3072_1024_1024_ld_1024_1024_3072,Gemm_Rocblas_-1162085576,0.211838
GemmTunableOp_BFloat16_TN,tn_6144_2048_4096_ld_4096_4096_6144,Default,4.88287
GemmTunableOp_BFloat16_TN,tn_2048_4096_15360_ld_15360_15360_2048,Gemm_Rocblas_-1162085575,12.0519
GemmTunableOp_BFloat16_TN,tn_8192_6144_3072_ld_3072_3072_8192,Gemm_Rocblas_-1162085592,11.7155
GemmTunableOp_BFloat16_TN,tn_10240_4096_12288_ld_12288_12288_10240,Gemm_Rocblas_-1162085575,51.8233
GemmTunableOp_BFloat16_TN,tn_4096_6400_4096_ld_4096_4096_4096,Gemm_Rocblas_-1162085590,12.0382
GemmTunableOp_BFloat16_TN,tn_15360_6144_3072_ld_3072_3072_15360,Gemm_Rocblas_-1162085590,21.2148
GemmTunableOp_BFloat16_TN,tn_12288_5120_1024_ld_1024_1024_12288,Gemm_Rocblas_-1162085569,4.42811
GemmTunableOp_BFloat16_TN,tn_3072_1024_4096_ld_4096_4096_3072,Gemm_Rocblas_-1162085578,0.950355
GemmTunableOp_BFloat16_TN,tn_12288_2048_14336_ld_14336_14336_12288,Gemm_Rocblas_-1162085580,38.2645
GemmTunableOp_BFloat16_TN,tn_15360_3072_14336_ld_14336_14336_15360,Gemm_Rocblas_-1162085581,70.8407
GemmTunableOp_BFloat16_TN,tn_10240_4096_2048_ld_2048_2048_10240,Gemm_Hipblaslt_502,8.2422
GemmTunableOp_BFloat16_TN,tn_12288_1024_6144_ld_6144_6144_12288,Gemm_Rocblas_-1162085588,6.9888
GemmTunableOp_BFloat16_TN,tn_5120_8192_10240_ld_10240_10240_5120,Default,40.4474
GemmTunableOp_BFloat16_TN,tn_2048_2048_10240_ld_10240_10240_2048,Gemm_Rocblas_-1162085591,5.15571
GemmTunableOp_BFloat16_TN,tn_4096_3584_4096_ld_4096_4096_4096,Gemm_Rocblas_-1162085569,6.47832
GemmTunableOp_BFloat16_TN,tn_15360_7168_9216_ld_9216_9216_15360,Default,78.0008
GemmTunableOp_BFloat16_TN,tn_14336_1024_2048_ld_2048_2048_14336,Gemm_Rocblas_-1162085591,2.93802
GemmTunableOp_BFloat16_TN,tn_13312_3072_7168_ld_7168_7168_13312,Default,21.982
GemmTunableOp_BFloat16_TN,tn_2048_9216_8192_ld_8192_8192_2048,Gemm_Rocblas_-1162085591,15.5162
GemmTunableOp_BFloat16_TN,tn_3072_1024_12288_ld_12288_12288_3072,Gemm_Rocblas_-1162085591,4.31847
GemmTunableOp_BFloat16_TN,tn_6144_6144_10240_ld_10240_10240_6144,Gemm_Rocblas_-1162085592,36.3528
GemmTunableOp_BFloat16_TN,tn_9216_4096_5120_ld_5120_5120_9216,Gemm_Rocblas_-1162085592,14.4729
GemmTunableOp_BFloat16_TN,tn_6144_1024_8192_ld_8192_8192_6144,Gemm_Rocblas_-1162085588,4.63447
GemmTunableOp_BFloat16_TN,tn_5120_4096_3072_ld_3072_3072_5120,Gemm_Rocblas_-1162085576,4.78983
GemmTunableOp_BFloat16_TN,tn_9216_8192_11264_ld_11264_11264_9216,Gemm_Rocblas_-1162085587,68.5009
GemmTunableOp_BFloat16_TN,tn_11264_5120_10240_ld_10240_10240_11264,Gemm_Rocblas_-1162085587,54.3877
GemmTunableOp_BFloat16_TN,tn_4096_256_4096_ld_4096_4096_4096,Gemm_Rocblas_-1162085590,0.412141
GemmTunableOp_BFloat16_TN,tn_3072_4096_8192_ld_8192_8192_3072,Gemm_Rocblas_-1162085591,10.0603
GemmTunableOp_BFloat16_TN,tn_4096_1024_15360_ld_15360_15360_4096,Gemm_Rocblas_-1162085575,6.18556
GemmTunableOp_BFloat16_TN,tn_1024_1024_13312_ld_13312_13312_1024,Gemm_Rocblas_-1162085580,1.42089
GemmTunableOp_BFloat16_TN,tn_15360_5120_1024_ld_1024_1024_15360,Gemm_Rocblas_-1162085569,5.7837
GemmTunableOp_BFloat16_TN,tn_7168_1024_2048_ld_2048_2048_7168,Gemm_Rocblas_-1162085569,1.05128
GemmTunableOp_BFloat16_TN,tn_11264_4096_13312_ld_13312_13312_11264,Gemm_Rocblas_-1162085575,50.2865
GemmTunableOp_BFloat16_TN,tn_8192_5120_4096_ld_4096_4096_8192,Gemm_Rocblas_-1162085590,15.2138
GemmTunableOp_BFloat16_TN,tn_8192_3072_13312_ld_13312_13312_8192,Gemm_Rocblas_-1162085575,28.86
GemmTunableOp_BFloat16_TN,tn_4096_1024_1024_ld_1024_1024_4096,Default,0.294935
GemmTunableOp_BFloat16_TN,tn_13312_7168_15360_ld_15360_15360_13312,Gemm_Rocblas_-1162085581,125.29
GemmTunableOp_BFloat16_TN,tn_9216_3072_5120_ld_5120_5120_9216,Default,10.5764
GemmTunableOp_BFloat16_TN,tn_4096_1024_2048_ld_2048_2048_4096,Default,0.567687
GemmTunableOp_BFloat16_TN,tn_2048_3072_1024_ld_1024_1024_2048,Gemm_Rocblas_-1162085569,0.422679
GemmTunableOp_BFloat16_TN,tn_2048_3072_3072_ld_3072_3072_2048,Gemm_Rocblas_-1162085578,1.3754
GemmTunableOp_BFloat16_TN,tn_2048_3072_4096_ld_4096_4096_2048,Gemm_Rocblas_-1162085569,2.03889
GemmTunableOp_BFloat16_TN,tn_6144_1024_10240_ld_10240_10240_6144,Gemm_Rocblas_-1162085592,6.50349
GemmTunableOp_BFloat16_TN,tn_2048_3072_5120_ld_5120_5120_2048,Gemm_Rocblas_-1162085576,2.39087
GemmTunableOp_BFloat16_TN,tn_7168_8192_1024_ld_1024_1024_7168,Gemm_Rocblas_-1162085569,4.15364
GemmTunableOp_BFloat16_TN,tn_13312_4096_2048_ld_2048_2048_13312,Gemm_Rocblas_-1162085584,10.618
GemmTunableOp_BFloat16_TN,tn_2048_3072_6144_ld_6144_6144_2048,Gemm_Rocblas_-1162085566,3.43172
GemmTunableOp_BFloat16_TN,tn_2048_3072_7168_ld_7168_7168_2048,Gemm_Rocblas_-1162085578,3.79527
GemmTunableOp_BFloat16_TN,tn_3072_4096_7168_ld_7168_7168_3072,Gemm_Rocblas_-1162085592,6.89233
GemmTunableOp_BFloat16_TN,tn_15360_6144_4096_ld_4096_4096_15360,Gemm_Rocblas_-1162085591,33.6745
GemmTunableOp_BFloat16_TN,tn_2048_3072_9216_ld_9216_9216_2048,Gemm_Rocblas_-1162085591,5.06625
GemmTunableOp_BFloat16_TN,tn_14336_6144_4096_ld_4096_4096_14336,Gemm_Rocblas_-1162085591,31.6331
GemmTunableOp_BFloat16_TN,tn_2048_3072_11264_ld_11264_11264_2048,Gemm_Rocblas_-1162085575,6.52158
GemmTunableOp_BFloat16_TN,tn_3072_3072_1024_ld_1024_1024_3072,Gemm_Rocblas_-1162085578,0.571181
GemmTunableOp_BFloat16_TN,tn_5120_7168_5120_ld_5120_5120_5120,Default,14.0786
GemmTunableOp_BFloat16_TN,tn_15360_6144_15360_ld_15360_15360_15360,Gemm_Rocblas_-1162085580,123.905
GemmTunableOp_BFloat16_TN,tn_3072_3072_3072_ld_3072_3072_3072,Gemm_Rocblas_-1162085576,2.07071
GemmTunableOp_BFloat16_TN,tn_14336_8192_2048_ld_2048_2048_14336,Gemm_Hipblaslt_502,22.11
GemmTunableOp_BFloat16_TN,tn_6144_4096_3072_ld_3072_3072_6144,Gemm_Rocblas_-1162085578,5.90514
GemmTunableOp_BFloat16_TN,tn_3072_3072_6144_ld_6144_6144_3072,Gemm_Rocblas_-1162085592,5.66416
GemmTunableOp_BFloat16_TN,tn_3072_3072_7168_ld_7168_7168_3072,Gemm_Rocblas_-1162085592,5.49752
GemmTunableOp_BFloat16_TN,tn_12288_4096_12288_ld_12288_12288_12288,Gemm_Rocblas_-1162085575,62.9508
GemmTunableOp_BFloat16_TN,tn_3072_3072_8192_ld_8192_8192_3072,Gemm_Rocblas_-1162085588,7.51615
GemmTunableOp_BFloat16_TN,tn_7168_8192_15360_ld_15360_15360_7168,Gemm_Rocblas_-1162085575,75.1888
GemmTunableOp_BFloat16_TN,tn_6144_3072_5120_ld_5120_5120_6144,Gemm_Rocblas_-1162085592,7.51222
GemmTunableOp_BFloat16_TN,tn_3072_3072_10240_ld_10240_10240_3072,Gemm_Rocblas_-1162085592,10.1454
GemmTunableOp_BFloat16_TN,tn_10240_7168_14336_ld_14336_14336_10240,Gemm_Rocblas_-1162085575,109.122
GemmTunableOp_BFloat16_TN,tn_3072_3072_11264_ld_11264_11264_3072,Gemm_Rocblas_-1162085587,9.50486
GemmTunableOp_BFloat16_TN,tn_3072_3072_13312_ld_13312_13312_3072,Gemm_Rocblas_-1162085575,11.3617
GemmTunableOp_BFloat16_TN,tn_15360_1024_1024_ld_1024_1024_15360,Gemm_Rocblas_-1162085569,1.17386
GemmTunableOp_BFloat16_TN,tn_3072_3072_14336_ld_14336_14336_3072,Gemm_Rocblas_-1162085574,16.2832
GemmTunableOp_BFloat16_TN,tn_4096_3072_1024_ld_1024_1024_4096,Gemm_Rocblas_-1162085567,0.907533
GemmTunableOp_BFloat16_TN,tn_1024_4096_8192_ld_8192_8192_1024,Gemm_Rocblas_-1162085569,3.03204
GemmTunableOp_BFloat16_TN,tn_6144_9216_7168_ld_7168_7168_6144,Gemm_Rocblas_-1162085587,30.7956
GemmTunableOp_BFloat16_TN,tn_13312_5120_5120_ld_5120_5120_13312,Gemm_Rocblas_-1162085592,25.8907
GemmTunableOp_BFloat16_TN,tn_7168_1024_15360_ld_15360_15360_7168,Gemm_Rocblas_-1162085578,9.84942
GemmTunableOp_BFloat16_TN,tn_4096_3072_3072_ld_3072_3072_4096,Gemm_Rocblas_-1162085578,2.81998
GemmTunableOp_BFloat16_TN,tn_4096_18176_4096_ld_4096_4096_4096,Gemm_Rocblas_-1162085592,29.1535
GemmTunableOp_BFloat16_TN,tn_8192_3072_1024_ld_1024_1024_8192,Gemm_Rocblas_-1162085569,1.84648
GemmTunableOp_BFloat16_TN,tn_4096_3072_6144_ld_6144_6144_4096,Default,7.39065
GemmTunableOp_BFloat16_TN,tn_4096_3072_7168_ld_7168_7168_4096,Default,6.98353
GemmTunableOp_BFloat16_TN,tn_3072_2048_11264_ld_11264_11264_3072,Gemm_Rocblas_-1162085575,6.61958
GemmTunableOp_BFloat16_TN,tn_4096_3072_9216_ld_9216_9216_4096,Default,9.46953
GemmTunableOp_BFloat16_TN,tn_4096_3072_10240_ld_10240_10240_4096,Default,13.1363
GemmTunableOp_BFloat16_TN,tn_14336_3072_1024_ld_1024_1024_14336,Gemm_Rocblas_-1162085569,3.22217
GemmTunableOp_BFloat16_TN,tn_4096_7168_13312_ld_13312_13312_4096,Gemm_Rocblas_-1162085587,32.4288
GemmTunableOp_BFloat16_TN,tn_4096_3072_11264_ld_11264_11264_4096,Gemm_Rocblas_-1162085575,12.3938
GemmTunableOp_BFloat16_TN,tn_9216_5120_7168_ld_7168_7168_9216,Default,25.7629
GemmTunableOp_BFloat16_TN,tn_4096_18688_4096_ld_4096_4096_4096,Gemm_Rocblas_-1162085590,29.2396
GemmTunableOp_BFloat16_TN,tn_4096_3072_12288_ld_12288_12288_4096,Default,17.0234
GemmTunableOp_BFloat16_TN,tn_11264_5120_9216_ld_9216_9216_11264,Default,39.5613
GemmTunableOp_BFloat16_TN,tn_1024_3072_7168_ld_7168_7168_1024,Gemm_Rocblas_-1162085573,1.75523
GemmTunableOp_BFloat16_TN,tn_4096_4096_11264_ld_11264_11264_4096,Gemm_Rocblas_-1162085592,15.9889
GemmTunableOp_BFloat16_TN,tn_3072_6144_10240_ld_10240_10240_3072,Gemm_Rocblas_-1162085592,19.7747
GemmTunableOp_BFloat16_TN,tn_7168_4096_2048_ld_2048_2048_7168,Gemm_Rocblas_-1162085567,4.50101
GemmTunableOp_BFloat16_TN,tn_15360_2048_15360_ld_15360_15360_15360,Gemm_Rocblas_-1162085587,42.3387
GemmTunableOp_BFloat16_TN,tn_11264_4096_14336_ld_14336_14336_11264,Gemm_Rocblas_-1162085575,68.8303
GemmTunableOp_BFloat16_TN,tn_11264_3072_14336_ld_14336_14336_11264,Gemm_Rocblas_-1162085580,53.0503
GemmTunableOp_BFloat16_TN,tn_5120_3072_1024_ld_1024_1024_5120,Gemm_Rocblas_-1162085578,1.1101
GemmTunableOp_BFloat16_TN,tn_5120_3072_2048_ld_2048_2048_5120,Gemm_Rocblas_-1162085569,2.12673
GemmTunableOp_BFloat16_TN,tn_4096_8192_8192_ld_8192_8192_4096,Gemm_Rocblas_-1162085590,26.1118
GemmTunableOp_BFloat16_TN,tn_4096_4096_15360_ld_15360_15360_4096,Gemm_Rocblas_-1162085575,23.37
GemmTunableOp_BFloat16_TN,tn_10240_5120_6144_ld_6144_6144_10240,Gemm_Rocblas_-1162085592,28.999
GemmTunableOp_BFloat16_TN,tn_10240_4096_1024_ld_1024_1024_10240,Gemm_Rocblas_-1162085569,3.05118
GemmTunableOp_BFloat16_TN,tn_5120_3072_3072_ld_3072_3072_5120,Gemm_Rocblas_-1162085578,3.62833
GemmTunableOp_BFloat16_TN,tn_5120_3072_5120_ld_5120_5120_5120,Gemm_Rocblas_-1162085587,6.16541
GemmTunableOp_BFloat16_TN,tn_7168_8192_5120_ld_5120_5120_7168,Gemm_Rocblas_-1162085592,21.7865
GemmTunableOp_BFloat16_TN,tn_2048_6144_1024_ld_1024_1024_2048,Gemm_Rocblas_-1162085569,0.929801
GemmTunableOp_BFloat16_TN,tn_4096_4096_5120_ld_5120_5120_4096,Gemm_Rocblas_-1162085592,6.71149
GemmTunableOp_BFloat16_TN,tn_5120_3072_6144_ld_6144_6144_5120,Default,8.88715
GemmTunableOp_BFloat16_TN,tn_12288_7168_9216_ld_9216_9216_12288,Gemm_Rocblas_-1162085587,62.6218
GemmTunableOp_BFloat16_TN,tn_5120_6144_7168_ld_7168_7168_5120,Default,16.3685
GemmTunableOp_BFloat16_TN,tn_2048_2048_3072_ld_3072_3072_2048,Gemm_Rocblas_-1162085576,0.917792
GemmTunableOp_BFloat16_TN,tn_4096_10240_4096_ld_4096_4096_4096,Gemm_Rocblas_-1162085590,19.2112
GemmTunableOp_BFloat16_TN,tn_5120_3072_8192_ld_8192_8192_5120,Gemm_Rocblas_-1162085591,12.0844
GemmTunableOp_BFloat16_TN,tn_4096_7168_3072_ld_3072_3072_4096,Gemm_Rocblas_-1162085578,6.41245
GemmTunableOp_BFloat16_TN,tn_8192_6144_10240_ld_10240_10240_8192,Default,47.347
GemmTunableOp_BFloat16_TN,tn_5120_3072_10240_ld_10240_10240_5120,Gemm_Rocblas_-1162085592,16.0056
GemmTunableOp_BFloat16_TN,tn_8192_4096_15360_ld_15360_15360_8192,Gemm_Rocblas_-1162085575,44.5815
GemmTunableOp_BFloat16_TN,tn_5120_3072_15360_ld_15360_15360_5120,Gemm_Rocblas_-1162085575,21.3715
GemmTunableOp_BFloat16_TN,tn_12288_6144_13312_ld_13312_13312_12288,Gemm_Rocblas_-1162085575,82.4985
GemmTunableOp_BFloat16_TN,tn_7168_5120_13312_ld_13312_13312_7168,Gemm_Rocblas_-1162085575,39.993
GemmTunableOp_BFloat16_TN,tn_1024_7168_9216_ld_9216_9216_1024,Gemm_Rocblas_-1162085567,5.54572
GemmTunableOp_BFloat16_TN,tn_6144_3072_7168_ld_7168_7168_6144,Default,10.4886
GemmTunableOp_BFloat16_TN,tn_4096_9216_15360_ld_15360_15360_4096,Gemm_Rocblas_-1162085575,50.358
GemmTunableOp_BFloat16_TN,tn_3072_2048_2048_ld_2048_2048_3072,Gemm_Rocblas_-1162085578,0.885784
GemmTunableOp_BFloat16_TN,tn_6144_3072_9216_ld_9216_9216_6144,Gemm_Rocblas_-1162085575,14.1944
GemmTunableOp_BFloat16_TN,tn_4096_3072_5120_ld_5120_5120_4096,Default,5.11526
GemmTunableOp_BFloat16_TN,tn_6144_3072_11264_ld_11264_11264_6144,Gemm_Rocblas_-1162085592,17.628
GemmTunableOp_BFloat16_TN,tn_3072_4096_11264_ld_11264_11264_3072,Default,12.2944
GemmTunableOp_BFloat16_TN,tn_6144_3072_12288_ld_12288_12288_6144,Default,24.2046
GemmTunableOp_BFloat16_TN,tn_10240_6144_3072_ld_3072_3072_10240,Gemm_Rocblas_-1162085592,14.5495
GemmTunableOp_BFloat16_TN,tn_4096_3840_4096_ld_4096_4096_4096,Gemm_Rocblas_-1162085569,6.99578
GemmTunableOp_BFloat16_TN,tn_6144_3072_13312_ld_13312_13312_6144,Gemm_Rocblas_-1162085575,21.514
GemmTunableOp_BFloat16_TN,tn_4096_1024_4096_ld_4096_4096_4096,Gemm_Rocblas_-1162085590,1.7363
GemmTunableOp_BFloat16_TN,tn_9216_1024_2048_ld_2048_2048_9216,Gemm_Rocblas_-1162085578,1.90138
GemmTunableOp_BFloat16_TN,tn_6144_3072_14336_ld_14336_14336_6144,Gemm_Rocblas_-1162085580,31.2913
GemmTunableOp_BFloat16_TN,tn_7168_3072_1024_ld_1024_1024_7168,Gemm_Rocblas_-1162085569,1.61093
GemmTunableOp_BFloat16_TN,tn_14336_7168_6144_ld_6144_6144_14336,Gemm_Rocblas_-1162085592,55.2652
GemmTunableOp_BFloat16_TN,tn_7168_3072_2048_ld_2048_2048_7168,Gemm_Rocblas_-1162085569,3.39845
GemmTunableOp_BFloat16_TN,tn_7168_3072_8192_ld_8192_8192_7168,Gemm_Rocblas_-1162085590,16.2097
GemmTunableOp_BFloat16_TN,tn_7168_3072_9216_ld_9216_9216_7168,Gemm_Rocblas_-1162085587,15.9679
GemmTunableOp_BFloat16_TN,tn_12288_7168_15360_ld_15360_15360_12288,Gemm_Rocblas_-1162085580,114.408
GemmTunableOp_BFloat16_TN,tn_3072_4096_9216_ld_9216_9216_3072,Gemm_Rocblas_-1162085575,9.72214
GemmTunableOp_BFloat16_TN,tn_7168_3072_13312_ld_13312_13312_7168,Gemm_Rocblas_-1162085587,24.6553
GemmTunableOp_BFloat16_TN,tn_7168_3072_14336_ld_14336_14336_7168,Gemm_Rocblas_-1162085581,35.2117
GemmTunableOp_BFloat16_TN,tn_7168_9216_15360_ld_15360_15360_7168,Gemm_Rocblas_-1162085575,87.614
GemmTunableOp_BFloat16_TN,tn_15360_3072_2048_ld_2048_2048_15360,Gemm_Hipblaslt_502,8.99715
GemmTunableOp_BFloat16_TN,tn_8192_3072_3072_ld_3072_3072_8192,Gemm_Rocblas_-1162085592,5.9056
GemmTunableOp_BFloat16_TN,tn_14336_4096_3072_ld_3072_3072_14336,Gemm_Rocblas_-1162085592,13.4721
GemmTunableOp_BFloat16_TN,tn_8192_3072_4096_ld_4096_4096_8192,Gemm_Rocblas_-1162085591,9.41332
GemmTunableOp_BFloat16_TN,tn_3072_7168_2048_ld_2048_2048_3072,Gemm_Rocblas_-1162085569,3.2725
GemmTunableOp_BFloat16_TN,tn_11264_2048_5120_ld_5120_5120_11264,Default,8.9337
GemmTunableOp_BFloat16_TN,tn_8192_3072_10240_ld_10240_10240_8192,Default,25.2813
GemmTunableOp_BFloat16_TN,tn_13312_6144_15360_ld_15360_15360_13312,Gemm_Rocblas_-1162085575,105.935
GemmTunableOp_BFloat16_TN,tn_8192_3072_11264_ld_11264_11264_8192,Gemm_Rocblas_-1162085575,23.7618
GemmTunableOp_BFloat16_TN,tn_8192_3072_14336_ld_14336_14336_8192,Gemm_Rocblas_-1162085580,39.2607
GemmTunableOp_BFloat16_TN,tn_1024_5120_1024_ld_1024_1024_1024,Gemm_Rocblas_-1162085567,0.329698
GemmTunableOp_BFloat16_TN,tn_6144_3072_3072_ld_3072_3072_6144,Gemm_Rocblas_-1162085592,4.49871
GemmTunableOp_BFloat16_TN,tn_8192_3072_15360_ld_15360_15360_8192,Gemm_Rocblas_-1162085575,32.4059
GemmTunableOp_BFloat16_TN,tn_5120_9216_8192_ld_8192_8192_5120,Gemm_Rocblas_-1162085587,34.9457
GemmTunableOp_BFloat16_TN,tn_13312_2048_8192_ld_8192_8192_13312,Gemm_Rocblas_-1162085591,19.8554
GemmTunableOp_BFloat16_TN,tn_9216_3072_2048_ld_2048_2048_9216,Gemm_Hipblaslt_502,5.45311
GemmTunableOp_BFloat16_TN,tn_12288_3072_8192_ld_8192_8192_12288,Gemm_Rocblas_-1162085583,27.6331
GemmTunableOp_BFloat16_TN,tn_13312_2048_1024_ld_1024_1024_13312,Gemm_Rocblas_-1162085569,1.97663
GemmTunableOp_BFloat16_TN,tn_10240_1024_4096_ld_4096_4096_10240,Gemm_Rocblas_-1162085590,3.89196
GemmTunableOp_BFloat16_TN,tn_9216_3072_3072_ld_3072_3072_9216,Gemm_Rocblas_-1162085592,6.53436
GemmTunableOp_BFloat16_TN,tn_12288_8192_5120_ld_5120_5120_12288,Gemm_Rocblas_-1162085587,37.9901
GemmTunableOp_BFloat16_TN,tn_7168_4096_4096_ld_4096_4096_7168,Gemm_Rocblas_-1162085591,10.7671
GemmTunableOp_BFloat16_TN,tn_9216_3072_4096_ld_4096_4096_9216,Gemm_Rocblas_-1162085590,10.3255
GemmTunableOp_BFloat16_TN,tn_9216_3072_7168_ld_7168_7168_9216,Default,15.4562
GemmTunableOp_BFloat16_TN,tn_9216_3072_9216_ld_9216_9216_9216,Gemm_Rocblas_-1162085587,20.4103
GemmTunableOp_BFloat16_TN,tn_9216_3072_12288_ld_12288_12288_9216,Gemm_Rocblas_-1162085587,35.2778
GemmTunableOp_BFloat16_TN,tn_7168_6144_5120_ld_5120_5120_7168,Default,16.6238
GemmTunableOp_BFloat16_TN,tn_9216_3072_11264_ld_11264_11264_9216,Default,25.8777
GemmTunableOp_BFloat16_TN,tn_9216_3072_15360_ld_15360_15360_9216,Gemm_Rocblas_-1162085575,36.7577
GemmTunableOp_BFloat16_TN,tn_10240_3072_1024_ld_1024_1024_10240,Gemm_Rocblas_-1162085569,2.33874
GemmTunableOp_BFloat16_TN,tn_4096_2048_3072_ld_3072_3072_4096,Gemm_Rocblas_-1162085579,1.73897
GemmTunableOp_BFloat16_TN,tn_10240_3072_2048_ld_2048_2048_10240,Gemm_Hipblaslt_502,6.02956
GemmTunableOp_BFloat16_TN,tn_12288_1024_2048_ld_2048_2048_12288,Gemm_Rocblas_-1162085589,2.53516
GemmTunableOp_BFloat16_TN,tn_3072_4096_12288_ld_12288_12288_3072,Gemm_Rocblas_-1162085572,17.8059
GemmTunableOp_BFloat16_TN,tn_10240_3072_5120_ld_5120_5120_10240,Default,11.9237
GemmTunableOp_BFloat16_TN,tn_10240_3072_6144_ld_6144_6144_10240,Default,17.398
GemmTunableOp_BFloat16_TN,tn_10240_3072_7168_ld_7168_7168_10240,Default,16.9972
GemmTunableOp_BFloat16_TN,tn_1024_5120_11264_ld_11264_11264_1024,Gemm_Rocblas_-1162085570,5.21866
GemmTunableOp_BFloat16_TN,tn_12288_8192_10240_ld_10240_10240_12288,Default,94.03
GemmTunableOp_BFloat16_TN,tn_8192_2048_5120_ld_5120_5120_8192,Default,6.70084
GemmTunableOp_BFloat16_TN,tn_3072_5120_6144_ld_6144_6144_3072,Gemm_Rocblas_-1162085592,9.15399
GemmTunableOp_BFloat16_TN,tn_4096_768_4096_ld_4096_4096_4096,Gemm_Rocblas_-1162085579,1.28418
GemmTunableOp_BFloat16_TN,tn_10240_3072_9216_ld_9216_9216_10240,Gemm_Rocblas_-1162085587,22.6717
GemmTunableOp_BFloat16_TN,tn_10240_3072_13312_ld_13312_13312_10240,Gemm_Rocblas_-1162085575,35.926
GemmTunableOp_BFloat16_TN,tn_6144_1024_12288_ld_12288_12288_6144,Gemm_Rocblas_-1162085592,8.3365
GemmTunableOp_BFloat16_TN,tn_10240_3072_15360_ld_15360_15360_10240,Gemm_Rocblas_-1162085575,41.5047
GemmTunableOp_BFloat16_TN,tn_11264_3072_1024_ld_1024_1024_11264,Gemm_Rocblas_-1162085569,2.46683
GemmTunableOp_BFloat16_TN,tn_11264_3072_2048_ld_2048_2048_11264,Gemm_Hipblaslt_502,6.64598
GemmTunableOp_BFloat16_TN,tn_5120_3072_13312_ld_13312_13312_5120,Gemm_Rocblas_-1162085575,17.6943
GemmTunableOp_BFloat16_TN,tn_11264_3072_3072_ld_3072_3072_11264,Gemm_Rocblas_-1162085590,7.92609
GemmTunableOp_BFloat16_TN,tn_1024_5120_13312_ld_13312_13312_1024,Gemm_Rocblas_-1162085575,6.46895
GemmTunableOp_BFloat16_TN,tn_4096_5120_14336_ld_14336_14336_4096,Gemm_Rocblas_-1162085592,35.0701
GemmTunableOp_BFloat16_TN,tn_1024_1024_14336_ld_14336_14336_1024,Gemm_Hipblaslt_502,2.12813
GemmTunableOp_BFloat16_TN,tn_11264_3072_4096_ld_4096_4096_11264,Default,12.2499
GemmTunableOp_BFloat16_TN,tn_13312_7168_6144_ld_6144_6144_13312,Gemm_Rocblas_-1162085592,50.4416
GemmTunableOp_BFloat16_TN,tn_11264_3072_6144_ld_6144_6144_11264,Gemm_Rocblas_-1162085587,18.6435
GemmTunableOp_BFloat16_TN,tn_11264_3072_7168_ld_7168_7168_11264,Gemm_Rocblas_-1162085573,18.7273
GemmTunableOp_BFloat16_TN,tn_11264_3072_12288_ld_12288_12288_11264,Gemm_Rocblas_-1162085575,43.018
GemmTunableOp_BFloat16_TN,tn_11264_3072_15360_ld_15360_15360_11264,Gemm_Rocblas_-1162085575,44.5875
GemmTunableOp_BFloat16_TN,tn_12288_3072_1024_ld_1024_1024_12288,Gemm_Rocblas_-1162085569,2.72888
GemmTunableOp_BFloat16_TN,tn_13312_3072_9216_ld_9216_9216_13312,Gemm_Rocblas_-1162085587,28.9105
GemmTunableOp_BFloat16_TN,tn_5120_4096_10240_ld_10240_10240_5120,Default,21.6478
GemmTunableOp_BFloat16_TN,tn_8192_5120_3072_ld_3072_3072_8192,Gemm_Rocblas_-1162085591,9.72702
GemmTunableOp_BFloat16_TN,tn_12288_3072_4096_ld_4096_4096_12288,Gemm_Rocblas_-1162085590,14.1546
GemmTunableOp_BFloat16_TN,tn_12288_3072_5120_ld_5120_5120_12288,Gemm_Rocblas_-1162085592,14.6912
GemmTunableOp_BFloat16_TN,tn_1024_9216_4096_ld_4096_4096_1024,Gemm_Rocblas_-1162085569,3.23444
GemmTunableOp_BFloat16_TN,tn_5120_8192_1024_ld_1024_1024_5120,Gemm_Rocblas_-1162085578,3.02709
GemmTunableOp_BFloat16_TN,tn_12288_3072_7168_ld_7168_7168_12288,Gemm_Rocblas_-1162085592,20.2947
GemmTunableOp_BFloat16_TN,tn_5120_4096_4096_ld_4096_4096_5120,Gemm_Rocblas_-1162085591,7.90041
GemmTunableOp_BFloat16_TN,tn_13312_2048_2048_ld_2048_2048_13312,Gemm_Hipblaslt_502,5.36247
GemmTunableOp_BFloat16_TN,tn_13312_4096_10240_ld_10240_10240_13312,Default,51.3715
GemmTunableOp_BFloat16_TN,tn_2048_2048_12288_ld_12288_12288_2048,Gemm_Hipblaslt_502,6.36552
GemmTunableOp_BFloat16_TN,tn_12288_3072_9216_ld_9216_9216_12288,Default,26.8666
GemmTunableOp_BFloat16_TN,tn_13312_4096_7168_ld_7168_7168_13312,Default,27.9726
GemmTunableOp_BFloat16_TN,tn_12288_3072_11264_ld_11264_11264_12288,Gemm_Rocblas_-1162085587,32.2193
GemmTunableOp_BFloat16_TN,tn_14336_6144_15360_ld_15360_15360_14336,Gemm_Rocblas_-1162085580,113.627
GemmTunableOp_BFloat16_TN,tn_12288_3072_12288_ld_12288_12288_12288,Gemm_Rocblas_-1162085580,46.4743
GemmTunableOp_BFloat16_TN,tn_7168_9216_14336_ld_14336_14336_7168,Gemm_Rocblas_-1162085581,98.6976
GemmTunableOp_BFloat16_TN,tn_12288_3072_15360_ld_15360_15360_12288,Gemm_Rocblas_-1162085575,49.8608
GemmTunableOp_BFloat16_TN,tn_13312_3072_1024_ld_1024_1024_13312,Gemm_Rocblas_-1162085569,2.96946
GemmTunableOp_BFloat16_TN,tn_9216_8192_12288_ld_12288_12288_9216,Gemm_Rocblas_-1162085575,93.6848
GemmTunableOp_BFloat16_TN,tn_11264_6144_7168_ld_7168_7168_11264,Default,37.5064
GemmTunableOp_BFloat16_TN,tn_13312_3072_3072_ld_3072_3072_13312,Gemm_Rocblas_-1162085592,9.46358
GemmTunableOp_BFloat16_TN,tn_13312_3072_5120_ld_5120_5120_13312,Default,14.9897
GemmTunableOp_BFloat16_TN,tn_11264_6144_12288_ld_12288_12288_11264,Gemm_Rocblas_-1162085580,84.43
GemmTunableOp_BFloat16_TN,tn_14336_1024_11264_ld_11264_11264_14336,Gemm_Rocblas_-1162085575,14.2059
GemmTunableOp_BFloat16_TN,tn_6144_3072_2048_ld_2048_2048_6144,Gemm_Rocblas_-1162085569,2.80933
GemmTunableOp_BFloat16_TN,tn_15360_4096_7168_ld_7168_7168_15360,Gemm_Rocblas_-1162085592,32.2029
GemmTunableOp_BFloat16_TN,tn_13312_3072_10240_ld_10240_10240_13312,Default,38.2896
GemmTunableOp_BFloat16_TN,tn_6144_7168_5120_ld_5120_5120_6144,Gemm_Rocblas_-1162085592,17.0653
GemmTunableOp_BFloat16_TN,tn_13312_3072_11264_ld_11264_11264_13312,Default,37.4057
GemmTunableOp_BFloat16_TN,tn_2048_9216_13312_ld_13312_13312_2048,Gemm_Rocblas_-1162085575,22.2576
GemmTunableOp_BFloat16_TN,tn_13312_3072_12288_ld_12288_12288_13312,Gemm_Rocblas_-1162085581,50.811
GemmTunableOp_BFloat16_TN,tn_9216_2048_3072_ld_3072_3072_9216,Gemm_Rocblas_-1162085578,4.33559
GemmTunableOp_BFloat16_TN,tn_13312_3072_14336_ld_14336_14336_13312,Gemm_Rocblas_-1162085581,62.3918
GemmTunableOp_BFloat16_TN,tn_13312_3072_15360_ld_15360_15360_13312,Gemm_Rocblas_-1162085575,53.5271
GemmTunableOp_BFloat16_TN,tn_7168_4096_12288_ld_12288_12288_7168,Gemm_Rocblas_-1162085592,36.8658
GemmTunableOp_BFloat16_TN,tn_5120_6144_9216_ld_9216_9216_5120,Default,22.2679
GemmTunableOp_BFloat16_TN,tn_14336_3072_2048_ld_2048_2048_14336,Gemm_Hipblaslt_502,8.55969
GemmTunableOp_BFloat16_TN,tn_4096_1024_13312_ld_13312_13312_4096,Gemm_Rocblas_-1162085571,4.95145
GemmTunableOp_BFloat16_TN,tn_15360_1024_6144_ld_6144_6144_15360,Gemm_Rocblas_-1162085592,8.59521
GemmTunableOp_BFloat16_TN,tn_14336_3072_3072_ld_3072_3072_14336,Gemm_Rocblas_-1162085592,10.1168
GemmTunableOp_BFloat16_TN,tn_8192_8192_12288_ld_12288_12288_8192,Gemm_Rocblas_-1162085575,82.5901
GemmTunableOp_BFloat16_TN,tn_14336_3072_4096_ld_4096_4096_14336,Gemm_Rocblas_-1162085590,15.9669
GemmTunableOp_BFloat16_TN,tn_1024_2048_12288_ld_12288_12288_1024,Gemm_Rocblas_-1162085570,3.23035
GemmTunableOp_BFloat16_TN,tn_14336_3072_6144_ld_6144_6144_14336,Default,24.1145
GemmTunableOp_BFloat16_TN,tn_14336_3072_7168_ld_7168_7168_14336,Default,23.6949
GemmTunableOp_BFloat16_TN,tn_3072_1024_3072_ld_3072_3072_3072,Default,0.647272
GemmTunableOp_BFloat16_TN,tn_14336_3072_10240_ld_10240_10240_14336,Gemm_Rocblas_-1162085587,41.8924
GemmTunableOp_BFloat16_TN,tn_14336_3072_14336_ld_14336_14336_14336,Gemm_Rocblas_-1162085575,65.3101
GemmTunableOp_BFloat16_TN,tn_15360_7168_14336_ld_14336_14336_15360,Gemm_Rocblas_-1162085575,161.727
GemmTunableOp_BFloat16_TN,tn_1024_6144_8192_ld_8192_8192_1024,Gemm_Rocblas_-1162085569,4.64711
GemmTunableOp_BFloat16_TN,tn_15360_3072_1024_ld_1024_1024_15360,Gemm_Rocblas_-1162085569,3.50921
GemmTunableOp_BFloat16_TN,tn_11264_7168_12288_ld_12288_12288_11264,Gemm_Rocblas_-1162085592,96.6498
GemmTunableOp_BFloat16_TN,tn_7168_3072_5120_ld_5120_5120_7168,Default,8.62433
GemmTunableOp_BFloat16_TN,tn_15360_3072_3072_ld_3072_3072_15360,Gemm_Rocblas_-1162085591,10.7789
GemmTunableOp_BFloat16_TN,tn_15360_3072_4096_ld_4096_4096_15360,Gemm_Rocblas_-1162085591,16.9085
GemmTunableOp_BFloat16_TN,tn_10240_6144_11264_ld_11264_11264_10240,Gemm_Rocblas_-1162085587,56.0321
GemmTunableOp_BFloat16_TN,tn_2048_6144_4096_ld_4096_4096_2048,Gemm_Rocblas_-1162085569,4.18276
GemmTunableOp_BFloat16_TN,tn_15360_3072_5120_ld_5120_5120_15360,Gemm_Rocblas_-1162085592,17.3289
GemmTunableOp_BFloat16_TN,tn_15360_3072_7168_ld_7168_7168_15360,Gemm_Rocblas_-1162085587,24.9579
GemmTunableOp_BFloat16_TN,tn_6144_4096_5120_ld_5120_5120_6144,Gemm_Rocblas_-1162085592,9.7911
GemmTunableOp_BFloat16_TN,tn_14336_4096_8192_ld_8192_8192_14336,Gemm_Rocblas_-1162085588,42.8837
GemmTunableOp_BFloat16_TN,tn_15360_3072_10240_ld_10240_10240_15360,Gemm_Rocblas_-1162085587,43.9693
GemmTunableOp_BFloat16_TN,tn_6144_3072_1024_ld_1024_1024_6144,Gemm_Rocblas_-1162085569,1.38414
GemmTunableOp_BFloat16_TN,tn_6144_5120_7168_ld_7168_7168_6144,Gemm_Rocblas_-1162085587,17.6833
GemmTunableOp_BFloat16_TN,tn_15360_3072_11264_ld_11264_11264_15360,Gemm_Rocblas_-1162085592,43.4764
GemmTunableOp_BFloat16_TN,tn_9216_8192_7168_ld_7168_7168_9216,Gemm_Rocblas_-1162085587,40.7358
GemmTunableOp_BFloat16_TN,tn_15360_3072_12288_ld_12288_12288_15360,Default,58.4096
GemmTunableOp_BFloat16_TN,tn_14336_4096_1024_ld_1024_1024_14336,Gemm_Rocblas_-1162085569,4.30172
GemmTunableOp_BFloat16_TN,tn_15360_3072_13312_ld_13312_13312_15360,Gemm_Rocblas_-1162085575,50.9434
GemmTunableOp_BFloat16_TN,tn_1024_4096_1024_ld_1024_1024_1024,Gemm_Rocblas_-1162085567,0.285273
GemmTunableOp_BFloat16_TN,tn_14336_6144_6144_ld_6144_6144_14336,Default,47.4861
GemmTunableOp_BFloat16_TN,tn_2048_5120_15360_ld_15360_15360_2048,Gemm_Rocblas_-1162085575,14.4701
GemmTunableOp_BFloat16_TN,tn_1024_4096_3072_ld_3072_3072_1024,Default,0.871156
GemmTunableOp_BFloat16_TN,tn_2048_6144_11264_ld_11264_11264_2048,Gemm_Rocblas_-1162085575,12.6268
GemmTunableOp_BFloat16_TN,tn_13312_5120_9216_ld_9216_9216_13312,Default,48.0369
GemmTunableOp_BFloat16_TN,tn_1024_4096_11264_ld_11264_11264_1024,Gemm_Rocblas_-1162085570,4.23623
GemmTunableOp_BFloat16_TN,tn_13312_1024_12288_ld_12288_12288_13312,Gemm_Rocblas_-1162085580,17.0689
GemmTunableOp_BFloat16_TN,tn_14336_4096_14336_ld_14336_14336_14336,Gemm_Rocblas_-1162085581,84.9479
GemmTunableOp_BFloat16_TN,tn_1024_4096_5120_ld_5120_5120_1024,Gemm_Rocblas_-1162085570,1.63066
GemmTunableOp_BFloat16_TN,tn_6144_8192_6144_ld_6144_6144_6144,Default,27.312
GemmTunableOp_BFloat16_TN,tn_1024_4096_6144_ld_6144_6144_1024,Gemm_Rocblas_-1162085570,2.33927
GemmTunableOp_BFloat16_TN,tn_14336_8192_5120_ld_5120_5120_14336,Default,44.4222
GemmTunableOp_BFloat16_TN,tn_1024_4096_9216_ld_9216_9216_1024,Gemm_Rocblas_-1162085564,3.13182
GemmTunableOp_BFloat16_TN,tn_3072_2048_7168_ld_7168_7168_3072,Gemm_Rocblas_-1162085592,3.78508
GemmTunableOp_BFloat16_TN,tn_10240_3072_4096_ld_4096_4096_10240,Gemm_Rocblas_-1162085590,11.6415
GemmTunableOp_BFloat16_TN,tn_8192_3072_5120_ld_5120_5120_8192,Gemm_Rocblas_-1162085592,9.68861
GemmTunableOp_BFloat16_TN,tn_1024_4096_10240_ld_10240_10240_1024,Gemm_Rocblas_-1162085566,4.34113
GemmTunableOp_BFloat16_TN,tn_5120_3072_14336_ld_14336_14336_5120,Gemm_Rocblas_-1162085576,25.9053
GemmTunableOp_BFloat16_TN,tn_1024_4096_13312_ld_13312_13312_1024,Gemm_Rocblas_-1162085575,5.25074
GemmTunableOp_BFloat16_TN,tn_1024_4096_14336_ld_14336_14336_1024,Gemm_Rocblas_-1162085570,7.67103
GemmTunableOp_BFloat16_TN,tn_1024_4096_15360_ld_15360_15360_1024,Gemm_Rocblas_-1162085575,6.14505
GemmTunableOp_BFloat16_TN,tn_2048_4096_1024_ld_1024_1024_2048,Gemm_Rocblas_-1162085569,0.564518
GemmTunableOp_BFloat16_TN,tn_6144_6144_6144_ld_6144_6144_6144,Gemm_Rocblas_-1162085592,21.0456
GemmTunableOp_BFloat16_TN,tn_3072_6144_3072_ld_3072_3072_3072,Default,4.01707
GemmTunableOp_BFloat16_TN,tn_2048_4096_2048_ld_2048_2048_2048,Gemm_Rocblas_-1162085567,1.29517
GemmTunableOp_BFloat16_TN,tn_6144_8192_3072_ld_3072_3072_6144,Gemm_Rocblas_-1162085592,11.8053
GemmTunableOp_BFloat16_TN,tn_3072_8192_3072_ld_3072_3072_3072,Gemm_Rocblas_-1162085578,5.28771
GemmTunableOp_BFloat16_TN,tn_2048_4096_4096_ld_4096_4096_2048,Gemm_Rocblas_-1162085569,2.82096
GemmTunableOp_BFloat16_TN,tn_2048_4096_6144_ld_6144_6144_2048,Gemm_Rocblas_-1162085566,4.41368
GemmTunableOp_BFloat16_TN,tn_2048_4096_7168_ld_7168_7168_2048,Gemm_Rocblas_-1162085592,4.86797
GemmTunableOp_BFloat16_TN,tn_2048_4096_12288_ld_12288_12288_2048,Gemm_Rocblas_-1162085590,12.5955
GemmTunableOp_BFloat16_TN,tn_10240_7168_13312_ld_13312_13312_10240,Gemm_Rocblas_-1162085581,79.6113
GemmTunableOp_BFloat16_TN,tn_6144_1024_9216_ld_9216_9216_6144,Gemm_Rocblas_-1162085591,4.80105
GemmTunableOp_BFloat16_TN,tn_2048_4096_9216_ld_9216_9216_2048,Gemm_Rocblas_-1162085592,6.65637
GemmTunableOp_BFloat16_TN,tn_2048_4096_11264_ld_11264_11264_2048,Gemm_Rocblas_-1162085575,8.64569
GemmTunableOp_BFloat16_TN,tn_1024_2048_7168_ld_7168_7168_1024,Gemm_Rocblas_-1162085576,1.29801
GemmTunableOp_BFloat16_TN,tn_2048_4096_13312_ld_13312_13312_2048,Gemm_Rocblas_-1162085575,10.1136
GemmTunableOp_BFloat16_TN,tn_2048_7168_3072_ld_3072_3072_2048,Gemm_Rocblas_-1162085578,3.26571
GemmTunableOp_BFloat16_TN,tn_2048_4096_14336_ld_14336_14336_2048,Gemm_Rocblas_-1162085566,15.0625
GemmTunableOp_BFloat16_TN,tn_10240_6144_4096_ld_4096_4096_10240,Gemm_Rocblas_-1162085591,23.0431
GemmTunableOp_BFloat16_TN,tn_3072_4096_2048_ld_2048_2048_3072,Gemm_Rocblas_-1162085569,1.95308
GemmTunableOp_BFloat16_TN,tn_3072_7168_8192_ld_8192_8192_3072,Gemm_Rocblas_-1162085587,16.8925
GemmTunableOp_BFloat16_TN,tn_3072_4096_4096_ld_4096_4096_3072,Gemm_Rocblas_-1162085569,4.08819
GemmTunableOp_BFloat16_TN,tn_3072_4096_5120_ld_5120_5120_3072,Gemm_Rocblas_-1162085592,5.054
GemmTunableOp_BFloat16_TN,tn_11264_7168_14336_ld_14336_14336_11264,Gemm_Rocblas_-1162085575,117.386
GemmTunableOp_BFloat16_TN,tn_9216_5120_2048_ld_2048_2048_9216,Gemm_Hipblaslt_502,9.13684
GemmTunableOp_BFloat16_TN,tn_3072_9216_14336_ld_14336_14336_3072,Gemm_Rocblas_-1162085580,46.0065
GemmTunableOp_BFloat16_TN,tn_3072_4096_6144_ld_6144_6144_3072,Gemm_Rocblas_-1162085590,7.45485
GemmTunableOp_BFloat16_TN,tn_9216_4096_13312_ld_13312_13312_9216,Gemm_Rocblas_-1162085575,42.4013
GemmTunableOp_BFloat16_TN,tn_3072_4096_10240_ld_10240_10240_3072,Gemm_Rocblas_-1162085592,14.0086
GemmTunableOp_BFloat16_TN,tn_4096_4096_1024_ld_1024_1024_4096,Gemm_Rocblas_-1162085567,1.22321
GemmTunableOp_BFloat16_TN,tn_4096_4096_3072_ld_3072_3072_4096,Gemm_Rocblas_-1162085576,3.69629
GemmTunableOp_BFloat16_TN,tn_4096_4096_6144_ld_6144_6144_4096,Gemm_Rocblas_-1162085592,9.72915
GemmTunableOp_BFloat16_TN,tn_4096_4096_12288_ld_12288_12288_4096,Gemm_Rocblas_-1162085592,22.4042
GemmTunableOp_BFloat16_TN,tn_11264_4096_9216_ld_9216_9216_11264,Default,32.3343
GemmTunableOp_BFloat16_TN,tn_7168_5120_6144_ld_6144_6144_7168,Default,20.1749
GemmTunableOp_BFloat16_TN,tn_14336_3072_12288_ld_12288_12288_14336,Gemm_Rocblas_-1162085575,54.5702
GemmTunableOp_BFloat16_TN,tn_4096_4096_13312_ld_13312_13312_4096,Gemm_Rocblas_-1162085587,19.2766
GemmTunableOp_BFloat16_TN,tn_11264_4096_12288_ld_12288_12288_11264,Gemm_Rocblas_-1162085575,57.4005
GemmTunableOp_BFloat16_TN,tn_2048_1024_2048_ld_2048_2048_2048,Gemm_Rocblas_-1162085569,0.252723
GemmTunableOp_BFloat16_TN,tn_4096_4096_14336_ld_14336_14336_4096,Gemm_Rocblas_-1162085580,27.8005
GemmTunableOp_BFloat16_TN,tn_5120_4096_7168_ld_7168_7168_5120,Gemm_Rocblas_-1162085587,11.6546
GemmTunableOp_BFloat16_TN,tn_15360_4096_8192_ld_8192_8192_15360,Default,45.025
GemmTunableOp_BFloat16_TN,tn_6144_4096_4096_ld_4096_4096_6144,Gemm_Rocblas_-1162085590,9.54464
GemmTunableOp_BFloat16_TN,tn_4096_5120_4096_ld_4096_4096_4096,Gemm_Rocblas_-1162085591,9.3493
GemmTunableOp_BFloat16_TN,tn_5120_4096_8192_ld_8192_8192_5120,Gemm_Rocblas_-1162085588,15.7751
GemmTunableOp_BFloat16_TN,tn_5120_4096_9216_ld_9216_9216_5120,Gemm_Rocblas_-1162085587,14.8037
GemmTunableOp_BFloat16_TN,tn_2048_9216_5120_ld_5120_5120_2048,Gemm_Rocblas_-1162085580,7.2078
GemmTunableOp_BFloat16_TN,tn_6144_8192_12288_ld_12288_12288_6144,Gemm_Rocblas_-1162085575,63.6576
GemmTunableOp_BFloat16_TN,tn_5120_4096_13312_ld_13312_13312_5120,Gemm_Rocblas_-1162085580,23.95
GemmTunableOp_BFloat16_TN,tn_7168_1024_5120_ld_5120_5120_7168,Gemm_Rocblas_-1162085592,3.02075
GemmTunableOp_BFloat16_TN,tn_9216_3072_6144_ld_6144_6144_9216,Default,15.2738
GemmTunableOp_BFloat16_TN,tn_10240_4096_15360_ld_15360_15360_10240,Gemm_Rocblas_-1162085575,54.0533
GemmTunableOp_BFloat16_TN,tn_6144_4096_1024_ld_1024_1024_6144,Gemm_Rocblas_-1162085569,1.78411
GemmTunableOp_BFloat16_TN,tn_6144_4096_7168_ld_7168_7168_6144,Default,14.1413
GemmTunableOp_BFloat16_TN,tn_7168_2048_5120_ld_5120_5120_7168,Default,5.73223
GemmTunableOp_BFloat16_TN,tn_11264_4096_11264_ld_11264_11264_11264,Gemm_Rocblas_-1162085592,42.4498
GemmTunableOp_BFloat16_TN,tn_6144_4096_8192_ld_8192_8192_6144,Gemm_Rocblas_-1162085590,18.9699
GemmTunableOp_BFloat16_TN,tn_1024_8192_10240_ld_10240_10240_1024,Gemm_Rocblas_-1162085566,8.00757
GemmTunableOp_BFloat16_TN,tn_6144_4096_9216_ld_9216_9216_6144,Gemm_Rocblas_-1162085587,18.2868
GemmTunableOp_BFloat16_TN,tn_9216_4096_2048_ld_2048_2048_9216,Gemm_Hipblaslt_502,7.44197
GemmTunableOp_BFloat16_TN,tn_15360_4096_13312_ld_13312_13312_15360,Gemm_Rocblas_-1162085575,69.4661
GemmTunableOp_BFloat16_TN,tn_4096_5888_4096_ld_4096_4096_4096,Gemm_Rocblas_-1162085590,10.8681
GemmTunableOp_BFloat16_TN,tn_6144_4096_13312_ld_13312_13312_6144,Gemm_Rocblas_-1162085575,27.4825
GemmTunableOp_BFloat16_TN,tn_6144_4096_14336_ld_14336_14336_6144,Gemm_Rocblas_-1162085580,37.6738
GemmTunableOp_BFloat16_TN,tn_7168_4096_3072_ld_3072_3072_7168,Gemm_Rocblas_-1162085592,6.7329
GemmTunableOp_BFloat16_TN,tn_4096_5120_7168_ld_7168_7168_4096,Default,11.5728
GemmTunableOp_BFloat16_TN,tn_10240_2048_13312_ld_13312_13312_10240,Gemm_Rocblas_-1162085575,23.6052
GemmTunableOp_BFloat16_TN,tn_7168_4096_5120_ld_5120_5120_7168,Gemm_Rocblas_-1162085592,11.3731
GemmTunableOp_BFloat16_TN,tn_7168_4096_6144_ld_6144_6144_7168,Default,16.0956
GemmTunableOp_BFloat16_TN,tn_6144_7168_15360_ld_15360_15360_6144,Gemm_Rocblas_-1162085575,59.7184
GemmTunableOp_BFloat16_TN,tn_7168_4096_9216_ld_9216_9216_7168,Default,20.7886
GemmTunableOp_BFloat16_TN,tn_7168_4096_10240_ld_10240_10240_7168,Default,29.1194
GemmTunableOp_BFloat16_TN,tn_4096_1536_4096_ld_4096_4096_4096,Gemm_Rocblas_-1162085569,2.81108
GemmTunableOp_BFloat16_TN,tn_7168_4096_13312_ld_13312_13312_7168,Gemm_Rocblas_-1162085575,31.8178
GemmTunableOp_BFloat16_TN,tn_12288_5120_8192_ld_8192_8192_12288,Gemm_Rocblas_-1162085591,45.6976
GemmTunableOp_BFloat16_TN,tn_9216_3072_8192_ld_8192_8192_9216,Gemm_Rocblas_-1162085591,20.571
GemmTunableOp_BFloat16_TN,tn_8192_4096_3072_ld_3072_3072_8192,Gemm_Rocblas_-1162085590,7.85398
GemmTunableOp_BFloat16_TN,tn_11264_5120_1024_ld_1024_1024_11264,Gemm_Rocblas_-1162085569,4.07787
GemmTunableOp_BFloat16_TN,tn_7168_4096_15360_ld_15360_15360_7168,Gemm_Rocblas_-1162085575,39.0229
GemmTunableOp_BFloat16_TN,tn_14336_5120_13312_ld_13312_13312_14336,Gemm_Rocblas_-1162085580,80.3018
GemmTunableOp_BFloat16_TN,tn_13312_1024_1024_ld_1024_1024_13312,Gemm_Rocblas_-1162085569,1.04078
GemmTunableOp_BFloat16_TN,tn_8192_4096_1024_ld_1024_1024_8192,Gemm_Rocblas_-1162085569,2.42668
GemmTunableOp_BFloat16_TN,tn_3072_7168_5120_ld_5120_5120_3072,Gemm_Rocblas_-1162085592,8.71209
GemmTunableOp_BFloat16_TN,tn_8192_4096_2048_ld_2048_2048_8192,Gemm_Rocblas_-1162085569,6.02511
GemmTunableOp_BFloat16_TN,tn_15360_4096_12288_ld_12288_12288_15360,Gemm_Rocblas_-1162085575,77.4807
GemmTunableOp_BFloat16_TN,tn_8192_4096_6144_ld_6144_6144_8192,Default,18.7586
GemmTunableOp_BFloat16_TN,tn_10240_4096_8192_ld_8192_8192_10240,Gemm_Rocblas_-1162085591,30.6962
GemmTunableOp_BFloat16_TN,tn_8192_4096_7168_ld_7168_7168_8192,Default,18.0137
GemmTunableOp_BFloat16_TN,tn_1024_9216_8192_ld_8192_8192_1024,Gemm_Rocblas_-1162085567,6.64513
GemmTunableOp_BFloat16_TN,tn_8192_4096_8192_ld_8192_8192_8192,Gemm_Rocblas_-1162085584,25.691
GemmTunableOp_BFloat16_TN,tn_14336_8192_14336_ld_14336_14336_14336,Gemm_Rocblas_-1162085575,166.952
GemmTunableOp_BFloat16_TN,tn_13312_5120_2048_ld_2048_2048_13312,Gemm_Hipblaslt_502,12.9688
GemmTunableOp_BFloat16_TN,tn_15360_4096_3072_ld_3072_3072_15360,Gemm_Rocblas_-1162085590,14.1733
GemmTunableOp_BFloat16_TN,tn_7168_7168_11264_ld_11264_11264_7168,Gemm_Rocblas_-1162085575,47.4678
GemmTunableOp_BFloat16_TN,tn_4096_16896_4096_ld_4096_4096_4096,Gemm_Rocblas_-1162085591,26.8346
GemmTunableOp_BFloat16_TN,tn_8192_4096_10240_ld_10240_10240_8192,Default,32.5697
GemmTunableOp_BFloat16_TN,tn_8192_4096_11264_ld_11264_11264_8192,Default,31.4322
GemmTunableOp_BFloat16_TN,tn_5120_9216_13312_ld_13312_13312_5120,Gemm_Rocblas_-1162085575,52.0358
GemmTunableOp_BFloat16_TN,tn_3072_8192_11264_ld_11264_11264_3072,Default,23.8322
GemmTunableOp_BFloat16_TN,tn_1024_2048_8192_ld_8192_8192_1024,Gemm_Rocblas_-1162085568,1.60719
GemmTunableOp_BFloat16_TN,tn_8192_4096_13312_ld_13312_13312_8192,Gemm_Rocblas_-1162085575,37.357
GemmTunableOp_BFloat16_TN,tn_9216_4096_1024_ld_1024_1024_9216,Gemm_Rocblas_-1162085569,2.70867
GemmTunableOp_BFloat16_TN,tn_11264_4096_7168_ld_7168_7168_11264,Gemm_Rocblas_-1162085587,24.1268
GemmTunableOp_BFloat16_TN,tn_6144_7168_3072_ld_3072_3072_6144,Gemm_Rocblas_-1162085592,10.2618
GemmTunableOp_BFloat16_TN,tn_6144_6144_13312_ld_13312_13312_6144,Gemm_Rocblas_-1162085575,42.61
GemmTunableOp_BFloat16_TN,tn_4096_1024_5120_ld_5120_5120_4096,Gemm_Rocblas_-1162085591,1.69883
GemmTunableOp_BFloat16_TN,tn_9216_4096_3072_ld_3072_3072_9216,Gemm_Rocblas_-1162085592,8.63958
GemmTunableOp_BFloat16_TN,tn_2048_8192_2048_ld_2048_2048_2048,Gemm_Rocblas_-1162085569,2.61049
GemmTunableOp_BFloat16_TN,tn_9216_4096_6144_ld_6144_6144_9216,Gemm_Rocblas_-1162085592,20.1605
GemmTunableOp_BFloat16_TN,tn_6144_8192_2048_ld_2048_2048_6144,Gemm_Rocblas_-1162085569,7.38804
GemmTunableOp_BFloat16_TN,tn_11264_6144_14336_ld_14336_14336_11264,Gemm_Rocblas_-1162085581,103.228
GemmTunableOp_BFloat16_TN,tn_9216_2048_2048_ld_2048_2048_9216,Gemm_Hipblaslt_502,3.67118
GemmTunableOp_BFloat16_TN,tn_9216_4096_7168_ld_7168_7168_9216,Default,20.3931
GemmTunableOp_BFloat16_TN,tn_3072_2048_6144_ld_6144_6144_3072,Gemm_Rocblas_-1162085592,3.864
GemmTunableOp_BFloat16_TN,tn_9216_4096_8192_ld_8192_8192_9216,Gemm_Rocblas_-1162085584,27.3703
GemmTunableOp_BFloat16_TN,tn_7168_4096_14336_ld_14336_14336_7168,Gemm_Rocblas_-1162085575,45.3598
GemmTunableOp_BFloat16_TN,tn_9216_4096_9216_ld_9216_9216_9216,Gemm_Rocblas_-1162085587,26.9469
GemmTunableOp_BFloat16_TN,tn_15360_7168_2048_ld_2048_2048_15360,Gemm_Rocblas_-1162085587,21.0968
GemmTunableOp_BFloat16_TN,tn_9216_4096_10240_ld_10240_10240_9216,Default,35.4661
GemmTunableOp_BFloat16_TN,tn_1024_9216_6144_ld_6144_6144_1024,Gemm_Rocblas_-1162085562,5.30588
GemmTunableOp_BFloat16_TN,tn_9216_5120_6144_ld_6144_6144_9216,Gemm_Rocblas_-1162085592,25.5481
GemmTunableOp_BFloat16_TN,tn_9216_4096_12288_ld_12288_12288_9216,Gemm_Rocblas_-1162085575,47.2088
GemmTunableOp_BFloat16_TN,tn_9216_4096_14336_ld_14336_14336_9216,Gemm_Rocblas_-1162085581,58.4273
GemmTunableOp_BFloat16_TN,tn_10240_4096_3072_ld_3072_3072_10240,Gemm_Rocblas_-1162085592,9.64112
GemmTunableOp_BFloat16_TN,tn_13312_1024_10240_ld_10240_10240_13312,Gemm_Rocblas_-1162085587,13.0913
GemmTunableOp_BFloat16_TN,tn_10240_4096_4096_ld_4096_4096_10240,Gemm_Rocblas_-1162085591,15.1672
GemmTunableOp_BFloat16_TN,tn_14336_1024_12288_ld_12288_12288_14336,Gemm_Rocblas_-1162085581,19.2781
GemmTunableOp_BFloat16_TN,tn_10240_4096_5120_ld_5120_5120_10240,Default,15.9924
GemmTunableOp_BFloat16_TN,tn_13312_8192_2048_ld_2048_2048_13312,Gemm_Rocblas_-1162085584,20.7325
GemmTunableOp_BFloat16_TN,tn_4096_9728_4096_ld_4096_4096_4096,Gemm_Rocblas_-1162085590,18.236
GemmTunableOp_BFloat16_TN,tn_10240_2048_8192_ld_8192_8192_10240,Gemm_Rocblas_-1162085591,15.4811
GemmTunableOp_BFloat16_TN,tn_11264_4096_2048_ld_2048_2048_11264,Gemm_Hipblaslt_502,8.95133
GemmTunableOp_BFloat16_TN,tn_14336_1024_7168_ld_7168_7168_14336,Gemm_Rocblas_-1162085592,8.35868
GemmTunableOp_BFloat16_TN,tn_11264_4096_4096_ld_4096_4096_11264,Gemm_Rocblas_-1162085590,16.4668
GemmTunableOp_BFloat16_TN,tn_11264_4096_6144_ld_6144_6144_11264,Default,24.2331
GemmTunableOp_BFloat16_TN,tn_5120_5120_13312_ld_13312_13312_5120,Default,29.6734
GemmTunableOp_BFloat16_TN,tn_11264_4096_15360_ld_15360_15360_11264,Gemm_Rocblas_-1162085580,60.8591
GemmTunableOp_BFloat16_TN,tn_12288_4096_2048_ld_2048_2048_12288,Gemm_Hipblaslt_503,9.87176
GemmTunableOp_BFloat16_TN,tn_3072_8192_8192_ld_8192_8192_3072,Gemm_Rocblas_-1162085585,19.2301
GemmTunableOp_BFloat16_TN,tn_6144_3072_6144_ld_6144_6144_6144,Default,10.867
GemmTunableOp_BFloat16_TN,tn_12288_4096_3072_ld_3072_3072_12288,Gemm_Rocblas_-1162085592,11.5802
GemmTunableOp_BFloat16_TN,tn_12288_4096_5120_ld_5120_5120_12288,Gemm_Rocblas_-1162085587,19.228
GemmTunableOp_BFloat16_TN,tn_6144_8192_8192_ld_8192_8192_6144,Gemm_Rocblas_-1162085584,37.534
GemmTunableOp_BFloat16_TN,tn_4096_19456_4096_ld_4096_4096_4096,Gemm_Rocblas_-1162085591,30.4638
GemmTunableOp_BFloat16_TN,tn_5120_5120_9216_ld_9216_9216_5120,Default,18.2422
GemmTunableOp_BFloat16_TN,tn_12288_4096_6144_ld_6144_6144_12288,Gemm_Rocblas_-1162085592,27.5158
GemmTunableOp_BFloat16_TN,tn_12288_4096_14336_ld_14336_14336_12288,Gemm_Rocblas_-1162085580,74.7411
GemmTunableOp_BFloat16_TN,tn_10240_7168_11264_ld_11264_11264_10240,Default,66.5736
GemmTunableOp_BFloat16_TN,tn_12288_3072_6144_ld_6144_6144_12288,Gemm_Rocblas_-1162085592,20.7221
GemmTunableOp_BFloat16_TN,tn_13312_4096_1024_ld_1024_1024_13312,Gemm_Rocblas_-1162085567,3.93539
GemmTunableOp_BFloat16_TN,tn_13312_4096_3072_ld_3072_3072_13312,Gemm_Rocblas_-1162085588,12.3113
GemmTunableOp_BFloat16_TN,tn_7168_7168_9216_ld_9216_9216_7168,Default,36.1736
GemmTunableOp_BFloat16_TN,tn_3072_5120_13312_ld_13312_13312_3072,Default,18.0945
GemmTunableOp_BFloat16_TN,tn_11264_2048_1024_ld_1024_1024_11264,Gemm_Rocblas_-1162085569,1.69065
GemmTunableOp_BFloat16_TN,tn_8192_5120_10240_ld_10240_10240_8192,Default,40.5019
GemmTunableOp_BFloat16_TN,tn_13312_4096_4096_ld_4096_4096_13312,Gemm_Rocblas_-1162085591,19.5409
GemmTunableOp_BFloat16_TN,tn_13312_4096_5120_ld_5120_5120_13312,Default,20.7335
GemmTunableOp_BFloat16_TN,tn_13312_4096_9216_ld_9216_9216_13312,Default,38.8663
GemmTunableOp_BFloat16_TN,tn_13312_4096_14336_ld_14336_14336_13312,Gemm_Rocblas_-1162085581,81.8672
GemmTunableOp_BFloat16_TN,tn_13312_4096_15360_ld_15360_15360_13312,Gemm_Rocblas_-1162085580,73.2085
GemmTunableOp_BFloat16_TN,tn_14336_4096_4096_ld_4096_4096_14336,Gemm_Rocblas_-1162085590,20.9378
GemmTunableOp_BFloat16_TN,tn_5120_9216_3072_ld_3072_3072_5120,Gemm_Rocblas_-1162085578,10.7825
GemmTunableOp_BFloat16_TN,tn_8192_3072_7168_ld_7168_7168_8192,Gemm_Rocblas_-1162085590,13.8186
GemmTunableOp_BFloat16_TN,tn_14336_4096_6144_ld_6144_6144_14336,Default,30.9826
GemmTunableOp_BFloat16_TN,tn_12288_6144_3072_ld_3072_3072_12288,Gemm_Rocblas_-1162085592,17.2743
GemmTunableOp_BFloat16_TN,tn_14336_4096_9216_ld_9216_9216_14336,Default,42.1916
GemmTunableOp_BFloat16_TN,tn_5120_4096_12288_ld_12288_12288_5120,Gemm_Rocblas_-1162085575,27.9089
GemmTunableOp_BFloat16_TN,tn_14336_4096_11264_ld_11264_11264_14336,Gemm_Rocblas_-1162085592,53.7284
GemmTunableOp_BFloat16_TN,tn_14336_4096_12288_ld_12288_12288_14336,Gemm_Rocblas_-1162085581,72.9652
GemmTunableOp_BFloat16_TN,tn_13312_6144_2048_ld_2048_2048_13312,Gemm_Hipblaslt_502,15.4155
GemmTunableOp_BFloat16_TN,tn_7168_3072_4096_ld_4096_4096_7168,Gemm_Rocblas_-1162085590,8.12495
GemmTunableOp_BFloat16_TN,tn_14336_4096_15360_ld_15360_15360_14336,Gemm_Rocblas_-1162085575,76.1527
GemmTunableOp_BFloat16_TN,tn_4096_5120_13312_ld_13312_13312_4096,Gemm_Rocblas_-1162085587,24.4999
GemmTunableOp_BFloat16_TN,tn_15360_4096_9216_ld_9216_9216_15360,Default,44.115
GemmTunableOp_BFloat16_TN,tn_15360_4096_10240_ld_10240_10240_15360,Default,58.8831
GemmTunableOp_BFloat16_TN,tn_15360_4096_15360_ld_15360_15360_15360,Default,85.1057
GemmTunableOp_BFloat16_TN,tn_1024_5120_3072_ld_3072_3072_1024,Gemm_Rocblas_-1162085570,1.10172
GemmTunableOp_BFloat16_TN,tn_1024_5120_5120_ld_5120_5120_1024,Gemm_Rocblas_-1162085578,1.98326
GemmTunableOp_BFloat16_TN,tn_2048_6144_5120_ld_5120_5120_2048,Gemm_Rocblas_-1162085578,4.79245
GemmTunableOp_BFloat16_TN,tn_4096_11008_4096_ld_4096_4096_4096,Gemm_Rocblas_-1162085590,20.2318
GemmTunableOp_BFloat16_TN,tn_4096_4096_7168_ld_7168_7168_4096,Gemm_Rocblas_-1162085592,9.1191
GemmTunableOp_BFloat16_TN,tn_4096_5120_5120_ld_5120_5120_4096,Gemm_Rocblas_-1162085592,8.09434
GemmTunableOp_BFloat16_TN,tn_1024_5120_6144_ld_6144_6144_1024,Gemm_Rocblas_-1162085570,2.87572
GemmTunableOp_BFloat16_TN,tn_5120_6144_10240_ld_10240_10240_5120,Default,30.7174
GemmTunableOp_BFloat16_TN,tn_1024_5120_7168_ld_7168_7168_1024,Gemm_Rocblas_-1162085580,2.83815
GemmTunableOp_BFloat16_TN,tn_15360_8192_12288_ld_12288_12288_15360,Gemm_Rocblas_-1162085575,151.904
GemmTunableOp_BFloat16_TN,tn_1024_5120_10240_ld_10240_10240_1024,Gemm_Rocblas_-1162085566,5.15367
GemmTunableOp_BFloat16_TN,tn_1024_5120_15360_ld_15360_15360_1024,Gemm_Rocblas_-1162085566,7.57045
GemmTunableOp_BFloat16_TN,tn_6144_6144_12288_ld_12288_12288_6144,Gemm_Rocblas_-1162085575,47.7801
GemmTunableOp_BFloat16_TN,tn_2048_5120_2048_ld_2048_2048_2048,Gemm_Rocblas_-1162085567,1.61662
GemmTunableOp_BFloat16_TN,tn_2048_5120_3072_ld_3072_3072_2048,Gemm_Rocblas_-1162085576,2.40576
GemmTunableOp_BFloat16_TN,tn_9216_7168_8192_ld_8192_8192_9216,Default,47.659
GemmTunableOp_BFloat16_TN,tn_2048_5120_5120_ld_5120_5120_2048,Gemm_Rocblas_-1162085580,4.06125
GemmTunableOp_BFloat16_TN,tn_2048_5120_7168_ld_7168_7168_2048,Gemm_Rocblas_-1162085566,6.12646
GemmTunableOp_BFloat16_TN,tn_5120_5120_6144_ld_6144_6144_5120,Gemm_Rocblas_-1162085588,14.6984
GemmTunableOp_BFloat16_TN,tn_2048_5120_13312_ld_13312_13312_2048,Gemm_Rocblas_-1162085566,12.7032
GemmTunableOp_BFloat16_TN,tn_5120_8192_3072_ld_3072_3072_5120,Default,9.66781
GemmTunableOp_BFloat16_TN,tn_2048_5120_14336_ld_14336_14336_2048,Gemm_Rocblas_-1162085581,18.3907
GemmTunableOp_BFloat16_TN,tn_5120_7168_14336_ld_14336_14336_5120,Gemm_Rocblas_-1162085580,57.6785
GemmTunableOp_BFloat16_TN,tn_3072_5120_1024_ld_1024_1024_3072,Gemm_Rocblas_-1162085567,1.14606
GemmTunableOp_BFloat16_TN,tn_9216_5120_9216_ld_9216_9216_9216,Default,32.023
GemmTunableOp_BFloat16_TN,tn_3072_5120_3072_ld_3072_3072_3072,Default,3.28329
GemmTunableOp_BFloat16_TN,tn_3072_5120_4096_ld_4096_4096_3072,Gemm_Rocblas_-1162085569,5.03932
GemmTunableOp_BFloat16_TN,tn_2048_2048_15360_ld_15360_15360_2048,Gemm_Rocblas_-1162085575,6.44688
GemmTunableOp_BFloat16_TN,tn_13312_4096_6144_ld_6144_6144_13312,Gemm_Rocblas_-1162085590,29.5711
GemmTunableOp_BFloat16_TN,tn_3072_5120_8192_ld_8192_8192_3072,Gemm_Rocblas_-1162085582,12.2934
GemmTunableOp_BFloat16_TN,tn_3072_5120_12288_ld_12288_12288_3072,Gemm_Rocblas_-1162085575,21.1033
GemmTunableOp_BFloat16_TN,tn_4096_7168_12288_ld_12288_12288_4096,Gemm_Rocblas_-1162085575,39.0501
GemmTunableOp_BFloat16_TN,tn_7168_2048_9216_ld_9216_9216_7168,Gemm_Rocblas_-1162085574,11.1765
GemmTunableOp_BFloat16_TN,tn_14336_2048_2048_ld_2048_2048_14336,Gemm_Hipblaslt_502,5.71124
GemmTunableOp_BFloat16_TN,tn_3072_5120_14336_ld_14336_14336_3072,Gemm_Rocblas_-1162085571,27.0886
GemmTunableOp_BFloat16_TN,tn_3072_5120_15360_ld_15360_15360_3072,Default,21.3616
GemmTunableOp_BFloat16_TN,tn_3072_7168_14336_ld_14336_14336_3072,Gemm_Rocblas_-1162085581,36.1253
GemmTunableOp_BFloat16_TN,tn_4096_5120_1024_ld_1024_1024_4096,Gemm_Rocblas_-1162085569,1.53593
GemmTunableOp_BFloat16_TN,tn_12288_3072_2048_ld_2048_2048_12288,Gemm_Hipblaslt_502,7.20977
GemmTunableOp_BFloat16_TN,tn_13312_2048_3072_ld_3072_3072_13312,Gemm_Rocblas_-1162085592,6.16129
GemmTunableOp_BFloat16_TN,tn_4096_5120_3072_ld_3072_3072_4096,Gemm_Rocblas_-1162085578,4.5742
GemmTunableOp_BFloat16_TN,tn_2048_7168_12288_ld_12288_12288_2048,Gemm_Rocblas_-1162085575,21.1079
GemmTunableOp_BFloat16_TN,tn_1024_2048_4096_ld_4096_4096_1024,Gemm_Rocblas_-1162085578,0.645675
GemmTunableOp_BFloat16_TN,tn_4096_5120_6144_ld_6144_6144_4096,Gemm_Rocblas_-1162085592,11.7667
GemmTunableOp_BFloat16_TN,tn_4096_5120_8192_ld_8192_8192_4096,Gemm_Rocblas_-1162085588,16.152
GemmTunableOp_BFloat16_TN,tn_14336_5120_6144_ld_6144_6144_14336,Gemm_Rocblas_-1162085592,39.6118
GemmTunableOp_BFloat16_TN,tn_4096_5120_9216_ld_9216_9216_4096,Default,15.0967
GemmTunableOp_BFloat16_TN,tn_4096_14848_4096_ld_4096_4096_4096,Gemm_Rocblas_-1162085590,23.5473
GemmTunableOp_BFloat16_TN,tn_4096_5120_11264_ld_11264_11264_4096,Gemm_Rocblas_-1162085580,19.5283
GemmTunableOp_BFloat16_TN,tn_6144_5120_4096_ld_4096_4096_6144,Gemm_Rocblas_-1162085591,11.9157
GemmTunableOp_BFloat16_TN,tn_4096_5120_12288_ld_12288_12288_4096,Gemm_Rocblas_-1162085575,27.3191
GemmTunableOp_BFloat16_TN,tn_5120_5120_1024_ld_1024_1024_5120,Gemm_Rocblas_-1162085579,1.86948
GemmTunableOp_BFloat16_TN,tn_6144_7168_6144_ld_6144_6144_6144,Gemm_Rocblas_-1162085592,24.4435
GemmTunableOp_BFloat16_TN,tn_12288_2048_8192_ld_8192_8192_12288,Gemm_Rocblas_-1162085588,18.5393
GemmTunableOp_BFloat16_TN,tn_8192_2048_13312_ld_13312_13312_8192,Gemm_Rocblas_-1162085580,18.7931
GemmTunableOp_BFloat16_TN,tn_2048_5120_12288_ld_12288_12288_2048,Gemm_Rocblas_-1162085591,15.1841
GemmTunableOp_BFloat16_TN,tn_5120_5120_2048_ld_2048_2048_5120,Gemm_Rocblas_-1162085569,3.73745
GemmTunableOp_BFloat16_TN,tn_5120_5120_4096_ld_4096_4096_5120,Gemm_Rocblas_-1162085591,9.8494
GemmTunableOp_BFloat16_TN,tn_5120_5120_5120_ld_5120_5120_5120,Gemm_Rocblas_-1162085587,9.84301
GemmTunableOp_BFloat16_TN,tn_14336_2048_8192_ld_8192_8192_14336,Gemm_Rocblas_-1162085589,21.2988
GemmTunableOp_BFloat16_TN,tn_3072_4096_1024_ld_1024_1024_3072,Gemm_Rocblas_-1162085576,0.880252
GemmTunableOp_BFloat16_TN,tn_5120_5120_7168_ld_7168_7168_5120,Gemm_Rocblas_-1162085592,13.9563
GemmTunableOp_BFloat16_TN,tn_5120_5120_11264_ld_11264_11264_5120,Gemm_Rocblas_-1162085587,24.6866
GemmTunableOp_BFloat16_TN,tn_6144_5120_12288_ld_12288_12288_6144,Gemm_Rocblas_-1162085575,39.6086
GemmTunableOp_BFloat16_TN,tn_5120_5120_12288_ld_12288_12288_5120,Gemm_Rocblas_-1162085592,33.4479
GemmTunableOp_BFloat16_TN,tn_12288_1024_7168_ld_7168_7168_12288,Gemm_Rocblas_-1162085587,7.07849
GemmTunableOp_BFloat16_TN,tn_6144_5120_1024_ld_1024_1024_6144,Gemm_Rocblas_-1162085569,2.27952
GemmTunableOp_BFloat16_TN,tn_6144_5120_2048_ld_2048_2048_6144,Gemm_Rocblas_-1162085569,4.60135
GemmTunableOp_BFloat16_TN,tn_7168_9216_5120_ld_5120_5120_7168,Default,25.1063
GemmTunableOp_BFloat16_TN,tn_13312_6144_8192_ld_8192_8192_13312,Gemm_Rocblas_-1162085585,58.0272
GemmTunableOp_BFloat16_TN,tn_6144_2048_2048_ld_2048_2048_6144,Gemm_Rocblas_-1162085569,1.8899
GemmTunableOp_BFloat16_TN,tn_6144_5120_3072_ld_3072_3072_6144,Gemm_Rocblas_-1162085592,7.40016
GemmTunableOp_BFloat16_TN,tn_15360_8192_11264_ld_11264_11264_15360,Gemm_Rocblas_-1162085575,114.867
GemmTunableOp_BFloat16_TN,tn_12288_5120_12288_ld_12288_12288_12288,Gemm_Rocblas_-1162085575,76.4838
GemmTunableOp_BFloat16_TN,tn_4096_17920_4096_ld_4096_4096_4096,Gemm_Rocblas_-1162085590,28.4882
GemmTunableOp_BFloat16_TN,tn_6144_5120_8192_ld_8192_8192_6144,Gemm_Rocblas_-1162085590,22.6755
GemmTunableOp_BFloat16_TN,tn_11264_8192_2048_ld_2048_2048_11264,Gemm_Hipblaslt_502,17.4542
GemmTunableOp_BFloat16_TN,tn_6144_5120_11264_ld_11264_11264_6144,Gemm_Rocblas_-1162085587,28.8678
GemmTunableOp_BFloat16_TN,tn_11264_3072_8192_ld_8192_8192_11264,Gemm_Rocblas_-1162085585,24.9624
GemmTunableOp_BFloat16_TN,tn_6144_5120_13312_ld_13312_13312_6144,Gemm_Rocblas_-1162085575,35.9207
GemmTunableOp_BFloat16_TN,tn_6144_5120_14336_ld_14336_14336_6144,Gemm_Rocblas_-1162085581,48.9976
GemmTunableOp_BFloat16_TN,tn_8192_9216_4096_ld_4096_4096_8192,Gemm_Rocblas_-1162085591,27.5977
GemmTunableOp_BFloat16_TN,tn_2048_1024_3072_ld_3072_3072_2048,Gemm_Rocblas_-1162085588,0.385295
GemmTunableOp_BFloat16_TN,tn_3072_3072_5120_ld_5120_5120_3072,Gemm_Rocblas_-1162085592,3.78153
GemmTunableOp_BFloat16_TN,tn_6144_5120_15360_ld_15360_15360_6144,Gemm_Rocblas_-1162085575,42.2598
GemmTunableOp_BFloat16_TN,tn_11264_2048_12288_ld_12288_12288_11264,Gemm_Rocblas_-1162085592,28.4776
GemmTunableOp_BFloat16_TN,tn_7168_5120_1024_ld_1024_1024_7168,Gemm_Rocblas_-1162085567,2.63829
GemmTunableOp_BFloat16_TN,tn_9216_6144_15360_ld_15360_15360_9216,Gemm_Rocblas_-1162085580,73.3809
GemmTunableOp_BFloat16_TN,tn_8192_6144_2048_ld_2048_2048_8192,Gemm_Rocblas_-1162085569,8.90219
GemmTunableOp_BFloat16_TN,tn_7168_5120_3072_ld_3072_3072_7168,Gemm_Rocblas_-1162085590,8.45632
GemmTunableOp_BFloat16_TN,tn_15360_7168_13312_ld_13312_13312_15360,Gemm_Rocblas_-1162085575,120.045
GemmTunableOp_BFloat16_TN,tn_10240_2048_1024_ld_1024_1024_10240,Gemm_Rocblas_-1162085569,1.53876
GemmTunableOp_BFloat16_TN,tn_7168_5120_10240_ld_10240_10240_7168,Default,35.5548
GemmTunableOp_BFloat16_TN,tn_7168_5120_11264_ld_11264_11264_7168,Gemm_Rocblas_-1162085592,33.5085
GemmTunableOp_BFloat16_TN,tn_11264_5120_11264_ld_11264_11264_11264,Default,51.8964
GemmTunableOp_BFloat16_TN,tn_7168_5120_14336_ld_14336_14336_7168,Gemm_Rocblas_-1162085580,56.6242
GemmTunableOp_BFloat16_TN,tn_7168_5120_15360_ld_15360_15360_7168,Gemm_Rocblas_-1162085575,48.5297
GemmTunableOp_BFloat16_TN,tn_8192_5120_2048_ld_2048_2048_8192,Gemm_Rocblas_-1162085569,7.49928
GemmTunableOp_BFloat16_TN,tn_8192_5120_5120_ld_5120_5120_8192,Default,15.9872
GemmTunableOp_BFloat16_TN,tn_8192_5120_6144_ld_6144_6144_8192,Gemm_Rocblas_-1162085592,23.4931
GemmTunableOp_BFloat16_TN,tn_13312_8192_15360_ld_15360_15360_13312,Gemm_Rocblas_-1162085575,140.617
GemmTunableOp_BFloat16_TN,tn_15360_4096_2048_ld_2048_2048_15360,Gemm_Rocblas_-1162085587,12.0783
GemmTunableOp_BFloat16_TN,tn_8192_5120_7168_ld_7168_7168_8192,Default,23.0668
GemmTunableOp_BFloat16_TN,tn_11264_3072_10240_ld_10240_10240_11264,Default,33.3277
GemmTunableOp_BFloat16_TN,tn_8192_5120_8192_ld_8192_8192_8192,Gemm_Rocblas_-1162085591,30.7818
GemmTunableOp_BFloat16_TN,tn_6144_6144_1024_ld_1024_1024_6144,Gemm_Rocblas_-1162085569,2.71381
GemmTunableOp_BFloat16_TN,tn_9216_5120_3072_ld_3072_3072_9216,Gemm_Rocblas_-1162085588,10.7322
GemmTunableOp_BFloat16_TN,tn_2048_5120_4096_ld_4096_4096_2048,Gemm_Rocblas_-1162085569,3.52344
GemmTunableOp_BFloat16_TN,tn_2048_5120_11264_ld_11264_11264_2048,Gemm_Rocblas_-1162085592,10.5953
GemmTunableOp_BFloat16_TN,tn_9216_5120_4096_ld_4096_4096_9216,Gemm_Rocblas_-1162085592,17.1106
GemmTunableOp_BFloat16_TN,tn_9216_5120_5120_ld_5120_5120_9216,Default,17.7848
GemmTunableOp_BFloat16_TN,tn_9216_5120_8192_ld_8192_8192_9216,Gemm_Rocblas_-1162085591,33.694
GemmTunableOp_BFloat16_TN,tn_14336_7168_12288_ld_12288_12288_14336,Gemm_Rocblas_-1162085575,125.295
GemmTunableOp_BFloat16_TN,tn_11264_1024_3072_ld_3072_3072_11264,Gemm_Rocblas_-1162085592,2.6143
GemmTunableOp_BFloat16_TN,tn_9216_5120_10240_ld_10240_10240_9216,Gemm_Rocblas_-1162085592,44.7031
GemmTunableOp_BFloat16_TN,tn_8192_6144_12288_ld_12288_12288_8192,Gemm_Rocblas_-1162085587,62.5334
GemmTunableOp_BFloat16_TN,tn_3072_3072_9216_ld_9216_9216_3072,Gemm_Rocblas_-1162085575,7.41685
GemmTunableOp_BFloat16_TN,tn_9216_5120_11264_ld_11264_11264_9216,Default,43.2532
GemmTunableOp_BFloat16_TN,tn_7168_7168_7168_ld_7168_7168_7168,Default,27.6795
GemmTunableOp_BFloat16_TN,tn_9216_5120_13312_ld_13312_13312_9216,Gemm_Rocblas_-1162085575,50.9495
